date,content,score
1615557488,I think there's some money laundering going on in the NFTs space like how art pieces have been IMO but oh well.. what do to. Not filthy rich to get first hand experience yet..,1
1615241031,"XDB may refer to: == Software == xBase (xDB) - a family of database management systems and related programming languages Xbase (formerly known as XDB) - a software library from the xBase family XDB Enterprise Server - a historical product from the xBase family Oracle XML DB - an Oracle Database feature EMC Documentum xDB - a native XML database == Other == Gare de Lille Europe (XDB IATA code) - a railway station and an international airport in Lille, France. More details here: https://en.wikipedia.org/wiki/XDB  *This comment was left automatically (by a bot). If something's wrong, please, report it in [my subreddit](https://www.reddit.com/r/wikipedia_answer_bot).* *Really hope this was useful and relevant :D* *If I don't get this right, don't get mad at me, I'm still learning!*",2
1615557248,I believe it's going to 75k in either April or May,1
1615361747,"Hello I'm danish too, and i've been using both Coinbase and Binance. But I prefer Binance since they have more coins to invest in. The only problem i've had with Binance is that one time their servers crapoed itself, and showed my wallet balance as 0. And i nearly had a heartattack. But I was fixed by itself a couple hours later. The best way to transfer is to use a SEPA transfer, since you don't have to pay any fees with that.  Also every crypto transaction is taxed, including staking and airdrops.  Held og lykke ven",2
1615557180,You can try Wirex App to start buying then send to Binance so you can see the order book and set TP at the specific price because crypto is 24/7 and big things might happen when you're asleep.,1
1615520300,"Bear markets are for shorting, but we're still far from the bear market IMO. The last Bull run started from 2015 (about 1 year before the halving) all the way to the end of 2017 (1 year after the halving). This halving just started mid of last year in 2020. We should have at least until July + a few months of FOMO until Sept. Use Google Trends and search Bitcoin. We're only halfway the search compared to 2017.",2
1615327648,"did you start buying crypto for the tech or for the monetary gain? i have ADA, great project. love it. tech is great. amazing stuff. fully support it. dumping it next month on the dip, buying back in to increase my shares then dumping it at the start of the bear market. will probably covert the fiat USDC then hodl if for a few months for the interest. i originally bought in for the monetary gain. i don't care how super awesome a coin is. i cannot lose sight of why i bought in.",1
1615383712,Mix it up. Then It'll be easier to hold,1
1615556972,I think the Ideas page at TradingView have great TA,2
1615584972,I'm balls deep into tezos. I think it has great prospects. Same for stellar but price is pretty solid if you are looking for quick gains. You won't see many -+10%,1
1615477882,VGX,2
1615520965,$EYE Beholder has good potential from what I read so far in the threads.,2
1615550723,"Yea, I got my eyes on a rebasing token that offers more than what's obtainable in the market atm. It has gotten into a handful of chains to clamp down transaction fees used on eth, currently featuring high rewards for Liquidity Providers on two fronts (Uniswap and Balancer), and the most exciting, it's about to list its marketplace to accommodate tons of projects on the block. its [MARK](https://benchmarkprotocol.finance) token and its non-rebasing peg xMARK",2
1615583959,GRT is low cap and dipping heavy rn. Tied to ETH,2
1615486350,"I have an account, no issues for me.",1
1615519586,Kraken shaved 60% off me for hitting a loss of 20% on 3x leverage.. argh! Should have sticked to spot.,1
1615511324,[removed],0
1615488078,"Your post has been removed because discord links, referral links, and referral codes are not allowed.  If you believe this was an error, please send us a link to this post through modmail.  Do not edit or delete the post *I am a bot, and this action was performed automatically. Please [contact the moderators of this subreddit](/message/compose/?to=/r/CryptoMarkets) if you have any questions or concerns.*",1
1615492869,"Ppi tomm.  We shall see whither standeth on did input inflation.  Shall beest big f'r all currencies *** ^(I am a bot and I swapp'd some of thy words with Shakespeare words.) Commands: `!ShakespeareInsult`, `!fordo`, `!optout`",1
1615511153,[removed],2
1615515839,[removed],2
1615501720,[removed],1
1615556862,"I think the wall will be there for awhile as the price is quite on the overbought range, so most likely it will range until the end of Mar before the wall breaks through.",1
1615503344,"Your post has been removed because discord links, referral links, and referral codes are not allowed.  If you believe this was an error, please send us a link to this post through modmail.  Do not edit or delete the post *I am a bot, and this action was performed automatically. Please [contact the moderators of this subreddit](/message/compose/?to=/r/CryptoMarkets) if you have any questions or concerns.*",1
1615556751,What is pi?,1
1615535745,"Using pi anon.  I'll giveth thee 1 pi, useth mine own invitation code: gundomertcan *** ^(I am a bot and I swapp'd some of thy words with Shakespeare words.) Commands: `!ShakespeareInsult`, `!fordo`, `!optout`",0
1615553707,[removed],1
1615556710,Upwards!,1
1615751297,Pretty sure scam but hey I ll buy a little,1
1615567854,[removed],-4
1615643183,"So everything I've heard and read has BTC at 200K year end and ETH at 10K. So the math says ETH. ETH also has utility... &#x200B; I'm KARMA whoring...  There I said it.  So I'm late to the party for Reddit and have almost no Karma.  To post in most groups you need Karma now to keep spammers out (I totally get it).  To get Karma you need to post... see the problem here?  I can post here however, if you find anything I post to be even slightly relevant please mod up.",6
1615598720,[removed],-1
1616556076,Why do you think so?,1
1615645322,[removed],-4
1615659053,[removed],-1
1615667608,[removed],0
1615665652,[removed],-4
1615669368,[removed],-2
1615685678,[removed],1
1615691536,"yup, went down to .78 and I bought",2
1615723960,"I’m not sure how far it will run or if it’s recent boom is just because of its listing on Coinbase, I’m watching it for any signs but not fomo in just yet",2
1615711181,[removed],1
1615734781,"It's down %32 off its ATH is may be a good time to get in.  SKALE is a development tool for creating distributed apps and side chains. Think of them as the guys who sold the miners the pans, pick axes and other supplies during the gold rush... they made more money than the miners ever did...  url: skale.network &#x200B; Please mod up if you find this useful",1
1615801713,I bought skale but then converted it to link after I lost 20$. I was going to stop buying anything ethereum related this year because of gas fees.,1
1615705937,[removed],-2
1615712198,We're investigating rn...,1
1615712476,[removed],1
1615714535,[removed],1
1615725038,[removed],1
1615838520,"Okey, thanks)",1
1615725593,"Your post has been removed because discord links, referral links, and referral codes are not allowed.  If you believe this was an error, please send us a link to this post through modmail.  Do not edit or delete the post *I am a bot, and this action was performed automatically. Please [contact the moderators of this subreddit](/message/compose/?to=/r/CryptoMarkets) if you have any questions or concerns.*",1
1615225666,I recommend always holding a portion of BTC and ETH.,3
1615222444,Tezos   LTO,1
1615237473,In the last few days i ve bought: lto uma nano yfii,1
1615276912,"$ATOM, $AKT, $SENT, $LUNA, $UNI, $LINK",1
1615557933,"All good except Dogecoin being a joke. Can have some for the fun ride though. You can look at TheGraph (GRT), Hedera (HBAR), Reserve (RSR), TheSandbox (SAND) and Beholder (EYE) or StudentCoin (STC) <- ICO",1
1615275731,"That means that there is a lot of trading activity is going on. I assume that we are speaking about a crypto coin with a small market cap, because it doesn't happen so much that the trading volume is higher than the market cap",1
1615720780,[removed],1
1615721414,[removed],1
1615838937,I'll take a closer look,1
1615449423,Orchid 💎💯we should GameStop it 💰,3
1615456123,"Damn, been mining that for more than 1,5 years, was wondering when I'd see attention spent on it",1
1615488517,i'll look into it,1
1615474677,PI is not a real coin. You are wasting your time.  You want to earn then use Presearch and earn PRE or Basic Attention Web browser and earn BAT.  Both are real coins that have actual value.,1
1615474932, PI is not a real coin. You are wasting your time. You want to earn then use Presearch and earn PRE or Basic Attention Web browser and earn BAT. Both are real coins that have actual value.,1
1616946008,U in coti ?,1
1616673246,"The Atari deal with Decentraland to build a crypto casino and then the NFT popularity. And of course Wild Guess. I just hit the last couple weeks with great gains when everything else was tanking. With One, Qtum, Eng, Sol, Vet, Vtho. And I had Storj without knowing Coinbase was going to list it and hit that big. I have my own way of picking Coin which seems to be working.",2
1615747917,"If high GAS prices are resolved, would that probably cause ETH and the defi coins to rise in value?",2
1615701957,I own both but like BTC a little more.,1
1616555462,"Just quoting one of the richest person out there, ya who ironically happen to not have any Crypto, I know..  ""Diversification is a protection against ignorance, it makes very little sense for those who know what they're doing."" - Warren Buffet",1
1615707490,What about Litecoin adding Nimblewimble 🧙? I think it has massive growth potential this year 🚀,1
1615703656,[removed],0
1615556279,Their discord has a public testnet happening right now as they try to work out the quirks of their masternode fork. Their dev has the github files under akshaynexus/pigeoncoin-dash,2
1615557176,Does it? Just released a new update to their google play store wallet and have a festival coming up for 420!,1
1615672961,[removed],-3
1616178422,This is so sad you can’t post the link because that sounds very useful! Sometimes these moderating bots are psycho! Helpful links are not spam 🤦‍♀️,2
1615817545,"Nice, I'll have a look into it. Do you also recommend using metamask for pancakeswap?",2
1616556039,"That' good advice. From your experience, is Crypto a completely different ball game with much higher volatility and lesser manipulation (Decentralized)?",1
1615710450,There's no-one to guide me,1
1615839276,"There is one platform that has really great functionality for autofarmer and asset management. I recently found this and am just starting to figure it out. Apart from fairly low fees, the withdrawal fee is 0.0%. Their site is called [pumpy.farm](https://pumpy.farm).",2
1616554121,platforms for exchanges? or defi dapps like uniswap? or lending defi like aave? Platform sounds like a very board topic in the crypto space. What information are you looking for?,1
1616581989,Thanks!,2
1616582018,How will I know if it worked?,2
1616673615,I found $PRE on my own.  $DRC I heard about on TikTok and looked into it.  I really liked the concept of a coin/token not tied to anything that didn't require mining which is very resource intensive.,2
1615235431,Thank u for the financial advice brother,1
1615522365,[deleted],1
1615333093,"Your post has been removed because discord links, referral links, and referral codes are not allowed.  If you believe this was an error, please send us a link to this post through modmail.  Do not edit or delete the post *I am a bot, and this action was performed automatically. Please [contact the moderators of this subreddit](/message/compose/?to=/r/CryptoMarkets) if you have any questions or concerns.*",1
1615559368,It's a game where you can win MANA Decentralands currency. Which can then be converted.,2
1615488410,telegram is the way,2
1615492986,"Yeah I’ve seen some and some subscription ones, I’m leaning towards MYC. What you guys recommend?",1
1615637357,I think there’s still potential.,2
1615643294,thank you!,2
1615656985,Any sources for this?,1
1615390765,Thanks,1
1615577133,I like the charts on them.,2
1615301800,Erc20,1
1615312857,"Yes, i quoted them, and for once they seem to be ahead of the others.   DeFi still missing is a flaw, but this NFT thing could bring them up",2
1615362853,"Hey I want to inform you that I’m 16, will that be a problem when it comes to trading? Also can you explain more about SEPA transfers, since I haven’t heard about it? Have you ever used Coinbase pro because it seems like the fees are lower there? But I don’t know if there is a extra payment for the pro version  Tak og i lige måde",1
1615329489,"Originally I got in to make some money, but as I started learning more about different projects I started seeing how crypto really is the future and how it has so much more to offer. ADA is actually one of my bigger holdings. I’m excited to see where it goes next and I think it solves a lot of global issues. But as someone who is not very techy some of it definitely goes over my head",1
1615390636,"If one can afford holding throughout a bear market, and making use of that time to increase positions, wouldnt it be beneficial in the long run?",1
1615594658,I do check that out regularly. But I prefer reddit's format.,2
1615478688,OK I'll take a look.  Thanks! Exchange?,1
1615585792,I'll take a look thanks!,1
1615585881,Over 2 billion cap is not low cap! 😂,1
1615502387,it is #26th,1
1615653615,[removed],1
1615909987,"Look at facts...they burnt admin coins, locked liquidity for 4 years and how much are they up with still a low MC.  You must be right. Lol They did an AMA Q/A yesterday with DEV’s and you got to meet them.  Transparency with names, a person to person experience.",1
1615569093,[removed],-4
1616556317,Me too! One for you just because we have the same goal.,1
1615669838,[removed],-1
1615712610,"I just reported and blocked the last 20, don’t know if it helps you, but it definitely helps me :-)",1
1616554447,What does a Monero bot looks like in comments? I want to help report too!,1
1615715258,[removed],0
1615485715,Why is there so much shilling for pi going on. You'd think after a couple years of garbage promises with a pyramid scheme sign up checklist people would catch on that it's worthless.,3
1616734562,"Wow! Nice! You either have great fundamental analysis or really lucky or maybe both! I am very interested in your way of picking coins, do you mind sharing?",2
1615768309,I think so! High gas is killing the market!!,1
1615841574,ETH is easier to stack as far as I know,1
1615708307,Cmon! You guys must be on commission!!,1
1615561377,"OK great information!! Thank you so much, I will look more closely now.  MOTA is for POT business.  I've had 0 luck with POT stocks so will avoid for now but thank you!!",2
1615676160,[deleted],4
1616554322,"ehh.. if I do this, they can't block I guess... gasnowDOTorg Change DOT to an actual .",1
1615818009,"Yes I use metamask but you have to set it up. IT DOES NOT USE ETHEREUM!!  There are instructions on how to set up metamask for BSC Binance Smart Chain.  Let me know if you need more help, I'll find the link for you. &#x200B; Please mod up if you find this useful.",3
1615821962,Yes that's what I use for Pancake swap but you have to set it up to use the BSC blockchain.   Please mod up if you find this useful.,2
1616558179,"I'm not well enough educated in crypto to give an honest answer. It does seem to be as volatile as the stock market with all the different currencies and platforms. I think from the little that I do know, the biggest danger to the whole idea is that governments fear it and are trying to control it. After all if it replaced Fiat currency for any country it would remove the power of control. How could they tax you for one thing?",2
1615839991,"I also started using this platform, so far I'm happy with everything.",1
1616734978,"The patient shall receive their rewards in full.  How bout this, just tag me in all your comments, I'll mod every one of them for you. No strings attached.. until I get too busy. I'm just feeling nice. 😄",2
1616734377,"Oh nice! Both seems like good projects, especially $DRC similar to $RSR and it's not available on major exchanges yet. Good chance for a 100x on this IMO.",1
1615557685,"Great tech but so are many other coins like Cardano, Monero, Hedera and TheGraph. Buying anything in 2021 will make a profit cos it's a bull run year.",1
1615692964,"oh man, u were right! It shot up like crazy!",2
1615520905,Sorry I'm new.. what is MYC?,2
1615643429,Remember to mod up please!,1
1615665942,[https://www.theblockcrypto.com/linked/98138/binance-us-investigation-report](https://www.theblockcrypto.com/linked/98138/binance-us-investigation-report) Please moderate comments!!,1
1615313159,"There Defi domain is actually expanding very fast. also, numerous projects joined lately. Also, their DEX is great.   Tezos is really about to do some amazing stuff in the crypto world.",1
1615365088,"I'm sorry to say that Binance requires you to be 18 to open an account with them :( but I think it's really cool you want to start investing now, and if you want to invest in the normal stock market, you can open a ""depot for mindreårige"" at 16 Years old at Nordnet. Or you could get a parent to open an account, and trade crypto through them?  SEPA is just a way to transfer Euro to countrys within the EU countries. At my online bank i just click on ""udenlandsk overførsel"" and then i can choose SEPA, and put in the IBAN number and address of the company i want to recieve the money.",1
1615330445,"Like I said, Cardano is great. One day I hope to have quite a bit of it staking and maybe participate in what the network has to offer. I have work to do and exercises in patience till I can afford to do that. Once my compounding fiscal interest outweighs my needs I will do just that. Affording to eat and pay mortgage has to come first before hodling ahmanwhatacoolcoinandnetwork tokens. We are still in the early stages of crypto. It's relatively new. Unfettered by large institutional manipulation. Years down the line we will not be able to make money in this market like we can now. It is my honest opinion that it may be better to do what's best for your future, before believing into ahmanwhatacoolcoinandnetwork tokens.",2
1615391292,"If you sell as soon as the bear market begins and prices start going down, and buy in when you think 'this is the end of crypto' or a month or two into it then you will increase your position with more tokens/coins. Next many months the rise will be slow for awhile with ups and down, into the next year you'll go to the moon. Rinse, repeat. [Look up these market indicators under the charts tab](https://www.lookintobitcoin.com/).",2
1615607481,But reddit has so much restrictions on putting links. Cannot reference sources properly without getting the comments removed.,1
1615478854,Voyager may be a good coin by not what i meant. I has a market cap well over on billion $.  I was thinking more up and comer... sub $0.10,0
1615610191,Upper small cap haha,2
1615653617,"Your post has been removed because discord links, referral links, and referral codes are not allowed.  If you believe this was an error, please send us a link to this post through modmail.  Do not edit or delete the post *I am a bot, and this action was performed automatically. Please [contact the moderators of this subreddit](/message/compose/?to=/r/CryptoMarkets) if you have any questions or concerns.*",1
1615677360,bot reported for spam,1
1615675934,Fuck monero. Sell today.,5
1615722566,So many bots and they seem poorly translated,1
1615713741,"reporting helps since we can see those, and it improves quality of interaction. Blocking just gives you a better browsing experience.",1
1615718640,"Erm, that'll be a yes to the M*Nero boys then!!",2
1615544579,You both sound the same as those people who didn't buy bitcoin. You don't see the future mate. And it's nothing lost doesn't cost anything. Stop being so skeptical about everything. If there is nothing to lose then there is only to gain.,0
1616804470,I'd tell you but then I'd have to kill you. Haha.,1
1615839023,I completely agree,1
1615725378,"The Monero people are bots, ignore them. I would go heavy into SKALE, it’s about to explode.",3
1615839125,Why do you think so?,1
1616178716,"This is good to know. I’ve been seriously burned on fees using uniswap which also forced me to use coinbase wallet which I hate... I recently got MetaMask and trust wallet, so I’ll have to look into using pancakeswap instead. Finally got me some CAKE on my KuCoin app 😆 Do you have to convert Eth to BNB so you can use it to pay fees instead? I have 5 BNB but unfortunately they are locked for a month earning interest... only down side to that is not having it when you need it.",2
1616559690,"You just made me realize something.. thanks. That really is quite dangerous in a sense to the country and it's people. Less tax on the wealthy, more disparity between the rich and poor. Lesser things the government can help with medical, housing and infrastructure needs.  But then again, the government isn't doing a very good job handling the infinite inflationary fault of fiat. I'm quite excited to see the outcome of this major power battle between the people's crypto vs the government's supremacy.",1
1615840312,"Thanks, I will have to try",1
1616755972,I won't do that to you. But thank you,1
1616761704,I'll check it out!,1
1616762369,RSR sounds very interesting indeed.  I need to understand how minting RSV tokens works.,1
1615568382,It’s a telegram group search MYCSIGNALS you’ll find it,2
1615319374,"I'm not here to shill tezos, just to talk about NFTs.",2
1615366204,I already have an account through my parents or they have one where I operate it. At the moment I just make small investments until I have more experience within the industry.  What bank do you use? I use Nordea and I’m guessing it shouldn’t be a problem to do SEPA transfers there. Btw thanks for the tip about SEPA i will try to look more into it and if you don’t mind maybe later on ask some more questions.,1
1615391527,"Cool thank you! I’m mostly doubting my ability to time when the inevitable bear market comes, which is why i am somewhat reluctant to sell and buy in again and would rather just keep buying at regular intervals over the next couple of years",1
1615610200,"That's why I was asking if there was a good subreddit for sharing TA. The problem is ham fist fucked moderation, not the format.  You'd think that with an unlimited amount of subreddits discussing a momentum driven asset class, there would be one that would like to discuss price momentum objectively.",2
1615642244,OK OK. Let me be more specific.  Projects like Presearch $PRE that are just now going live and have massive disruptive potential.  I don't understand why exchanges aren't falling over themselves to list $PRE. CRAZY!!,1
1615547646,"Elaborate exactly why Pi is worth it. They have nothing but MLM tactics, no coin, no roadmap beyond hype etc. It's bitconnect",1
1616185880,You can also use 1inch.exchange on the binance smart chain. It's not quite as cheap as pancake swap but pretty good.   Please mod up of this is useful.,2
1615367594,"That's an excellent plan! i think we all need to make mistakes, so starting small means those mistakes don't hit too hard.  I use Nordjyske bank, but yeah it's a very normal proces and you shouldn't have any trouble when you try it.  Ask any time, also i learned alot on [/r/DKFinance](http://reddit.com/r/DKfinance). They are a bit angry in there, but have some good tips sometimes.",1
1615391945,"If the pi cycle top indicator is accurate. Prices will skyrocket in early april then hit the floor in the middle of the month. Good time to sell and buy. Same thing in August or September. Lots of people say 'institutions are buying in now... it will be different this time'. Like an abusive relationship, it will not be different this time.",1
1615692782,I see... agree with you. Please lemme know if you find one.,1
1616346156,Thanks! I’m not sure if that’s what I’m using when I go through Trust wallet and pick exchange instead of swap?,2
1615368620,Thanks for the help and i have just joined DKfinance,1
1616419627,I'm not sure I understand the question? You have to make sure your wallet is set up to support BSC.  Then when you go to 1inch just select BSC as the network you want to use to trade.,2
1616425577,"Thank you so much! Never knew you could change that! Just saw Ethereum at top and was able to change it to Binance, but then didn’t see Trust wallet or MetaMask as an option to choose for wallet so I will have to work on this more later. Might have to change it on wallets too before they show up to connect.",1
