date,content,score
1615662383,I hope alot of you saw my comment 5 days ago about MANA. If you did you are stacking Benjies right now.,6
1615689039,I see they have Sushiswap on Coinbase now.. I've heard nothing but positive things about it. Do you think it will shoot up in value?,3
1615701438,Was wondering if someone could give me advice as to which would be best to invest my stimulus check of $1400 on? Ethereum or Bitcoin? Any advice helps!,3
1615639524,ADA ✈️✈️✈️🔥🔥🔥 2$,5
1615473941,"Pigeoncoin (PGN) was created around the same time as Ravencoin, both with anti ASIC campaigns in mind! Where as RVN uses randomization of algorithms to fight asic mining, PGN uses a shuffle which also helps swap algorithms in a non linear way, making it harder to mine with asic and rather promoting individual miners with graphics cards. Pigeoncoin is shifting to masternodes with a focus on the social media space and it remains operated by the community. Pigeoncoin messenger being worked on and has potential to disrupt the space! Place to pickup would be CoinEX exchange. MotaCoin (MOTA) has also been around since 2018, it is a dispensary coin with a couple places currently accepting it in lieu of fiat! MotaCoin has a smaller max supply of 100 million and with the marijuana craze it has potential to big moon shot! Currently trading at .005 per coin! SatoExchange/Frei exchange to pickup MOTA! DYOR and good luck out there!",3
1615605629,Does anyone know anything about rocketbunny?,3
1615637285,CHZ is hot. 🔥 let’s bring it to 2$,3
1615670241,Seriously can we cut it with the spam?,3
1615748566,"Hi all, new to crypto here. I bought some ETH on binance that I would like to withdraw to a metamask wallet, in order to use it on decentralized exchanges such as Uniswap.  My question is, what transfer network should I use? I see that the Ethereum network has way higher fees than the BSC network. Do you recommend using the BSC network? Could my ETH still be used on Uniswap if I used BSC to withdraw?",3
1615659595,Can anyone help me please I'm new in crpyto  Just want to know some little things Please,2
1615832063,"Hey! Can anyone offer a service with low commission rates on deposits and withdrawals? There are very convenient sites, but with huge commissions, and I would like to minimize commission losses",2
1615950503,Buy Polygon (Matic) now!!! #UncleJoeCrypto,2
1615979985,How am I able to post something here. It says i don't have a lot of comment karma or something like that,2
1616004594,.,2
1616153879,Where can I buy sparta?,2
1616445105,$DRC Digital Reserve Currency just broke $0.01 again and is nearing it's all time high. Looking for the breakout at 0.0102 then it will be in price discovery.  $PRE Presearch just broke $0.11 and at an all time high for the last few years.  The project is now live and you can run a node through proof of stake.  Both these projects are super cheap and worth looking at. &#x200B; Please mod up if you find this useful.,2
1615171364,What cheap crypto is going up daily and is gonna keep going up daily,2
1615247308,Guys why do I feel crypto is much more fun and interesting then stocks? You can jump to one coins to another to make profit. And it easier then stock imo. What you guys think?,2
1615251609,"Has anyone seen this Pi crypto app? You supposedly mine Pi through your phone, not sure if its real or has any potential",2
1615294166,[https://gizmodo.com/atari-says-its-launching-a-crypto-casino-based-on-its-o-1846428801](https://gizmodo.com/atari-says-its-launching-a-crypto-casino-based-on-its-o-1846428801) &#x200B; MANA IS HOT!,2
1615341177," Hey folks, can anyone recommend a PR firm that works with crypto companies?",2
1615429476,"Hey guys, who knows about SLV(silverway) token, yesterday it did +71.1%, so I think, do I need to invest it?",2
1615431998,LITECOIN has a transaction time of 2.5 seconds compared to BITCOIN’s 10. It is the future 🚀🌑,2
1615460441,"First time on here so soz if I stuff it up. Just after some thought on cctl a small crypto miner, looks like it could be cheap to me",2
1615480664,Is anyone a part of any signal groups? If so how is it and what are the prices?,2
1615521976,So matik and SKL are moonshootiny right now and for the past 24 join in let's push all to 10 and matic to 5,2
1615584500,Chiliz Can change your live today🚀,2
1615604664,"hey guys, first time investing in crypto. is binance any good as a platform? or any better suggestion? thanks in advance",2
1615632945,BTC skyrocketing,2
1615635083,"Hot coin about 70% gain, does anyone have some good news or just the next pump ?",2
1615642888,"If you. are looking to get in at a low valuation check out $PRE E20 token. You might also consider running a Presearch node to earm $PRE.  You can earn PRE by using PRESEARCH instead of Google.  You can also install their browser plugin to get free PRE as well. PRE is up %750 this year and just broke $0.10 barrier!!! I'm KARMA whoring...  There I said it. I feel like I need a shower but so be it! So I'm late to the party for Reddit and have almost no Karma.  To post in most groups you need significant Karma now to keep spammers out (I totally get it).  To get Karma you need to post... see the problem here?  I can post here however, if you find anything I post to be even slightly relevant please mod up.  I ALWAYS to the same for new posts!",2
1615649529,Any know much about BSC Farm? Just noticed on CoinMarketCap it has a 27000% increase in 24 hours!,2
1615751142,Anyone’s thoughts on ONE and CHZ . I’m excited as a Canadian to see where the US stimi ✅💰💰💰,2
1615285358," It is a 50/50 shot whether BTC is going to hit a new all-time high within the next five days, but the charts are looking bullish. Watch the full episode of trading bitcoin with Tone Vays 👇 https://bloxlive.tv/video/MTA3NzI=/bitcoin-to-new-all-time-high-get-ready",2
1615126014,"Hey does anyone know about margin trading with low interest rates? I am using Interactive Brokers to trade stocks, I can get 1,8% APR interest for stock trading up to around 3-4x of my portfolio value. Is there anything similar to that for crypto markets? For example I would like to put in 100k USD and would like to borrow up to 200k-300k to trade on the market with low interest rate (less than 2% APR). Im not thinking about futures or some 100x CFDs or other synthetic things than can margin call you for no reason, but want to trade real cryptos. Any suggestions?",1
1615126894,[removed],1
1615136817,ANT (Aragon) ? Can be 40$ again?,1
1615190493,Plenty of cheap crypto right now,1
1615205761,"Just getting into cryptos. I'm looking at holding cryptos for the long-term. I input around $700 into a Coinbase account, and have spread it around a bunch of cryptos.    Is this a valid strategy, or should I be trading constantly?",1
1615215592,Which exchange can I buy coins like Troy and Perl?,1
1615223342,Oke thanks a lot,1
1615226298,"Thank you,ive bought them both aswell.They are my safety ones.",1
1615227035,"Guys TOMO going up live good fast and out investment, have good day",1
1615229499,[https://t.me/cryptogodhere](https://t.me/cryptogodhere) worth your time,1
1615235273,[removed],1
1615236107,"About NFTs, what coin in your opinion is ahead of the concurrency? Considering that Eth based ones suffer from the high Gas fees problem.",1
1615240856,Yes,1
1615241016,What is XDB?  Is there a forecast? Plus can I expect Vechain to BOOM ?,1
1615269540,Thank you,1
1615273117,Question for the EU traders that uses “currency.com” app... now that I’ve made quite a sum of money with the btc/eur was wondering should I worry for the taxes or they take care of it? 😅😬,1
1615290796,Whats the biggest exchange for crypto? I am not looking forward to having 3029002 providers to get the crypto i want.,1
1615304081,"I just feel like I'm gonna explode, and usually I have that feeling when the market's about the explode. I think BTC very close to 60, maybe 70k!",1
1615311833,"Hey everyone  I have recently got into cryptocurrency and I would say that I’m ready to take my interest of cryptocurrency to the next level. I mean that i want to invest a low amount of money, but im unsure where to do it. I have looked at Coinbase and Binance but it seems like some people don’t think these are the most optimal. What do you guys think? and if you disagree with Coinbase and Binance what would you suggest? Also what is the best way to transfer money, I’m from Denmark and there are some different rules, so if anyone here is from Denmark or are familiar with the danish rules, what would you suggest? Thanks",1
1615325433,How do you hodl through a bear market when you don’t have enough capital to take the lows? I hope it’s ok if I post this here. I’m new to crypto and even newer to Reddit and I don’t understand this damn comment karma stuff so my posts keep getting taken down elsewhere 😒 Im struggling to understand hodling vs taking profits and I’d like to have a better strategy in place for myself. I keep hearing things about what to do when the bear market hits and I’m just simply confused. I don’t have much invested at this time. Ideally I’d like to just hodl because I believe in the projects I’ve invested in this far. But I’m afraid once the bear market hits I’d just be hodling my money into the ground. Do I try and time the market and sell everything before the bear comes while we’re still high and then buy back? What is your strategy?,1
1615331342,is there a good sub for sharing TA?,1
1615335495,https://youtu.be/DEHBrmZxAf8,1
1615365120,Any thoughts on Tezos (XTZ)? I’m seeing a lot of kickback from digital artists about the environmental factors of NFTs and it looks like a few a starting to use platforms running on Tezos as an alternative.,1
1615383649,I want to talk about three things:  1. BTC is back and above 50k  2. CHZ is killing the market with Sport Team's Tokens and pumping from 0.04 to 0.3 (dollars) 3. OGN is killing the market with their NFTs auctions and pumping from 0.12 to 0.98 (dollars),1
1615391329,"So like bitcoin is up, but all my crypto- related stocks are down.  Tad frustrating.  $DMGI $FORT $BITF $MOGO",1
1615392704,"How many people here own ENJIN coin? I have 50,000 and it has taken a little Breather but I expect it to be over three dollars by the end of April check it out if you’re into it.",1
1615468457,"heyyy so I'm doing research for someone and I'm just now learning about cryptocurrency, NFT, whales etc.. I just want to ask if there's a thread of CryptoWhales in this subreddit? Like names of people holding a large amount of cryptocurrency? that would be a big help thank you so much.",1
1615474879,Does anyone have any thoughts on super cheap coins with potential? Wading through the piles of dead coins/projects is a painful excersise.,1
1615485284,Thoughts on using Kraken? Currently using Gemini and I like it but it doesn’t have tezos and I’ve recently became interested in trading that.,1
1615488076,[removed],1
1615492851,Ppi tomm. We will see where stand on input inflation. Will be big for all currencies,1
1615494638,Telcoin  Electroneum Doge  That is all  Click,1
1615500836,to the moooon!!!,1
1615501634,that 58k sell wall tho. BTC been stuck at 57.9k for a while since the 58k.,1
1615503343,[removed],1
1615535728,"Using pi now. I'll give you 1 pi, use my invitation code: gundoMertcan",1
1615548183,"Hey, I'm here to inform you about this; [Benchmark Protocol](https://benchmarkprotocol.finance) is launching its marketplace scheduled for Q2, 2021 currently, MARK is now on Balancer with two pairs; MARK-USDC and MARK-ETH Earn high %APY on these pools with xMARK stakes earning as much as 200%",1
1615554764,Where do we think ATOM is headed?,1
1615565445,"You guys seen SAFEMOON yet, 200% run brand new coin basically HOGE on steroids as it has a 5% burn.  1/3 of total token from creator was burnt so no RUG chance.  1 mil trade volume in the last 24 hours and just about to list!  On Pancakeswap right now. https://www.reddit.com/r/SafeMoon/comments/m3g368/how_to_buy_safemoon_hurry_before_its_too_late/?utm_source=share&utm_medium=ios_app&utm_name=iossmf&utm_term=link",1
1615567365,Time to cash in BTC and wait for the next dip? What you guys reckon?,1
1615587907,[deleted],1
1615597884,Look at it cook.,1
1615644665,Siacoin 🚀🚀,1
1615649504,The latest CryptoQuestion Micro Cap Watch List just landed in my inbox: **https://cryptoquestion.tech/micro-cap-watch-list/** Top performers this week: $PLOT +100% $CNS +83% $MCX +72% They dropped $FLASH New additions to this weeks list include: $LOOT - An NFT play which looks to have been ignored by the market so far. Enjoy and let me have your thoughts as always.,1
1615658284,"REAL MOONSHOT POSSIBILITY, only 100k supply. Check out r/cryptexlocker",1
1615660770,"I really have never asked about the security of storing my data and cryptocurrency in Telegram bots before, when it comes to continuous and uninterrupted operation, without risk. I have been looking for instant messengers on a similar platform with Telegram for a long time. Found not so many, tell me who already uses such platforms? Which ones do you use?",1
1615665185,r/BigBlockchainBets come join me!!!🤑,1
1615668540,Is there a site that tracks the # of token holders?,1
1615682995,Why is XEC trading frozen?,1
1615685200,Anyone looking at SKALE right now? Feels like a good time to buy. At 80¢,1
1615705091,Safemoon is an early crypto that has potential.,1
1615711450,Why are there so many Monero and XMR bots in comments?,1
1615713175,Are there monero bots in this subreddit?,1
1615723839,"Anyone in on ethernity chain or got any thoughts on it? Seems to just be starting what could be an insane trip up, I got in a few days ago just looking for peoples thoughts on it",1
1615725435,"Gonna update my previous comment, afterwards talking to some experts, BUY SKL!! You will thank me!! Buy buy buy!!",1
1615725469,"Add $FLASH for ultimate lift off, get instant yield on your stake, low defi gem",1
1615725592,[removed],1
1615131847,"Hi,im new in the crypto world. I just started with my first steps into this and have made a small portfolio. Please let me know what you guys think. I have: Vechain (vet),Cardano (ada),tron (trx),Dogecoin (doge),Stellar (xlm),Ripple (xrp). Im going to buy some more in the upcoming week,any other sugestions?",1
1615257145,What does it mean when volume is higher than market cap?,0
1615317623,We are professionals and we are ready to teach you how to trade on the cryptocurrency market. We want as many people as possible to understand that cryptocurrencies are the future. cryptosignals.team,0
1615679725,"Btt btt btt , NPXS NPXS NPXS",0
1615720172,"Hello friends, I hope you are enjoying your (insert day of week/national holiday). Have you heard the good news? Monero is here to solve all your problems and give you limitless wealth. I am neither a bot or being paid for this objective endorsement..  🤔",0
1615432652,Pi is the next big thing in crypto  Invitation code : boussinia2019,-1
1615474335,Using pi now as well. Add my invite code rjackson777,-1
1615450484,"Pi, Pi, Pi ! Get mining on your phones it will launch soon  Here's me invite code: MangoChris",-2
1615998978,Doing time here as well... Got booted for this question:     I have some ERC Iotex - which i'd like to get exchanged for Native. Would prefer an exchange in order to swap - are there any exchanges left to switch? Checked with Kucoin and they don't exchange anymore & Binance is no longer accessible...  Can anyone suggest an exchange?,1
1616382386,It's time to buyyyy,1
1616630754,Hahaah,1
1616630768,Watch out guys for safemoon,1
1616701916,Anybody sellin?,1
1616796024,Sell all,1
1615707554,Been on that mana rocket 🚀,2
1615664938,[removed],-2
1616555807,How did you know about MANA pumping.. wild guess or insider info?,1
1615734369,I think it already has!  Uniswap is releasing V3 very soon. It could be a game changer for Uniswap.  They are doing something about hight GAS prices!! Going to fix them!   &#x200B; Please mod up if you find this useful.,1
1616555721,Just a cautionary note that Sushiswap still has the rug pull code unfixed.,1
1615701890,$700. in BTC and $700 in ETH? There are advantages and disadvantages to both coins.,2
1615708229,"You could always diversify? Spread it around! Bitcoin, Ethereum, Litecoin and then a few other cheaper coins? If they tank then at least you havent lost too much. It also depends how long you plan on investing I guess? This is not financial advice! Just stuff I've gleaned myself. You should do your own research as well! Good luck dude.",2
1615702224,[removed],0
1616179730,"both BTC and ETH are safe bet, but some of the smaller ones to consider if you have more risk tolerance are LINK, ADA, DOT, ENJ (careful this just pumped), CHZ, ZIL, and AXN - these are more speculative since not all proven yet, but could potentially get bigger returns if successful.",1
1616555192,"Anything on the first page of coinmarketcap is all good and stable. 2x to 5x is still very possible by Q4 of 2021. Low market cap coins will have slightly higher risk due to potential rugpull like the recent turtledex case, but could give you a 50 to 100x like $RSR and $THETA in a year. These are usually only available in UNISWAP. $EYE is another potential one recently available. ICO have even more potential to go beyond 100x but have the highest risk. Requires a good fundamental analysis before getting one from ICO. Can't drop the link of the one I bought recently. PM me for the link if you're interested. Just get anything within your risk appetite. Any crypto will earn you more than any other existing financial assets. Especially the start of 2021, the bull run just started. Do take caution at Q3 onwards where a crash may happen anytime, no one know exactly when.",1
1616556096,I cannot rule out that possibility.,1
1615555816,So looking at PGN.  The git REPO has no commits at all recently...  Is the address in COIN GECKO wrong?  Looking at the REPO itself.  No commits in years. Are they doing private develoement?,2
1615556738,MOTA looks like a defunct project as well...,1
1615619201,yeah wondering the same. all these random meme coins coming out but people making serious gains,1
1616556237,"risky... like $HOGE.. Get in for fun sake, then it's okay.",1
1615699218,90% of comments here seem to be spam 🙃,1
1615671552,[removed],-2
1615777609,"You can only use Ethereum Network for Uniswap. Gas fees are high and will most likely get higher as more people come on board. Do not invest in low cap coins if you don't plan to spend at least $1k into it and hold long term because the fees just don't make it worth it. There's also a chart somewhere (I cannot post link cos of my low Karma) that shows some timing during the day has lower gas fees. I would recommend trading the blue chip coins first if you're new, those that are already available in the major exchanges. The fees there are much lesser than the gas fees for Uniswap.",3
1615809038,You can also trade on BSC Pancake swap using BNB Binance token (like Etherium) much cheaper gas fees!!  [pancakeswap.finance](https://pancakeswap.finance).  They have great pools where you can earn income from $CAKE tokens you stake. &#x200B; Please mod up if you find this useful.,3
1615775359,I can only tell you what 40 years of investment has taught me. Start small and diversify.  I just opened an account with Anchor . There's no minimum and you get 8% on your money  while you look at the different bit coins available. There's a wealth of info. available but try not to get sucked into one of these deals where people are pushing one coin to inflate the price short term. The holding account isn't FDIC insured so I'd limit what you start with. You can download the app off the play store or Apple.,2
1615684314,"I'm new too, I've got my son directing me",1
1615660262,[removed],-2
1616555859,"What do you want to know, I'll help.",1
1615839219,Who has experience with different platforms? Who can share information?,2
1615833106,Usually the commission is the same everywhere and it is almost impossible to find some kind of service with commissions below average.,1
1615835804,Different commissions everywhere,1
1615837274,"Interesting question, never thought about the commission",1
1615839153,Also interesting to know,1
1616178196,"Very smart to be considering that - one thing I found was comparing withdrawal fees between different coins can be helpful. For example, Coinbase charges varying degrees of fees for each crypto to transfer off the platform EXCEPT EOS and XLM are free for some reason... so since you can generally convert free on Coinbase (besides likely losing some slippage they take advantage of) I just convert it before transferring off and convert back on my interest earning platform.  Likewise, Binance.US has vastly different fees to withdraw different coins and some make it cost prohibitive unless you have really large orders, EXCEPT for some reason NEO is free to withdraw!  Unfortunately you can’t easily convert on Binance.US (unless you swap into BTC pairs), but this is still great to know. Also I’ve found Celsius doesn’t take out fees on my withdrawals so I really like earning interest there since you also don’t have to lock up your assets for any period of time either. I can’t post a referral link to give us both free BTC because apparently this will get you banned on here.  The ones who have charged me fees to withdraw were Crypto.com and Coinbase wallet (way more fees than actual Coinbase). I withdrew $100 ETH and ended up with only $80 due to getting hit with both fees. Thought that was crazy to charge fees for a deposit too! So watch out for those too. Hope this helps!",1
1616444795,I'll wait till it bottoms out thanks!!,1
1616553922,Just keep replying useful stuff like this and hope for more comment karma. One for you!,2
1616553859,com,1
1616382434,"Umm if you have to ask here, you shouldn't be buying it",2
1616553842,You can buy with bnb on Binance.,1
1616553728,Who or what brought you to the existence of these projects? Just curious.,2
1615222272,LTO   Tezos   Zilliqa   Look them up. This is not financial advice.,1
1615557375,"YES YES YES! I totally agree. To late to explore the earth, too early to explore the stars but best time to invest in crypto!",1
1615694794,This is so true. While I'm waiting for my best buy coins to get gains I'm also looking into some altcoins and love how so many projects are coming up in the crypto space. Last week just bought INFI now on my way to whitelist for CATE.,1
1615291609,Def going to make much much better gains. Been doing crypto for years guna wait until the stock market crashes this year to get into that,0
1615333092,[removed],1
1615347356,"I use it, but it’s probably a waste of time. But even the most pointless cryptos have had value.",1
1615557290,why so? It's a game right?,2
1615383736,Oh yeah✌️,1
1615383677,No sure about it but DYOR,0
1615486558,Hmmm looks interesting!!  Super cheap!,1
1615519948,"Bitcoin can do 7-10 transaction per second, Ethereum 15-20 transactions per second, Litecoin about 56 transaction per second, XRP 1,500 transactions per second, Hedera Hashgraph allows hundreds of thousands of transactions per second. Seems like it just gets better. Cryptocurrency in general is the future IMO. 🚀🌑",1
1615484776,Lost of free groups on Telegram.,1
1615604923,Too late..,2
1615643071,"I use COINBASE, KRAKEN [CRYPTO.COM](https://CRYPTO.COM) and BINANCE.  I also use PANCAKE SWAP for decentralized trades using METAMASK.  Binance seems fine I've had not issues.  If you are in the US don't go near it with a ten foot pole! The FEDS are out to get it!!! Canadian here.",2
1615639973,[removed],0
1616556141,Probably going to range for awhile due to the big red wall at 56k,1
1615636000,[removed],0
1615644040,[removed],-2
1615808796,Wow I didn't realize there were so many different ONE coins!! I assume you mean HARMONY (ONE).? Gecko has it as a buy so I'm looking a little closer. I'll post what I find out.  I think CHZ is due for a pullback but you never know...  sports in general are almost always a safe bet. Please Mod Up if you find this useful.,2
1615178829,Try Unimex,1
1615126895,"Your post has been removed because discord links, referral links, and referral codes are not allowed.  If you believe this was an error, please send us a link to this post through modmail.  Do not edit or delete the post *I am a bot, and this action was performed automatically. Please [contact the moderators of this subreddit](/message/compose/?to=/r/CryptoMarkets) if you have any questions or concerns.*",1
1615557713,Very possible,1
1615276815,"Trading constantly is so risky, if you're up to the task it's a good way to accumulate into your main stays. If you're looking for a leisurely investment, you could consider a staking coin, there are plenty to choose from but Cosmos Atom is where i've allocated the most of my portfolio set up for APY. You can passively make more coins by delegating them.",1
1615364104,Try crypto.com,2
1615557525,Why Troy and Perl?,1
1615235275,"Your post has been removed because discord links, referral links, and referral codes are not allowed.  If you believe this was an error, please send us a link to this post through modmail.  Do not edit or delete the post *I am a bot, and this action was performed automatically. Please [contact the moderators of this subreddit](/message/compose/?to=/r/CryptoMarkets) if you have any questions or concerns.*",1
1615287396,rarible?,1
1615301893,$xtz Tezos. they’re starting to take over on the NFT domain with their significantly low fees protocol. Over the next weeks there will be multiple NFT platforms emerge on Tezos,1
