date,content,score
1615912537,ADA showing signs of upward divergence,4
1615980247,"Hi all, does anyone have any advice for a new crypto investor? I'm trying to find good resources and websites to learn more about crypto trading before I start to invest bigger amounts. Thanks",4
1615921260,"Just loss $2,500 in value with MATIC. Is it the time to leave the boat? I don’t see any resistance at .36 and I see a loong way to get back to .42 when I bought. I am just a retard....",3
1615968117,"Im all in STMX,  utility case ,great project...",3
1616100467,Can someone ELI5 me please on what happened to Cardano today?,3
1616227669,BTT🚀🙃,3
1616288252,Any thoughts on ZIL? Looks like a good buy right now and should be listed to Coinbase soon by the looks of things. Coinbase added support on their website for it recently which seems like a good sign.,3
1615761936,Hey everyone I have a question about a new popular coin called THETA What do you guys think about this and are any of you guys interested in this coin?,3
1615849762,$MATIC is about to pop!!!,2
1615854733,I would like to chart bitcoin vs other coins to see how close they do or do not track with bitcoin. Can anyone suggest tools or charting apps that enable this? Thanks!,2
1615887955,Sell some $vet to get $matic??,2
1615905895,"I want to Earn on Binance for the first time, where to start for a mid-term pool?",2
1615936849,ETH trying hard to break that 1800 wall,2
1615983903,Guys Ethereum founder Vitalik is part of KNC team. Very interesting play.,2
1616049644,Best defi platform to take a loan of ~$10k of usdc or USDT? I want to borrow fiat. Bank loan rates are 10%+,2
1616059819,KNC making me proud.,2
1616064958,Is  XRP a buy?,2
1616092929,New to crypto. What’s the best discussion page to get tips from. My crypto portfolio is okay but I’m just holding on to stuff because I don’t know what I’m doing.,2
1616094344,"CryptoQuestion launched their Moonshot Portfolio Selection in February. They selected 20 cryptocurrencies which they researched, attached risk scores to each and set a price target.  You can view the latest portfolio here that was released today.  **https://cryptoquestion.tech/moonshot-portfolio-march-2021/** The biggest risers were: $BEPRO +2600% $PLOT +363% $KTLYO  +232%  The idea behind their portfolio is that they provide you with the tools to build your own portfolio of cryptocurrency moonshots. By building your own portfolio this allows you to diversify your risk in what is a high risk space. It has to be said there are some very interesting selections excluding the few I have mentioned above, including $YLD,  $BIRD and $SYLO **Remember to always DYOR!**",2
1616124259,SAFEMOON 🚀📈,2
1616232284,SAFEMOON going for it,2
1616265839,Guys I need help.  How d you all buy your crypto?  No app I use supports all the coins I want to buy.  Coinbase doesn't even support vechain. But crypto does.  Now I want Thor so I have to get binance.  There has to be a platform that trades all crypto.  Is ledger nano my answer? Please someone help!,2
1616271014,Whale running accumulation strategy on PERP. Two walls with buy orders sandwiched between.,2
1616272689, What percentage of social media pages for cryptocurrencies do you think are bots or spam?,2
1616287575,Hey what do you think about the terra project? 219.6% in the last month!,2
1616461396,Buying the dips on altcoins before season kick off in April.,2
1615730871,Petition for mods to at least temp ban mentions of that certain anonymous crypto?,2
1615766081,"i have dca’d 2 years ago into tezos. I’m now tired of it because it doesn’t move, should i hold or switch to another coin with my bag like ALGO?",2
1615813571,"Anyone heard about minepi dot com? Friend of mine was mentioning it, I'm going to try and see if it's a scam or not. So far, no open source and only 2 people in the ""team"". 2 flags , but if anyone has already done some diggin, shoot!",2
1615816319,Does chain link have any hope? I’ve lost a shit load over it and I’m starting to think my money might be better elsewhere,2
1615821696,"I’m new to all of this, I have 50 bucks, should I buy ADA, DOGE or ETH?",2
1615758244,Threw 5k in OMI this morning. Also picked up Safehorizion as a Yolo. Just launched today. [https://goswappcharts.web.app/?isbsc=true&tokenId=0xa468391a62c3562c2e960534a2defde8686a2d81](https://goswappcharts.web.app/?isbsc=true&tokenId=0xa468391a62c3562c2e960534a2defde8686a2d81),1
1615761706,Will XEM go up soon or should i sell so i don't get a loss?,1
1615765767,Do you think alt coins will we go back to the old prices compared to BTC? From the chart feels like alt coins are fated to really low prices compared to BTC,1
1615807435,"Im fairly new to Crypto , been watching it for a year now and investing only a few months,   Alice was my first Launchpool and i didn't accumulate much.        What exactly happened with Alice? I missed initial launch on Binance , but see this insane fluctuation ,  I'm looking for a more detailed charting of that first minute of launch ,  at one point it was 60,000% gains  $1000 US dollars would've been a $60,000,000 payout if you hit that perfect buy/sell limits  Can it possibly be that much? Looking for someone with more experience in these launchpools to explain because there has got to be more complexity than that...right?",1
1615833153,ChiliZ any recommendations? I think there’s still potential to reach $2.  what‘s your thoughts?,1
1615837067,What coin(s) have good volatility and liquidity for trading?,1
1615842033,I am targeting INJ as the next moonshot in my portfolio. Look into it.,1
1615756089,Worth investing in safemoon? I'm trying to afford a vr headset through crypto and put 100 pounds into eth xlm and bitcoin cash 50:25:25 is it worth withdrawing then shoving it into safemoon?,1
1615730808,[removed],-2
1615849907,"Speaking about trading, did you guys to trade on ACDX? People trading structured products there. Any experience with it? That's apparently the first exchange doing that kind of trading.",1
1615854899,$HOGE TO THE MOON,1
1615898293,A whale is accumulating IRIS heavily and MITH is going bonkers.,1
1615909073,"Any thoughts on MDT? Project looks interesting, new partnership announcement coming soon, low cap, trading on binance. Seems like a win to me, does anyone have any other info on this coin?",1
1615910691,Siacoin is on the way up... looking good!,1
1615917299,"So a little plug for DRC Digital Reserve Currency.  You can get it on UNISWAP, MATIC and BILAXY?  So there are 1B tokens minted and there will never be any more. 100% of the DRC token supply has been listed on the Uniswap decentralized exchange with an intentionally small market cap to allow early adopters to establish inexpensive exposure to DRC if they believe it will have a larger market in the future. The token is fully developed and operational and its holders are immediately able to use it for its intended functionality on the Ethereum blockchain. No one has control over DRC nor provides essential managerial efforts that affect its success as DRC has fully decentralized structure.   So unlike DOGE XRP ETH there is a limited supply and there will never be more.  This tokens only function is as a store of value.  Get it while it's cheap! &#x200B; &#x200B; Please mod up if you find this useful",1
1615928446,Is Nervos Network CKB going nowhere? I’ve seen a few goldshell CK5s for sale and they claim $50 a day profitability...but they mine CKB and I’ve heard nothing about it other than a few voskcoin videos that are a few years old. Any hype there?,1
1615985706,"They will launch a debit card to pay with crypto, brilliant futur, STMX",1
1615990880,[removed],1
1615998607,[https://fb.me/e/3OVFskLbM](https://fb.me/e/3OVFskLbM),1
1615999000,What is going on with FileCoin? It’s up 35% in a day?,1
1616003086,KNC already mooned and I only mentioned it hours ago. Hope you had a chance to get in.,1
1616007716,"Hello! Looking for an autofarming platform, does anyone have a solution? I want to find the most optimized system that will be universal",1
1616013346,DREP building a lot of momentum.,1
1616021357,"Bought ADA yesterday, thought I was way too late to the party and it was a 50/50 gamble whether it'll go up or down. Looking good so far... And holy shit FILECOIN! Bought them around 40 thinking they were only good for a decent  7.4% APY on Gemini. WOW",1
1616026169,Loading up ADA before Coinbase listing. Free money. Also happy both my DREP and KNC calls are working out but I gotta sell them for ADA. It actually hurts to.,1
1616028275,Can someone recommend me which coins I should get into? I have quiet amount of ADA but I dont know for sure which ones to go. I wanted buy next some VET abut I’m not sure about it. I’m a student btw so i don’t for that much money.,1
1616041629,"Wanna find out your opinion about coin CSX  (Coinstox), does anyone leverage  it?  Hit upon their post about up-to-date blockchain  ecosystem  rising and thinking about to participate.",1
1616042743,"Similar to BASX, it's erratic, I don't understand when appropriate to bid or ask more. Daily rebase drives me crazy and it's hard to play.",1
1616043710,Does anyone know why this transaction didn’t exchange my tokens-   https://etherscan.io/tx/0xbc5d46ea6eef55602c6d6edd98b573ab3d34276ea719aa0b595a037a2139d92a#statechange,1
1616048285,What could be much better than 20% yearly yield for ETH holding in Yield app?,1
1616063134,"Hello people, is there anyway of knowing which cryptos are being listed on binace before they get listed?",1
1616080397,"What exactly is a financial code (like a financial code used by businesses to access the ability invest into UGY, for example), and what are the risks of sharing your code with someone, or buying/investing by using another's financial code? And is such code sharing legal?",1
1616124946,[removed],1
1616131357,[removed],1
1616149939,Where will you be when GRUMPY moons? Disclaimer: real Reddit account (post history) but do hold grumpy. Ideal buy in before whitebit listing.,1
1616152855,"You never know what BASX changge will occur tomorrow, good or negative. But daily burning increases your value.",1
1616155075,IMHO don’t need to say that the DeFi market is  drowning! Have you checked how many new DeX projects were done for this time? This is astonishing. Just have a look at  Enecuum and you will understand what I’m talking about,1
1616156918,Has anyone checked into flamingo? Seems to have good potential but not much talk on it anymore!,1
1616168518,[deleted],1
1616187291,"Beginner question, does anybody know how can I get CHZ in US?? Binance.US doesn't work for me.",1
1616189807,PERP flying.,1
1616212425,"Getting ready to make a pretty big purchase. Think I’ll split it between TRAC, DENT, LTO and BEPRO. Any thoughts?",1
1616239796,Theta anyone?,1
1616246574,anyone think STPT is a good choice,1
1616252691,HOGE 🚀,1
1616311795,I am wondering is it OK to trade on binance while being in the foreign country? I left my SIM car at my homeland (where my binance account was created)  to get through SMS authentication and went to another country to study at my uni. Will I be banned and lose my account for entering my account from different IPs?,1
1616323817,"Cryptocurrency Trading in Hong Kong  Alright guys, so I've done a lot of research on trading crypto trading in Hong Kong and I cannot seem to figure out the entire thing properly. I also am finding a hard time figuring out the information regarding taxes in Hong Kong. From what I've understood so far: \-> There are no proper Cryptocurrency Exchanges based in Hong Kong especially those that contain the majority of coins including altcoins. \-> There is no capital gains tax (short-term or long-term). So this means I do not owe the government anything if I make a profit on my crypto trading. Please reassure this if you have the knowledge regarding the same. I am based in Hong Kong and I want to trade cryptocurrencies. I have a Hong Kong bank account and I would like to deposit from my Hong Kong bank account into a crypto trading exchange/app to trade cryptos and I would then like to withdraw the money back into my account. Until now, I've checked out the popular names in the game such as Coinbase that support Hong Kong as a country/region but doesn't allow me to link my bank account for transfers. It only allows for crypto conversions. I've also checked out Binance, it supports sending payments from a Bank card (visa/mastercard) into Binance (with a 3.5% fee) but then doesn't allow for any sort of withdrawal method into my Hong Kong bank account. I am almost certain all of the information above is true. Basically, I would like to trade cryptos from Hong Kong and would like to be liable to any taxes in Hong Kong and not some place else. Can someone please help me figure this out? Any help is much appreciated. Thank you in advance.",1
1616341187,"I don’t think it will pump tbh. I like to put some more cash in riding coins as  $ENX token and be cal that my investment will be doubled next month, than fill in any doubtful project",1
1616344700,"Choose safer and more  stabilized tokens for investment!  I think, every reliable project should  have a trusted team, as Enecuum does. that forms investors’ income  stabilized, and a high level of security gives them more guarantees.",1
1616350053,"Any Navi guys here? I got some their latest NFT packs from dMarket, I think they're gona pop just like NBA topshots did",1
1616364983,$PIKA TO THE MOON 🚀🚀🚀🚀🚀,1
1616385180,"We all love original plots that  is different from their predecessors.$ENX token is one itd kind. I haven’t yet met system that that can be simply operated both on treasuries, LP so as trading. Great! I’m believing they becomes acknowledged this year.",1
1616400991,that have good prospects for development,1
1616407757,Remember when I posted whale accumulating PERP? He is done. He's about to pump it.,1
1616424364,HDL airdrop! New coin on algorand with a 25 mil cap. 3000 coins to your algo wallet next month: https://headline.dev/crypto/,1
1616539543,"you will regret missing Yield app fund, yearly yield won't so high as now for long.",1
1616547112,Amazing NFT’s ! https://opensea.io/accounts/Crypto_RARE_Art,1
1616584844,IOST going wild!,1
1616598089,"Guys|dudes|fellas}, participate in Enecuum projects! This is the fresh hype topic of the blockchain market. Soon, we will commerce in the DeFi field. You can check   $ENX for the start, trustworthy project, imho. I’ve already joined community round sale",1
1616603754,Any coin suggestions? Or Recommendations?,1
1616704151,I really like you,1
1616760718,"Guys|dudes|fellas}, participate in Enecuum projects! This is the new hype topic of the crypto world. Soon, we will dominate in the DeFi field. You can check  $ENX token for the start, trustworthy project, imho. I’ve already joined community round sale",1
1616792191,"I was impressed by the UNO  coin from the UnoRe project - the world’s first reinsurance trading system powered by Polkadot. They allow the community to put money inand achieve sizable returns from one of the safest fund  classes in the world as it  removes barriers to entry for  holderssuch as capital and regulations, while also encouraging the people to take part in the process of insurance and reinsurance.",1
1616277288,Will buy $4k Bitcoin if this gets 100 upvotes. And 1$ more for every one over 100 Will post proof or you can ban me,-8
1615755556,Who’s also thinking Alice is going to pump tomorrow?,0
1616004822,BAT just grabbed onto a rocket today. Plus no ads (YouTube included). Can’t wait to see this at $100 a share,0
1616329049,"Guys, I don’t know if you’re new but there’s a card game that gives you 20 $ in ETH when you do simple missions. If you find good cards you can even sell them on the market for eth. I found it interesting. I leave the link here if anyone wants to try it https://godsunchained.com/learn/spgp?referral=QpKpxelugm",0
1616774400,"Anyway, I have always concerned decentralized projects with some distrust, due to their value is not backed by  something worthy. My research on UnoRe is making me change my mind.",0
1615963229,English doc !,3
1616003980,"Just great news, I hope it will continue to rise",1
1616042334,"Good job Basix, elastic supply is a major step!Not considering the fact that the market is overall autonomous, trustless, and independent.",1
1616601299,We all love original designs that differ from their  previous projects.  $NFTT token   is one of itd kind. I haven’t yet  come across system that allows you to have NFTs  be showcased in a VR gallery or digital display. Great! I’m sure they becomes popular very soon.,1
1615987097,"Pay attention to the evolution of a couple of altcoins n bitcoin, learn how to read graphics and choose to invest in the coin whose project you find most interesting or useful. It's all a big bet",2
1615987319,https://youtu.be/IFe9wiDfb0E It is like watching a mirror,1
1616003636,You just need to actively follow all the news and the cryptocurrency rate. There are also many DApps that help you understand,1
1615986434,"So getting your tokens onto the MATIC block chain/network is expensive and painful with price of ETH the way it is.  However, once there using quickswap (like UNISWAP) is super cheap!!  Their UI is petty buggy still as well they still have some work to do but lots of potential. I'm going to hold some and buy and sell as the price fluctuates. &#x200B; Please mod up if you find useful.",3
1616003905,MATIC just drowns. It is very sad to realize these losses.,1
1615985639,Tokens for crowd sourcing and small tasks! Neat idea looks like it's currently being pumped. Up %100 in one day....  8.5B tokens of 10B in circulation. &#x200B; Please mod up if you find this useful.,4
1616111084,"From what I have been able to gather it instantly spiked as it went live on coinbase, everyone who bought in under a dollar sold like crazy and left anyone who bought in the 1.50 range (myself included) holding out for the long run because it’s slowing down in the 1.20’s. Hoping for an over night jump though! (Completely uneducated)",3
1616431872,Would you recommend to invest now in that?,1
1616322602,After Ada’s drop from it’s Coinbase listing I’m now weary to follow this trend,2
1615808793,Curious too. Low market cap,1
1615870830,"I’m in on theta, but got in 2019. Good idea about decentralized YouTube. No way to censor.",1
1615898840,yea how did that work out?,3
1615916793,The MATIC side chain works but it has some issues and bugs.  The support DOCS are worthless.  It has a ways to go but lots of potential there.  SWAPS are much cheaper the UNISWAP. &#x200B; Please mod up if you find this useful,2
1615912989,"CoinGecko gives you comparison in BTC, ETH and US$ so it's useful! &#x200B; Please mod up if you find this useful.",2
1615912914,Getting on the MATIC network with your tokens is very expensive and painful but once you are there coin swapping is cheap compared to UNISWAP. You don't need to have your MATiC tokens on the MATIC network to put them into earning pools.  I learned that lesson the hard way!! OMG!! Anger rising!! &#x200B; Please mod up if you find this useful.,2
1616006576,And he did it,1
1615990591,SIMIETRI rating  B+  TOKENS are limited to 250M and 90% are in circulation * **Market Opportunity**   **8.5** * **Underlying Technology**   **7.5** * **Ecosystem Structure**   **9.0** * **Core Team**   **8.0** * **Token Economics**   **9.0** * **Token Performance**   **8.0** * **Roadmap Progress**   **7.0** &#x200B; Please mod up if you find this useful.,5
1616094785,Dont throw your money for xrp. Holo ( HOT) will get the next pump this weekend ;). Dont be an idiot and buy the dip.,1
1616263208,XRP is a short,1
1616080478,"Yes, I have it in my portfolio and it's growing beautifully. I actually regret closing a few of my XRP positions and putting them into BTC. My friend told me about XRP after a big spike in it gave him financial freedom.",-2
1616162636,Some those projects have been around for a while and really haven't done much. Apollo (APL) for instance.  The project looks alive and well and the road map is up to date... maybe this is its year?,1
1616654357,"Check out KuCoin, huge selection of alts and basically no KYC (a phone number is required) for the lowest verification level which allows max withdrawals of 5btc/day.",2
1616287466,I think you can buy in coinbase or binance and then swap it in uniswap or sushiswap. I have a ledger too but I think just with a metamask wallet is enough,1
1616293825,Binance have most of the alt coins that you are looking for,1
1616275167,"10% are ""transfer scams""; 10% are course/ MLM scams. 50% are shilling shit coins and NFTs. The remaining 29% are ""influencers"" looking attention and 1% are actually crypto related",4
1616554119,"Yeah the Altseason Spring Edition coming soon, check the BTC Dominance Charts going down on the monthly.  ETH for the future of Defi  ALBT for the tradfi to Defi bridge  BAT for decentralized web browsing with defi coming  XDB for esports and music NFTs",2
1615797938,ALGO is perfect.,5
1615811081,Love ALGO. All my coins are down right now except ALGO.,3
1616005192,Definitely worth doing,2
1615831347,It's not a real token. You are wasting your time with it.  If you want free tokens use presearch for your searches to earn $PRE tokens (going up!)  and use the Brave browser to earm $BAT tokens (Basic Attention Tokens) trading at a $1.00,1
1615824565,What did you buy at?,1
1615822132,ADA do it on an exchange as ETH gas fees will use up your $50!!   Please mod up if you find this useful.,4
1615813716,I'm holding. I think it will go up.,1
1615816266,Fr. Seems like bitcoin is just taking over now,1
1616005397,You can make good money on altcoin,1
1615834114,"The problem with these things is that there is no liquidity. So you think “high gains moon lambo ritch” but the truth is your being fooled. Simple example: 4 people all own 1 coin of only 4 in existence.  1 guy “buys” his From his other wallet for 1000$ (Basically making a fake transaction), this means that this guy just decided the worth of the coin. If he would have picked 1000000$ then that was the price set. Now you heard about coin X and that it’s presumable going to moon and make you rich right. So you go to an exchange and buy the coin that just pumped from 5$ to 1000$ leaving you with 1 coin of the guy that fooled you into believing it’s worth 1k$ and leaving him with your 1k$... good luck finding another fool to buy that coin from you.. Anyway, you want to sell since you recently found out it’s a complete scam right. So you put your coin up for sale for 1k$. But nobody wants it, so you lower your pricepoint and since there is no liquidity you can’t sell it to anyone because your worth will tank to 0 in just a second. Compare this to BTC where a sale of 1 million will not even cause a ripple.  TL;DR dont buy low liquidity coins unless you REALY know what they are trying to do and wish to support their project.",1
1615869076,"I think we are getting a bear market now, might wait for a dip",1
1616174268,Where can you buy ChilliZ and enjin coin?,1
1615783400,Its a high risk high reward. Worth throwing a few hundred in there for 10-100x.,1
1615797112,Yolo tbh,1
1615834498,"Buy vtho, screencap this",1
1615910818,Anyone else here in Siacoin?,1
1615986048,"Looking at GitHUB their source repo is VERY active, so the project is alive and well.  There are 24B  tokens in circulation and an infinite supply.  Personally I stay away from projects with no token cap other than ETH. Not sure if they burn tokens or not. &#x200B; Please mod up if you find useful.",2
1615990881,"Your post has been removed because discord links, referral links, and referral codes are not allowed.  If you believe this was an error, please send us a link to this post through modmail.  Do not edit or delete the post *I am a bot, and this action was performed automatically. Please [contact the moderators of this subreddit](/message/compose/?to=/r/CryptoMarkets) if you have any questions or concerns.*",1
1616003707,It can drop in price just as quickly.,1
1616006513,And now everything is as it was before,1
1616007868,"Now many such platforms appear, so far I have not found a specific option for myself.",1
1616095278,"I'm also a student. Trying to make sure i finish my degree with some bags waiting for me in crypto. A good option is to have a better strategy than just chasing a single coin. Put some in  big tokens BTC, ETH etc. Put a fair % in staking programs for passive income. I prefer SpiderDAO for this. they offer 80% APY. And then give yourself like 10% of your funds and learn to trade and flip shitcoins. All the while making money with big tokens and passively earning on stake programs.",3
1616083436,MANA would be a good bet. :),2
1616065110,Are these tokens on a different block chain?,1
1616095015,StoneDefi allows staking ETH and trading simulatneously so you get more than just the yearly yield as you can still trade while others have no option but to just hold.,1
1616064949,VirtualBacon puts out a news letter he has Binanace news in it. I think you start getting the news letter if you join the VirtualBacon group on Telegram. &#x200B; Please mod up if you find this useful.,5
1616124947,"Your post has been removed because discord links, referral links, and referral codes are not allowed.  If you believe this was an error, please send us a link to this post through modmail.  Do not edit or delete the post *I am a bot, and this action was performed automatically. Please [contact the moderators of this subreddit](/message/compose/?to=/r/CryptoMarkets) if you have any questions or concerns.*",1
