date,content,score
1616131359,"Your post has been removed because discord links, referral links, and referral codes are not allowed.  If you believe this was an error, please send us a link to this post through modmail.  Do not edit or delete the post *I am a bot, and this action was performed automatically. Please [contact the moderators of this subreddit](/message/compose/?to=/r/CryptoMarkets) if you have any questions or concerns.*",1
1616170458,Do you mean CTL (Citadel)?,1
1616190411,can you explain?,1
1616193999,>CCTL what do you mean about this?,1
1616260972,"You can get it on UNITRADE,. Quicktrade, You will need to have a wallet.  Metamask.   Please mod up if you find this useful.",2
1616296426,"Kucoin doesnt require kyc so i’d recommend making an account there. You can buy a lot of altcoins with btc, usdt, eth",2
1616275483,BEPRO is where it’s at ! CryptosRUS just had the CEO Rui on Friday and it was great. Left no doubt in my mind that they will do amazing this bull cycle and already headed down a great path. Do yourself a favor and go watch the interview,2
1616296546,Any thoughts on TRAC’s really low trading volume? I love the project but i’m skeptical about how low the number of people using it seems to be,1
1616332938,bitflyer is not available there?,1
1616639831,LTO,1
1616797095,"I put a  thousand into Filecoin about in January when it was roughly $22 a coin. I’m glad I did at this point, gotta keep watching it though.  So far, I’m winning.",1
1616284909,Ban this fucking guy,1
1615792288,Sure has pumped today.,2
1615799481,Bought at 10 and then sold 30 sec later for 35.,1
1616005824,Do you think he'll get to this point?,1
1616009101,It has gone up in price a lot. Great!,1
1616004175,"Now the price is 1.24, but tomorrow it will likely be higher after launching on coinbase",1
1616052835,Hope you all are making cheddar!!,1
1616005100,thanks for the advice,3
1616004063,"I totally hear you. I was there in 7 rallies up to .42(the price I bought) i got tired after 4 days. Yesterday at night I placed an exchange order for Bitcoin at aprox .42 Matic price. And it went trough when BTC was about 54,900 No regrets i rather be with the big boy. Matic sucks",1
1616432113,Puhh.. I’m pretty new to this whole stuff. So I better not give any advices.  But for me it worked so far. I hope there is lot more potential at BTT.. but who knows..?,1
1615906953,Depends how you look at it? You are saying it will never jump again. Good luck with that one,1
1616004044,"Thanks for the advice, I will try",2
1616173763,"Yes true, but some are starting to move. APL isn't really one of favorites although it has increased by about 100% in the last month.",2
1616506692,We would really appreciate it if you could join our new community where we discuss undervalued cryptocurrencies. In particular the focus of the conversation is on our podcast Moonshot Monday where we talk about 3 potential moonshots each week.  r/MoonshotMonday The podcast can be listened to here: https://cryptoquestion.tech/weekly-podcast/ Much appreciated!,1
1616302696,So which ones are legit?,1
1616576973,"Nice, been holding on to all of the above for a bit over a month now! About to get more of each with this dip and wait for altseason to properly commence. Just out of curiosity, where did you get your ALBT?",1
1615814789,I just got on the Algo rhythm last week... glad I did 🤣,1
1615822375,"what a timing, i have swaped my tezos for algo when u said this",1
1615832848,"Yeah I’m not a novice but thx for responding. Had some time to check it out and there’s a bunch of red flags.  1) Team of 2 2) Tokens are distributed but you don’t actually own them yet. It’s basically a database now. This I’m not 100%sure because the 3rd point is a definite red flag for me 3) Everyone who tries to grab these coins is doing it for one reason and one reason only, to sell them. This chain or future chain is basically giving out tokens to everyone in some sort of pyramid scheme system. Only friends of friends can register,  people are basically doing MLM work for them and hooking up others with “free coins” sales talk. This coin is going to get pumped and dumped so hard you don’t wanna know. Selling pressure +1 indefinately? O and are people still falling for that PHD kindof talk? Dude ‘s got a PHD in this or that as if a PHD is a safe ticket from scams or moneygrabs.... 2017 vibes anyone? Edit: O yeah they want to create an app that will do POS, like who wants a battery draining app that works in the background like that...  Also closed source, and they call it MinePI...",1
1615826070,34.37 😐,1
1615869239,"In my uneducated opinion.. Stay away from Doge for your first investment.  Find something with more use and value. If you are looking for a lotto ticket, there are a lot more relevant coins to look into.  At least 10 mentionedin these threads.   That being said, Doge was the very first coin I bought.  But that was back in January. I still own a small bag.  It's just not exciting and honestly I don't feel has much upside short term, if at all.  If you want to throw a little scratch at it later, I'm sure it will be reasonably priced.   ADA is decent and at a lower price than Eth.  You get more coins for your dollar.  While mathematically, that makes no difference, if ETH grows at a higher percentage but I think as someone new to the game it feels more exciting.   Long term, you can't go wrong with Eth.  I think of it as a retirement investment. It has less of a potential to skyrocket compared to some newer ones but long term, with its BIG head start, it will probably be more valuable than the other two. I own all 3, along with ENJ, MANA, VET and a big bag of Hoge.  All for different reasons. Basically I'm a hoe tho.  Hope that was helpful.",6
1616006355,"According to forecasts, it will most likely go up",1
1615835413,"First off : my math was a mistake , 0.10$ to 60$ is 600x so 1000$ would be 600,000$ not 60,000,000 🤪  Thanks . I understand the chart hitting 18.72$ and 60$ in a 1 minute candle alot better now . I've posted this on multiple threads looking for multiple opinions and now learned that pre-sale price was 0.10$ and GP launch price was 18.72$. What I am more interested at is the time frame this occurred.  I managed to buy at 27$ 04:30 EST and at one time reached 46$ 4:45 The 5 minute candles show it all occurred in 15 minutes and immediately plummeted back to 35.    Like I said I'm new to crypto and was my first Launchpool i jumped into so I was just riding it to learn but a well timed sell would nearly 3x the investment in 15 minutes. From what I see , the drag out of the highly inflated price (30$+) lasted much longer with this launch than previous launches and the second spike made smarter investors than me alot of money.  Likely due to the high influx of unknowledgable investors ?",1
1615885784,I’m already in.. so..  dip is killing me😒,1
1616180224,Bitpanda for example.,1
1616004814,"Yes, that's great",1
1616007987,I would also like to know the answer,1
1616083946,"Not that I know of, Trying to trade TRAC for ETH",1
1616395951,"Unfortunately, no",1
1616006466,And now everything is as it was before,1
1616027011,"Naw, maybe 2045. It has to get to $10 first",1
1616008900,I'm counting on it too,1
1616004581,"Yes, thanks for the idea, I'll try to do the same. It's better to choose something more stable than to endure the same losses later",1
1616006792,"Everything is possible, I will hope that he will go up again and compensate all the losses",1
1616303750,"Ones by crypto experts; not traders. So engineers, mathematicians, programmers, economists and actual financial advisors  They are hard to spot but I suggest you start with cardano founder Charles Hoskinson https://youtube.com/c/charleshoskinsoncrypto He has a network that you follow to find more  Also on Crypto market cap they have links to white papers on each crypto. Read them and look for those that analyse then",2
1615826300,Ouch. I mean I guess ride it a little longer its been hovering at 30,2
1616005005,"This is very important information, thank you very much",1
1615835748,"Unfortunately you are not the only one who ships in a few $ to see where it goes. And these guys aren’t retard either, you turn 50$ into 100$ and saw how easy it was, fomo kicks in and eventually you lose it all. You can say you take out your initial investement and try it but number say that traders are usually on the wrong side of the table. They know perfectly well when to hype people and when to dump on them. Bitconnect made some people money, but facts are that 99% of people who trade lose money. You think you can beat the odds, knock yourself out. But please don’t pull in friends or other because you “won easy money”, not saying that you are. But that’s how it works.",2
1615886796,"Dang it, wanted to give you a tip. we will get our profits out of it nevertheless",2
1616008436,"I tried one DeFi platform, I'm happy with how it optimized revenues. It is very convenient to manage all assets. pumpy.farm, I recommend trying",1
1616085438,So it's not showing up in metamask? You need to add TRAC token to metamask for it to show up.,1
1616052745,Me too! I was only looking at it from a short term position :),1
1615893655,Hope so too. Thx for you response and the tip.,1
1616008697,"I've already seen this Dapp, but haven't started using it yet. Today I will try. thank",1
1616085691,"Hmmm, I’m using a ledger, do I need to use metamask to make it work?",1
1616009088,Happy to help,1
1616096502,I think a ledger should work. I don't use one so  not sure. Trac is an ethereum block chain token?,1
