date,content,score
1617162142,"Good stuff man! I know MANA is pretty nice, not sure if it’s on Binance",2
1617178959,"Binance has done that to me more times than not, I've learnt to check my wallet 1st.",2
1617201316,I think we’ll see .05 easy,2
1617199412,1CKB=1CKByte,1
1617204155,"Yeah, even with the efforts to separate it into a degen sub, there's still a lot ""SafePickle""-esque shit being shilled.",4
1617170353,[removed],1
1617167868,Wait until Binance makes the swap then you'll see the true price stats...BUY & HOLD!!!,1
1617168387,Should go up with the merger.,1
1617169617,Love it 🚀,1
1617170003,Just wire transfer to Coinbase pro and just buy eth directly.,1
1617170107,Though it could be limited period,2
1617182573,well thats optimistic. Think it needs to cool off a bit now.,1
1617185382,Healthy correction was too over extended on daily ema could dip down to 16,2
1617186680,consolidating.,1
1617202076,"BTT supply is 990B, that is 7.67x the supply of DOGE, so no, it will never reach $1 or even $0.1",3
1617200768,"You're discounting the noob factor, starting up with little funds makes the cheapest crap attractive, no research just buy the bottom dwellers, some do go up but the gains from last year (1000%+) are not happening",2
1617201676,$ 0.1 by the end of April,1
1617203996,"Putting aside whether you think the coin is good fundamentally, just look at the supply count. There is nearly 1 trillion BTT tokens, so $1 BTT would mean it matches Bitcoin's marketcap, that's basically impossible.  It's not that most people promoting it are bots, but I would say they are overlooking the fundamentals and tokenomics of it in favor of the dream of making it big. Similar to how people dream of becoming a Doge millionaire when it reaches $1, even though the fundamentals and tokenomics make that all but impossible.",1
1617204580,Can’t believe I sold only $150 of stmx on Feb 12 and if I kept it I’d have $1100 today lmao,3
1617205109,"ONE is on a dip right now, great time to get in. CKB going on a run",3
1617209440,TRX and ADA,2
1617209368,[removed],1
1617212059,Opacity OPCT obviously. Get the free plan on opacity.io to discover why.,1
1617213159,Why do you think its still undervalued even with the recent price action?,1
1617214314,"It will drop again, PND",1
1617212540,"If you’re patient, Cosmos and Uniswap should have a huge April. (Cosmos first to have IBC and will likely add new partnerships soon, Uniswap v3 on may 5th). If you’re looking for quick gains OMG or even more riskier, Filecoin",2
1617219426,"How do you guys know when to go exit a trade , not sure if OMG still has some gas ⛽️ left ? Or that’s it ? Like it’s going to drop for months from this all time high ?",2
1617219837,"just added AXS, ZIL and HOT because of this ✌️",3
1617219890,I let them go.,3
1617224288,"Uni is worth it if you have the patience until May. Uniswap v3 is launching May 5th and there will definitely be a price raise leading up to it. ANKR I would suggest trading when it’s on a high. Not that it’s a bad project, but you can get quicker returns or a better hold elsewhere. Especially since it’s already kind of at a peak.",2
1617224825,I sold and feel free now. there is plenty more fish in the sea ✌️,2
1617191735,Man i want to see this tornado take off🚀,3
1617227812,Google Decentraland,5
1617188738,Surprised people aren't jumping on NXPS. It's going to explode!,1
1617201262,Would get into one coin. Harmony one coin will be in the top 25 currency’s very soon.,4
1617198041,"DEFINITELY not doge. Take your chances with anything in the top 10 if you’re unsure. I’m all in on ADA, IOTA, RSR",3
1617200902,"If you're gonna go all in on doge, you might as well just hand me your money instead of throwing it away",2
1617200341,I wouldn't recommend ADA either.,1
1617211506,📈,1
1617217041,Can't Down vote profits,2
1617228801,"Jus correcting to 20 ema on hour timeframe, should repel off n climb upwards again hopefully",3
1617227244,its good long term. I think its gonna be very useful. You should download the app,2
1617160678,MATIC has 20x more daily transactions than DOT yet the market cap of DOT is 20x that of MATIC You do the math 🤷🏼‍♂️,2
1617154936,Hoping BNB pops off with that coin burn,1
1617183244,👏,2
1617192778,How did you get wind of this coin? I need for know for research purposes...,1
1617187478,"Idk about a correlation but my money is on ONE; it’s $1 less and has 32 billion less tokens, that’s just maths.",5
1617189549,changed all my ADA in TXR,1
1617200113,Stake that shit,2
1617194381,my DOT is SUSHI,1
1617211491,[removed],3
1617216274,"You should buy the dip. Cardano is a solid project. However, if you're looking for short term gains you may want to look elsewhere.  As smart contracts begin to come out, it's inevitable the price will go up...the question is how much can it gain? I read an outrageous report it can hit 30$...I love cardano and have been holding forever but I don't see how 30 is possible in the near future....2-4$ however is entirely possible imho",2
1617226128,Maybe just consolidating for a longer green candle ;),2
1617155782,In 3 years you didnt even get 100%.... perhaps it's time to change your strategy.,8
1617182766,You dont. Stay broke.,1
1617170533,ogn is good. They have a partnership with amazon. It wasnt moving so I sold it. It doubled in a week,2
1617161431,[removed],1
1617170874,"OGN moved a lot already.    Still more potential, though it's had great growth since the start of the year.",1
1617167389,Search kamikaze cash on YouTube. He has an easy to follow tutorial on it. Old WSB theta gang head too so he knows his shit,1
1617172162,Coinbase cold wallet or even Crypto. Com DEFI wallet,1
1617181329,[removed],1
1617189194,I have a feeling that it might be Binance. Great potential project with strong fundamentals. Maybe now would be a good time to buy in. Only $0.005.,2
1617185271,"Yeah... Rising from 0.00015 to 0.00022 after it dropped from 0.0008 the weeks before. So, I continue waiting for the 400% rise to become green 😂",2
1617185398,I bet your one of those who buys at the ath and sells at a 400% loss too 😂,2
1617194240,"I'd view it more a long-term hold, so if you're looking for short-term gains, swap away. Exchange tokens will have value for a long time IMO, even through a bear market (obviously it will go down, but it won't be crushed).",2
1617204307,Probably will peak close if not right above 300. Sell around 275-290.,1
1617209404,BINANCE,1
1617208394,Bro that will be exactly like the Derp burn. We will loose our coins too,2
1617210867,I thought it was on the 30th,2
1617209639,CKB,3
1617209348,TRX,1
1617214627,"ONE, CKB, BNB",1
1617210429,just entered heavily,1
1617213054,ENJIN has had a huge run the past month. I’d be cautious but it’s a great project.,2
1617213792,"> once ""Age of Rust"" gets out of extra beta testing and onto Steam in a few weeks, it's success will be the start of future gaming history..",2
1617213129,ENJ is having a run atm. Maybe swap halve? Theta will be back,1
1617213153,I have both,1
1617213779,The question is how many Theta do u got?,1
1617215103,What do you mean? Was thinking to trade mines...,1
1617216600,[removed],1
1617217470,HBAR...,2
1617217483,"It’s not yet on Binance, but look into VRA.",1
1617218532,TRX,1
1617218601,[removed],1
1617220625,What makes you think $3? Will it correct or just keep climbing?,1
1617223187,"Yes, but DYOR",1
1617223801,not,1
1617223859,I'm big on LUNA so I wouldn't... but I also use their stock trading and lending apps to make more money so the coin also has value to me haha.,1
1617224724,If you want to go with NFTs you should have a look at FLOW and ATRI (coop. with decentraland),1
1617226175,Why u telling this?,1
1617212427,"Are you serious? it’s up 600% on the month, what more do you want? Sell your ONE, more for me and other HODLers 🤷‍♂️",6
1617212547,You're kidding right?,4
1617214177,"Look at one month gainz, everything takes a dip. This is where you buy more.",4
1617214395,"Yeah it went from .03 to .22 in a few weeks, but it’s worthless. Get outta here 😂",3
1617222723,Look at the 4h chart you bonobo its perfectly ripe for another take off,1
1617187193,[removed],-1
1617162086,I cashed out of Robinhood. Left 10 dogecoin just in case it moons.,2
1617157055,Lol robinhood bot,0
1617156268,[removed],1
1617226218,I just bought more. My profits are x5 already at this point,2
1617226067,[deleted],1
1617221347,Trash!!,1
1617166732,[removed],-2
1617202286,Seems like a decent long term hold.,1
1617209988,What are your thoughts on ENJ?,1
1617212850,I think they had the new amount of coins with the old market cap yesterday. It’s been corrected to reflect it now.,1
1617222433,Cause it was about time!!!!! Remember they own BTT which has been flying,2
1617226467,"Binance made a competition. Big prizes in the pot, Tesla Y and money prizes. For BTT TRX JST SUN WIN trading...Until 4 April. The competition for JST until 16 April",2
1617223816,Literally everything is flying at one point in the last two months.,1
1617158327,"Me too, I think Harmony can go further. Still like both coins tho haha!",2
1617196231,I can’t tell if this is a joke or not...,3
1617198378,[removed],-2
1617179610,Every.single.time!!!,1
1617204116,Aave already partnered and bridged with Matic back in January 2021.,2
1617204125,[twitter ](https://twitter.com/aaveaave/status/1377187340397985792?s=21),1
1617210883,If you read the posts you can clearly see its a bot without having to look at karma or how long they've been here. They were not even using coins that exist...they were typing gibberish,1
1617208831,I'm confused...I shilled no coins in that post.,1
1617210650,I just reported at least 30 posts for you,1
1617194570,"BTT is used by Google, Facebook, Netflix and Twitter",2
1617189689,Please Eli5 why NXPS is a good long term HODL?,1
1617219949,I'm long ONE but gonna short this weekend also :),2
1617175967,"i mean it hit $0.0156 in 2018 on its debut according to coinbase. Add inflated volume, hype around the reduction, and it's +358% gain in the last month.. why not? Edit: With that said do your own DD. Folks at r/PundiX have pretty good links",2
1617201353,Hell yea,2
1617222281,"Thanks, very educational. I wonder when the first „major“ crypto youtuber will cover CKB. That should push the price even further.",2
1617227869,All my profits this week shuttling into ONE so far. Money making money❤️,6
1617227890,"Some ppl are in for the long haul, some ppl just wanna make 100$",3
1617241045,"Couldn’t agree more, I haven’t lost anything yet, because I research what I’m about to invest in. It helps you out so much more in the long run",2
1617207259,My personal favourite from today is $SafeElongate,1
1617167984,I meant BUY & HOLD (NPXS) on Binance,2
1617170263,Do you know how long the waiting period is to transfer funds out of coinbase pro if I wire it? If I deposit with my bank account it usually takes 6 business days before I can send it to another wallet,1
1617207052,"I keep selling my Stmx and i keep going back in, it's been good to me.",3
1617208492,"It’s gotten a lot of resistance the last week or so, dipping as low as .16 and not pushing past .21, but I still think long term 2021 it’ll hit a dollar maybe more",3
1617213975,It’s just gonna keep going up. No one else has a patent like them in the market. It’d take others several years to get anything different... and that’s assuming they have a plan that works. VRA can work with anyone from YouTube to FB with their patent. They are going to authenticate NFTs. Lots of exciting things I’m bullish with and their wallet you can stake for 36.5%.,1
1617215135,"It will like always, just nobody knows how much 🙂",1
1617213096,Just got in OMG thank you for the recommendation,2
1617388681,This aged well!,2
1617192922,"I was thinking the same. I am watching Merch dao now and OCEAN, I really believe OCEAN will do good in the near future, they just partnered with Mercedes a few days ago.",1
1617164800,What does that mean?,2
1617189531,💎,2
1617227592,But it's max supply matches his circulation supply what does that mean? Sorry a begginer,3
1617194614,Nice one.  Anything you could recommend as I’m presuming you’re not a bot? I’m currently holding one/vet/chz/Hbar/BEPRO and QLC? Tempted to trade it in for more One,2
1617208501,"The market cap  Is easier to break no? 🧐 I’m pretty sure if you hodl, it will benefit long term,  better stock up now 😂🤲🏾💎",2
1617211053,"Unless I miss read it starts 01/04/21.  At 02:00 am, that’s on Binance I read.   and I just double check to assure the information is credible 👌🏽. Maybe on other platforms it’s different 🤔",1
1617211696,Just to update it will be the 5th of April that spot trading for the coin will be suspend. The earlier date mentioned previously is for margin trading suspension date. ☝🏽,1
1617210115,[deleted],2
1617210518,"Just hold, trust me! This coin will explode",1
1617213530,It will be releasing soon.. any day,2
1617213698,"once ""Age of Rust"" gets out of extra beta testing and onto Steam in a few weeks, it's success will be the start of future gaming history..",2
1617213849,https://enjin.io/powered-by-enjin/age-of-rust,2
1617215847,[removed],1
1617219857,Okay when you recommend to buy? 200$?,1
1617222206,"Obvious corrections. They’re gonna wanna take a profit. I’m ball parking it, but I wouldn’t be surprised if it’s $3-5 this year alone. That patent they just got approved is a game changer. They literally just shut the competition down and set them years back. Look into what they can do for Advertising, NFTs, Games, Streaming. I’d say VRA is a monopoly at this point. Also look into the advertising budget, how much money they would save companies (which is incentive since they’re the only ones with a “Proof of view”patent) and how they can verify and audit NFTs for authenticity. Millionaires aren’t going to buy a fake Mona Lisa. They’re gonna pay a appraiser. That’s only a few things. I wouldn’t be surprised if they come out with their own streaming stick.",2
1617215308,Bruv boy is a swinger jumping from peak to valley,2
1617210714,good long term. It always goes up and down and then doesnt move,1
1617228943,So btt can dump after 4th april?,1
1617196312,Lol.,4
1617202186,"Me either, but definitely entertaining",2
1617199087,It’s like it’s breeding,2
1617212528,"We're in agreement. The presumption is we have time to ""read the posts"", or spend most of our time in the comment threads. Getting ride of bots requires, generally, automated solutions. What you saw [was the Monero Bot Army.](https://www.reddit.com/r/TheseFuckingAccounts/comments/m5qk61/everything_changed_when_the_monero_spambot_nation/) It changed its tactics in the last 24h. It wasn't gibberish, but obfuscated Monero spam. (And yes, the team at r/Monero is aware, and they're none too happy about it either. SSB just happens to be the current target.) We're sorry you're sharing our frustration, but we want you to know it is indeed shared.",4
1617209057,"I’m taking the Mickey out of the bots mate, wasn’t directed at you",2
1617211997,"If that was you, thank you. The `Monero Bot Army` changed its tactics overnight, and we're updating filters now. I wouldn't have seen almost any of those without the reports.",3
1617191863,"A few things:     \- Pundi X hope to massively reduce the difficulty in handling cryptocurrency through contactless smart cards and integration into existing retail outlets through POS devices which accept Pundi X.   \- NPXS aims to have 100 million users in the next 3 years by integrating their services into convenience stores, shopping malls, retail shops, cafes, restaurants and other outlets.   \- Their team are also developing a mobile wallet which will simplify key management for users, the wallet is set to store a number of cryptocurrencies. The Pundi X wallet will store keys on behalf of users and be accessible using a password and account system.",2
1617177058,"I am kinda mad at binance. I tried to find out if they support to conversion or not. I didn't find any information so I liquidated my NPXS, then 4 hours ago they posted on twitter about the conversion support. Meanwhile Pundi went up 10%...   I decided to jump back in, because I saw some interesting updates for may. I'm still learning this crypto thingy (the hard way)",2
1617201466,Where can I buy one?,2
1617230995,"I took profits and did the same thing. ONE will continue to boom. Look at the chart for the last 30 days, it's literally insane to sell on the dip right now",5
1617229339,best way to do it.,3
1617170423,"They're burning coins, which historically makes the price go up.",1
1617170398,"You should be able to withdraw your crypto immediately, as long as you purchased via a wire transfer.",2
1617213194,I sold yesterday after I made my initial investment :(,1
1617215991,Glad I could help! Congrats (already) on the 5% gains!,1
1617170823,Matic should be worth more in the future as its user base is increasing.,3
1617195582,go for ONE,5
1617195580,"I don't really know much about these projects to be honest, outside of the fact they've already pumped recently (if comment chatter on r/cryptocurrency and r/SatoshiStreetBets is indicative). I'm more looking for small cap projects at this point.",1
1617213831,Just (jst),1
1617210911,"my heaviest load is on hot!  very heavy!  I never take off, it will reach 0.5!",1
1617213934,https://store.steampowered.com/app/1461520/Age_of_Rust/,2
1617209090,Hahahaha I had to read it slowly..right on,3
1617214986,You're welcome :),2
1617194483,Thanks,1
1617178318,you feel that dip? cause i sure did. felt like the day dad left. still hodling.,1
1617201510,You can get it in Crypto.com,1
1617170436,"Word, thanks man!",1
1617211012,"How much is heavy for you? I also have heavy bag, so Im courious",1
1617214017,"read about ""Wallet & Tokens""  where you will need an Enj wallet for various crypto rewards..  https://www.ageofrustgame.com/",2
1617215172,"**ALL:** Please give this user some upvotes. They're helping the mods stop the bot army. I'll take 300 users like this who fight the bots with the report button over 10,000 bystanders who think it's going to fix itself.",1
