date,content,score
1617160516,H A R M O  N Y,16
1617150995,ENJ and Harmony ONE getting ready to break barriers again,12
1617155107,"Harmony ONE gonna break .25 this week. Press conference going on this week, partnerships happening. Starting to trend more, do the math people",14
1617217826,Harmony ONE gonna go bonkers this weekend,10
1617150033,ENJ waking up?🤞,8
1617156783,Bruh $Hoge up 40% 24hr vol and no one talks about it? Ight...,7
1617157061,Love it when harmony has a small dip. I’ll load up every chance I get,7
1617165726,#BTT is looking sexy!!,7
1617193927,What’s with the bots in the thread today? It’s like they’ve given up trying to even blend in,7
1617212466,MATIC partnering with Aave?! Yessss,7
1617214426,Matic partnership 👀📈📈,7
1617165449,ANKR TRUST ME!,6
1617167232,CKB yo I'm up 132% Shit is poppin! Also BTT up 182%  It's all so cheap why would you not??,7
1617177426,FU Bitcoin. That is the second time in a day that you are screwing me over on a perfectly good STMX run. You big energy sucking bully.,6
1617183954,Why has this sub been taken over by nonsensical bots? 🖕🏽,6
1617203867,Matic gonna explode 12:00 eastern time. In an hour Matic is announcing partnership with Aave,5
1617207907,"Bots have taken over...mods, you need to fix this or this sub is dead.",6
1617152304,One,16
1617147237,I've been doing very well with CKB & BTT coins....,6
1617165360,Keep YOUR EYES ON ANKR! This just happened and it's back testing. Let's go!,5
1617169321,[deleted],5
1617171867,BTT at ATH,6
1617176860,Quiet. CHZ is sleeping 🤫,5
1617183991,Better Hop on BTT before lift off 🚀🚀🚀,5
1617184270,"NPXS / BTT / VET, been holding them for some time but things start to look good! Bought some more on the dip Let's gooooo Btw stupid bots get out of here!!",6
1617217116,Whn ONE gunna run?,5
1617145764,Harmony ONE is all you need,13
1617165678,Harmony ONE will be the next to pop like BTT did today.,13
1617156421,"ONE is on sale again, gonna buy the dip.",11
1617152584,Stmx 🚀🪐,4
1617152807,**HOT! HOT! HOT!**,4
1617155580,PUSH HOLO TOKEN (HOT),4
1617158092,Hoooooge,4
1617160678,"For anyone scrolling... Yes, the scheduled sticky post is off by 1-day. We're looking into this time machine.",4
1617169141,Pundi on the move. Binance coin burn should give it a nice boost too!,5
1617170132,April gonna be big,5
1617173513,NPXS is undervalued on KuCoin in comparison to its new ticker PUNDIX which released today.. reduction at a 1000:1 ratio began today.. binance will be picking it up tomorrow for an auto  conversion on 4/5.,4
1617184248,"Bepro charts looking bullish af, if the 12hr chart stays green. IF",3
1617197992,Why should I buy ONE. Someone tell me,4
1617202902,"Why nobody talks about CKB? I went in on march 6th for below $0.01, sold all for $0.017, luckily got back in at $0.02 and now it just broke $0.04, one of my best performing assets this month!",4
1617204782,MATIC the most undervalued coin rn - over 40 DApp integrations already this month - will be a top 10 coin easily,4
1617207653,Remember when all this place used to talk about was DOGE?,5
1617208852,"Fresh news - “AaveAave, the world’s leading liquidity and lending protocol is scaling DeFi with Polygon/MATIC” 🔥 This is an important paradigm for DeFi, with a fresh focus on accessibility and user experience",5
1617218576," VET and VTHO bargain price right now. Long time hold, not a p&d. Dyor and check the charts since January!",4
1617220355,StormX🚀,3
1617223328,Wink and stormx 🚀🚀🚀🌕,5
1617224697,Elongate ♥️🚀🔥,4
1617165155,Friends take a look at ONE ... Opportunity for big profits.  😜📈🚀💰,9
1617185834,"BTT consolidating nicely past few hours, ready for another leg up?",7
1617188892,STORM X!,6
1617188902,STORM X!,7
1617145882,"is it worth holding onto coins like xlm or even nano? seems ones like VET, LTO, and ALGO get mentioned/shilled quite often so wondering if worth swapping one coin for another. I'm sure xlm/nano will grow over time but it's the opportunity cost of not getting into these other coins I'm worried about",3
1617149498,CKB running now,3
1617150473,[deleted],3
1617155604,Take a look at Stmx!!!!,3
1617156664,$poodl,3
1617159980,Still we have time to buy BTT,3
1617161872,ATOM is ready for lift off. April is going to be a huge month for them.,3
1617173147,BTC to 60k!,3
1617178941,I think we're looking at end of the March dip. April will be extremely bullish wohoooo,3
1617191439,Fucking DAPPT yo! 2X for me in like 20 hours! 😳 Literally fixed all the lost gains from big bully BTC's dip today. 🤑,3
1617193091,[removed],3
1617195088,CKB to break .04 today on its journey to .10 by next week,3
1617195129,My current shitcoins are: $BEPRO and $LAVA,3
1617204154,"CKB, ONE, BNB!!",3
1617204225,CKB .04plus.  https://youtube.com/playlist?list=PLuOtObULDZm1NwcH3rtY1O7vG8tPo8yzj,3
1617209819,Guys do u think BTC will break ath soon or i am the only one?????,3
1617212829,"if btc can hold 60 on next try, it's ROCK-N-ROLL for ENJ & BNB baby!!  :)",3
1617213457,"Anyone else fueling up their rocket ship with VRA, FTM, and TEL? Meet me on the moon Statoshis",3
1617215337,"Guys, CKB - how is it still pumping? Its like somebody gave Superman a viagra",3
1617216103,"ENJ and BEPRO over the last few days have been stable. People want to shoot down these projects, but as an informed investor these coins have unbelievable potential!!! ENJ is now on Gemini and BEPRO’s main net hasn’t even launched yet. Get in and stay in 🚀💎",3
1617217686,ETH BROKE 1900$ ^^,3
1617218737,ETHEREUM ..... PRICE 100.000$ ..... LETS GO TO THE MOONNNNN 🚀🚀🚀🚀🚀🚀🚀🚀🚀🚀🚀,3
1617221381,StormX!!!!!!,3
1617235559,damn i sure am glad i bought filecoin while it was trading under $40.. my $255 investment is now approx $1300.00. im not cashing out either im along for the ride. if i see it staqrt to significantly decrease i might trade it just to be safe but its looking pretty reliably strong at this point.,3
1617227619,Genuinely curious why someone would sell Harmony at .19 or .18 when it’s hit .22 and will continue breaking ATHs. Wait till the weekend and watch her explode 🚀,7
1617228890,"If you're going to get in on the ONE dip, this is a nice time.",5
1617161168,Yo Binance just gave me a bad gateway message 3 times as I was trying to  make a deposit. funny thing is each one actually went through so now I’m holding a big ass bag of ONE. In ENJ as well. What’s the next best token on binance rn? TIA 😘,5
1617189753,BEPRO exploding again,4
1617199200,CKB all time high.  .04 plus.  The Nervos Network is rocking. Maybe .05 today?,4
1617200381,Tired of seeing red while all these shit coins are being shilled to death.,5
1617145507,First,2
1617145533,"$LABS and $CHAIN, both bullish and great projects. Real estate and gaming crypto, respectively.  Give the animal dump coins a miss",2
1617150288,XRP up next after ZRX🤔,2
1617153954,Pretty sure you all been sleeping on MOB,2
1617156011,What news made BNB pop!!!,2
1617162533,"The PundiX merge is happening now, what are your predictions for the price over the next few days?",2
1617168313,Thoughts on LIGHT?,2
1617169118,What's the best way to buy 2000 USD worth of ETH? Is it worth it to buy a coin like ATOM on Coinbase pro then convert to ETH?  I've seen some posts/comments here about something like that. If anyone has any insight I would love some!,2
1617170093,PSA : PancakeSwap offers +100% APR on some coins,2
1617171630,"Hot today 0,025",2
1617173116,TRX moving 👀,2
1617175567,"I was a bit late getting on a few shit coins but I don’t think I’m too late, stmx 4hr chart looks promising",2
1617184908,TRX 🤫,2
1617184993,What's happening to ONE? I am getting nervous...,2
1617199884,"Has anyone got any more information on how profitable BTT can be? I read it will never reach $1 or it’s at least very very unlikely that it will , is there something I am missing on BTT or is it mainly bots on here pushing this ??",2
1617204444,Stmx!,2
1617204665,Holding MATIC LTO HTR RSR COTI and SUPER - thoughts and what should I add ?,2
1617205828,VRA is going astronomically high. It’s hyper undervalued at under 4¢,2
1617209103,WinK (WIN) exploded today 😁 now is at 45% up 😁,2
1617211344,What coinbase available coins are we buying?,2
1617216436,"Figured i'd check out the animalcoin frenzy 2 weeks ago 4 lolz, said fuck it and transferred playmoney to metamask 2 weeks later i'm up 1200% on shitcoin p&d's kek, fully cashed out",2
1617216551,[deleted],2
1617219319,6 hrs until OMI on Uniswap ✨,2
1617219532,Woah some massive candles on BTC while etherium appears steady. Big swing on ETH/BTC,2
1617219809,Quick question is it worth still holding my ankr and uni? They annoy me :),2
1617220290,[deleted],2
1617220696,COS 🤫,2
1617220857,COS,2
1617220958,"Those who got my msg on VRA yesterday congrats on the green hills today, in price discovery mode but this coin has the makings of a 1 to 5 dollar coin...super project and highly undervalued marketcap (180mn)...not any safe mars moon stars with no use case... research, read up and get in when u are ready",2
1617222279,"Scrt. Not telling you to buy it, just look into it and see the potential.",2
1617222979,"Enj you’re stressing me out. Make up your mind which way you gonna go, Up or down?? Cant keep checking on your ass the whole night smh:)",2
1617224687,TRX did pretty good! Called that yesterday. I wonder if CVC is taking its turn now🤔,2
1617224734,ENJ keeps teasing the ENJ holders 😫😤🤞,2
1617231763,Is it true that Stormx are releasing their debit card this Friday????,2
1617234610,BEPRO is waking up.,2
1617185676,CKB has no rest!,4
1617191507,A STORMx is brewing,3
1617226937,What is this #MANA I keep hearing about?,3
1617227262,$ELONGATE MOOOOONSHOT MONDAY!!!! GOOOOO!!!,3
1617148360,[deleted],2
1617151073,[deleted],2
1617186338,Get into NPXS on Binance and HOLD!!! Let it burn off more... Good things are yet to come...(NFA)🤞🤞🤞,2
1617197158,What's the best crypto to invest in. I been looking at litecoin. Maybe go all in on doge and see what happens. Any opinions,2
1617209945,HBAR 👌,2
1617210553,"So apparently on r/cryptocurrency I’m a bot. But all I do is try and help , people, and seek guidance when needed. Very rude community, r/SatoshiStreetBets is my real home ❤️ much better community spirit",2
1617214178,[removed],2
1617215770,$Hoge is bullish aff,2
1617225411,Stmx tanking 😟,2
1617159438,[removed],1
1617197694,FEG crew all day.,1
1617153301,Link & Enj are my long term holds (and bnb) and will be the surprise sleepers in very future..,1
1617168335,I just picked up 8m more HOGE. Worst case scenario I’m not out a ton of money - best case scenario it gets pumped as a meme coin like DOGE and 🌙,1
1617181941,I wrote a song guys. It goes like this  Crypto Crypto! Buy the dip and sell the rip tho! Crypto Crypto!,1
1617186511,"DYOR and take a look at BitcoinAsset (BTA), 5m tokens, currently only $3.30 and going up like crazy. I luckily bought at $0.70 but with over 16,500 holders I don’t see it slowing down anytime soon.",1
1617187214,Anyone else notice that ONE seems to maintain a roughly a dollar difference from ADA? Same people trading those coins?,1
1617193556,"DOT breakout🚀 You should really consider DOT in your portfolio. Regarding interoperability, DOT is way ahead.",1
1617207935,[removed],1
1617211226,Will ADA taking off this week? Still thinking if I buy the dip.,1
1617220129,"Damn, I knew I should've bought the nano dip, kicking myself right now!",1
1617220264,ETH old skool teaching the Altcoins how it's done,1
1617221686,TRON is on the move finally!!!!!!! 🙏🏻 On it’s way to .40-.60 during this Alt season,1
1617224782,ZRX yesterday. XRP Today possibly ? 🤔,1
1617227290,I wish BTC would hurry and zoom past $60k.,1
1617225946,Vtho seems like it's done for good any thoughts?,0
1617185184,Elongate ♥️🔥🚀,-1
1617146385,"When do people think the 15th BNB burn will happen, mid april?",1
1617147292,DENT AXN XRP,1
1617147830,Zil,1
1617149386,"The majority of posts here are shilling meme coins that have already pumped hundreds of percent. I have been spending a lot of time trying to find some non-meme early opportunities into the NFT space and I think I have found a good one. $BLES is a very new NFT project that has a lot of potential in my opinion. What is it? In the NFT space, it can often be hard to understand what exactly a project does. Blind Boxes ($BLES) has a very strong, simple concept. It offers collectors the chance to own valuable NFTs, hidden in blind boxes. This concept is already popular with both physical and digital collector goods. Anyone ever bought a loot crate for an online game? Exactly. Tokenomics? Reached an ATH over 10$ soon after release. Hit a low around 5$. Up around 10% as I am writing this. Huge potential short and long term. We are talking 10x or even 100x this altcoin season. Where can I get it? Ethereum master race, get it on Uniswap. Binance inbreds, get it on PancakeSwap. Website: [https://blindboxes.io](https://blindboxes.io/) Stay $BLESsed.",1
1617150090,ZRX about to hit $2!📈,1
1617154416,[deleted],1
1617154531,How do people in the US buy DREP?,1
1617155827,I am curious do any of you watch youtubers and get profits?  A lot of thes coins are not on my exchange and moving from wallet to wallet is eating my profits but waiting to get it on my exchange there is a pump and dump then sideways killing profits that way? How are you doing it,1
1617157374,Bros. Axxa. Lol,1
1617157408,Axxa is a 500mil market cap company. Currently 1 million lol.,1
1617158317,I don't see a single person talking about fil ren ogn ark ardr kmd ont yet these have been some of the biggest movers,1
1617161040,Get AMMA.AI while you can. lol 1m market cap,1
1617161172,Hoge going back bby,1
1617161675,How do I sell CSP/CC on btc? Is there a guide here for it?,1
1617162397,How about that $ARDR showing back up? Get on that 🚀🚀 before she’s gone...,1
1617162630,$SKY low marketcap coin new ATH 🚀 SKYcoin 🚀,1
1617170254,"ETH, do your thing",1
1617170419,"Anyone have suggestions on the best digital wallets to use? I don't want to leave all my coins in coinbase or KuCoin anymore, but I don't want a physical wallet. I have a buddy who uses Exodus and wanted to see what y'all thought. Thanks!",1
1617170623,BTC to go over 60k tomorrow!,1
1617172584,SLT 🚀,1
1617172922,Can someone explain me the deal with VTHO what now when max supply is 0 and circulation supply is the same as total supply is that mean the coin is done? Get your running shoes on and run from it? Thanks for any advice or info.,1
1617173887,[deleted],1
1617178801,Whale drop on btc,1
1617180797,DREP!,1
1617181168,Can someone explain me the deal with VTHO what now when max supply is 0 and circulation supply is the same as total supply is that mean the coin is done? Get your running shoes on and run from it? Thanks for any advice or info.,1
1617181903,"I love how my investments in VRA, BEPRO, DAPPT and TEL on KuCoin are nearly 30% up on average in 2 days, and are barely being affected by this stupid, sudden BTC dip. 😁",1
1617182270,[deleted],1
1617182471,Let's send a message to the SEC concerning crypto. https://helplbrysavecrypto.com/,1
1617182808,guys keep an eye on MTH. Roadmap will be released on April 5th,1
1617183455,What exchange do you think $SYLO will be listed on this Q2 based on their roadmap? If it's something like binance that project would surely skyrocket given its fundamentals.,1
1617183935,Hoge on the rise 🚀 y’all said it was dead 😂,1
1617191883,JST and SUN pump like BTT  till 16 April...,1
1617191916,Congrats to all you lucky animals who are on the ARK!,1
1617192631,"SiaCoin 300 MLN buy wall at 41 sat, something good is starting",1
1617192681,"Poodle cheat on moonshot monday, soany fake account, more vote than holders. Ban It",1
1617193962,What’a everyone’s view of CRO? I bought some a few weeks ago but doesn’t seem to be going anywhere.   Thinking of changing it for something else,1
1617196392,I said it CPC now i‘m 2k in green,1
1617196779,What people think of SUPER (superfarm),1
1617198542,How do you guys think FIL is going to perform in the future? Is it going to over take LIT or has it peaked?,1
1617203507,KERN  This is what you call a layup people.,1
1617206093,What is the best exchange app for BTT?,1
1617206781,Pundi NPXS is doing a 1000:1 token burn 🚀🚀🚀🚀 tonight 👁👄👁 to the moon ☃️,1
1617208673,Why r so many coins taking a hit. We need Ankr to go to the moon again,1
1617209210,Guys I got 500$ extra to invest. What should I buy?,1
1617209558,HOT sale! Buy something before moon,1
1617212014,Opacity OPCT about to show some power!,1
1617212925,[deleted],1
1617214798,Doge has been building up something fierce over the past month. Should see something huge happen soon. 😘,1
1617215226,"Look at CONV, SPLYT & Blind Boxes 🚀🌙🔥",1
1617215849,Crypto for Free! Nano via weapp. You have to be near a nano spot. But there are other ways you can get some for free! Do you know other coins that are free and easy to get (easy or no regestration)?,1
1617216456,There are so many small cap coins with incredible blow up potential. Legit projects backed by some of the biggest VC’s in the space.,1
1617216732,why can't i post an image as a new post? i want the world to see my meme :(,1
1617217394,Best coins on binance for Today?,1
1617217476,I know it's unusual but it seems BNT is going for a ride,1
1617217691,"VRA is that x100 this year, but my opinion is you’d get in now for it since it’s only going up.  My Prediction $3 this year.",1
1617217905,"Spi coin guys. Telling you since last week. Bought it for 60,already at 280 now and still going. Not even listet on binance or Coinbase. Dyor, supply, cap and the product itself.",1
1617219051,Any good  penny coins in pancakeswap ?,1
1617221125,Xvs...keep an eye out...hitting resistance bbut is forming a perfect W...if we break 70 resistance I see a 100 coming...dyor,1
1617221448,Y’all think one is gonna go anywhere?,1
1617222218,HNT is coming back! Glad I held and didn't sell in the dip.,1
1617222351, I'm thinking about swapping out THETA and LUNA to ENJIN any thoughts on this? It's maybe 5% of my portfolio,1
1617223193,What do you guys think of the new BNB coin TKO? Possible potential or not?! 📈🔝,1
1617224154,"Anyone going in on Polkamon (PMON)? I've mostly avoided the NFT craze but this one seems like it could have legs since they're developing an actual game that will use the collectible monsters. Plus Nintendo is such a control freak, I don't see them doing actual Pokemon NFTs...  Probably gonna wait for the launch hype to die down though, think a lot of people were anticipating this one.",1
1617224631,CVC and XRP moving👀,1
1617224677,PAN (Pantos) and ATRI (ATARI) 30x-50x short term potential🚀,1
1617224835,Wonder if Algo is primed for another run 🏃‍♂️,1
1617232012,HBAR,1
1617234287,$ElonGate just won Moonshot Monday! Will become the ultimate meme charity coin. Get in now before the holders double in a week. Only 5.5 days old! Not even on CoinMarketCap yet! Dev team moving at lighting speed.,1
1617212233,Boy ONE sure turned into a worthless POS.  I guess all the SSB hype didn’t help,-4
1617185056,Hogl is looking absolutely similar to Hoge. As soon Hogl listing is official on Whitebit it will Moon. @HOGLfinance,-2
1617155590,[removed],-2
1617148222,Elongate ♥️🔥🚀 Buy It on pancakeswap 😉,-1
1617151703,"Have you guys heard about $ZNN? 8.6M Max supply and 120M Mcap, this is a real gem. Tell me why you aren't investing in a project that provides you with: \> An ultra-scalable network \> Cheap and fast transactions \> BTC interoperability on protocol level \> Oracles on protocol level \> Funding and support to develop Dapps Also you can earn passive income on your [$ZNN](https://twitter.com/search?q=%24ZNN&src=cashtag_click) Avg 55% APY. No need to send it anywhere stake it yourself on your own pc.  If this sparked your interest, make sure to read this guide that a longtime community member made: [https://shazzamazzash.medium.com/zenon-network-an-apes-guide-to-the-galaxy-7aad7dacdfef](https://shazzamazzash.medium.com/zenon-network-an-apes-guide-to-the-galaxy-7aad7dacdfef)",-1
1617196135,[removed],-1
1617225541,Has anyone used waves.exchange? Is it safe?,-1
1617226057,[deleted],-1
1617226173,"wow! TCPFM is going crazy rn, worth checking out imo :)). Link to their website: [Projectinterstellar.com](https://Projectinterstellar.com)",-1
1617154521,"Safe moon has a market cap of **$228,487,185???**",0
1617157449,Look up Axxa.ai,0
1617162082,"$MUSK is getting pumped right now, good time to jump in if you want to gamble on a shitcoin!",0
1617185429,Dock !,0
1617187460,Thoughts on AVAX?,0
1617194170,"Everyone should load up on ICX, this is a sleeping giant 🔥🔥 https://medium.com/helloiconworld/icon-2-0-introducing-a-new-blockchain-software-architecture-based-on-go-8874107a4e58",0
1617198841,"I'm trying to join discord ( [https://discord.gg/SatoshiStreetBets](https://discord.gg/SatoshiStreetBets) ), but it says unable to accept invite.... Can anyone help me?",0
1617206409,"BCD, bitcoin diamond. Nomen est omen 🚀🚀 Let's bring this coin back to ATH at 100 usd again 🚀 🚀 🚀",0
1617209961,https://www.reddit.com/r/SatoshiStreetBets/comments/mh8yvw/enjin_coin/?utm_medium=android_app&utm_source=share,0
1617212491,Looks like DREP has again his old value in Coinmarketcap.com WTF is going on with this alt folks seriously,0
1617219917,anyone look into ITH?,0
1617220244,Last Moonshot Monday winner FEG has more than 1/2 of the # of SSB members in Telegram.  That’s an interesting measure of interest although I’m not sure what to make of it after all the bot chaos.,0
1617221773,Red is my favorite color!,0
1617221930,Why is TRX flying? can someone explain pls,0
1617225158,NRV up again close to 50% today,0
1617161543,O N E,14
1617158001,I am more positive towards ONE,6
1617157944,Yes. You are right.,3
1617150979,Looks like it!,4
1617167745,"But why this pump, I don't get it 🤣",1
1617199115,Most entertaining bot post ever!,3
1617195899,[removed],-5
1617178621,I feel you.,3
1617203981,Source ?,3
1617210209,"Yes, I just banned another handful of bots. Every one of them has an older account and more karma than you. So this isn't a ""simple fix"" without you being part of the collateral damage.",3
1617208474,“I will be sure to recommend this coin my family and friends” how about you shut the fuck up you shitcoin shilling nimrod,2
1617209948,"Hi Current_Hornet5934 - It's not lost on us the blunt filters which would catch many would also prohibit your participation here too. You have a 1mo old account with modest karma. The bots have older accounts and more karma than you. So need to balance enforcement actions against locking out our users. In the meantime, it means everyone, like yourself, get to help with the signal to noise ratio. We're trying to steer a battleship. You can turn it, but it doesn't happen on a dime.  And I can tell you -- looking at the user reports -- the bystander effect is in full effect. Hardly any users are using the report button. That's the single best tool the community has to help us locate and ban the bots while we work on more automated solutions. (Also, if you want to get our attention, please use modmail. It is more reliable I just happened to pop into the daily. Glad to hear from you there.)",2
1617153934,One,2
1617147398,Both very underrated,2
1617149351,About to put more money into both of them as soon as I can,2
1617151799,Killing it with BTT,1
1617174511,I did just that. Was seeing absolutely nothing from my stocks,1
1617183541,Bout to wake up tho. Shh,1
1617184551,[removed],1
1617188977,NXPS & VET both good choices. Sceptical on BTT. Change my mind.,1
1617217761,Friday night is usually when it starts,4
1617146209,"ONE does look like a great project, gonna throw a bag in I think!",8
1617167709,I liquidated today,3
1617157023,Same,3
1617153202,Its already over...,0
1617166769,[removed],1
1617190179,NPXS staking on binance in a week also.,2
1617174792,Good pick up at it’s current price?,1
1617201220,Research sharding and how they confirm on the block chain. It’s really a coin that is advanced for its time. We’re on the forfront of cryptocurrency and I believe buying ten thousand one coins is a one up.,3
1617198787,Everyone cool is doin it.,4
1617204268,https://youtube.com/playlist?list=PLuOtObULDZm1NwcH3rtY1O7vG8tPo8yzj,2
1617204059,It hurts my heart watching it keep going up everyday. FOMO hitting hard lol,1
1617206137,Agreed,2
1617209419,buy and stake,2
1617210620,Dogecoin is straight trash,3
1617209388,💩,3
1617148112,"algo is more a steady riser than vet right now, meaning vet should have a good day soon after so much consolidation",2
1617150972,CKB doing awesome. Gonna hit $1 this year!,2
1617150877,Pew pew,1
1617157031,Breaking through them sell walls nicely,2
1617174002,[removed],1
1617196052,"mine is Auction, NFT trend",1
1617211525,hope it goes sideways,1
1617222530,"It‘s just crazy, wouldn‘t surprise me if we see it in the top 50 soon",2
1617224560,"BEPRO is to be launched on binance soon too, so.we could definitely see a price increase",2
1617216670,How do you buy BEPRO in US?,1
1617227729,Paper hands is why. They're just dragging us all down with them.,8
1617229006,"Because so many people try and use crypto investments like a casino. They buy a project during a pump, then chase the next, and so on and so forth. Eventually they lose money. It’s beyond stupid. They just want instant gratification/return. As opposed to finding a solid project and investing in it to watch it grow.  Not financial advice but that’s how I’ve made a ton of money.",6
1617229304,📈,3
