date,content,score
1617029083,"I’ve stopped looking at charts, stopped moon farming, and it might be a coincidence but I’ve never been happier. I don’t even look at the prices anymore. I know where it’s headed on the long timeframes, and i hodl, so I don’t even stress day to day anymore.",5
1617029655,MATIC!!!,6
1617029806,This is starting to feel like it’s the beginning of alt season. ![gif](giphy|26ufq8k6RuyKjmdTW),5
1617029945,Stock market down while the crypto market is up? That’s nice to see,4
1617030469,We feeling refreshed and revived?! Gonna be a great week!,5
1617031805,"It's like taking a dump daily, its supposed to be healthy..",5
1617032020,Guys don't look at the charts during market hours.,4
1617032023,"Just relax everyone, just buy this ""dump"" if you're that worried",5
1617032150,We are so close to 2M members!!,5
1617032686,"Several people in here talking about a ""dump"". What am I missing here? I'm seeing all green as far as I can tell.",6
1617033452,HOT so HOT right now. 0.1 soon,5
1617033508,Be greedy when others are fearful.,4
1617033634,"Come on ONE, you can do it 🥺🤑",6
1617033755,This weekly news cycle of good news for BTC and ETH is what  will keep us pumping and scaring away the bears.,6
1617033850,We back baby,4
1617034275,"10% dip - ""You call this a dip?"" 10% pump - ""To the moon 🚀🚀🚀""",4
1617035290,"Tell me what your coins are, and i will tell you who you are. It is time for fortune telling. 🔮",5
1617035325,"Awww, classic. Sold my SKL at 0,82 today with zero profit to buy some ONE or more VET. SKL is 0,92 now. Loveeeeely",4
1617036178,1800  ETH :D,5
1617036342,ETH broke the 0.031415926 ETH/BTC resistance too. 😅,5
1617036369,Just broke my first dollar using the Brave Browser. Could someone set up my Forbes interview for me?,5
1617036575,When you want to shitpost and catch up but you have to actually work ![gif](giphy|3og0IHx11gZBccA98c|downsized),6
1617036740,"Last week, while a lot of people were crying, I was buying! Who loves buying the dips and being in profit?",5
1617036758,Eth it’s time to shine,5
1617036792,ETH finally spiking. Now just hit the 2k benchmark.,5
1617037395,ETH 2K before btc 60k??,5
1617037918,woohoo to waking up to green.,5
1617037966,"Finally... Ethereum, HAS COME BACK.... to life.",5
1617038043,Here we gooooo,5
1617038470,"I sincerely hope that the atom will no longer make fun of us, but has returned to its former glory.",5
1617038754,Eth Ledger Thanks for reading,5
1617038756,Now this is podracing!,5
1617039004,This is the way ETH,6
1617039010,LOTS of buy pressure for ETH today. hoping this move brings us back up near ATH,6
1617039134,I love the stranger giving love to all,5
1617039184,ETH back on the menu. Not sure about this April first 51% attack thing though.,5
1617039321,"ETH/BTC ratio almost up 5%. Ya love to see it Edit: Mark you calendars, flippening coming to a exchange near you in 2025",4
1617039443,What is ETH current ATH?,5
1617039446,Much love to this sub,6
1617039640,Whats with all these awards?,4
1617039894,XLM waking up from it's slumber 👀 well maybe to get up and piss and back to bed. but it's somethin,4
1617040011,NBA Top Shot is doing a pre order for a base set pack. Time to dip the toe ![gif](giphy|VGoZVlR9naOZCiRLSy),5
1617040041,I just like the coins!,5
1617040075,![gif](emote|snoomoji_pack|give_upvote),5
1617040202,These random awards shows you how this sub is bullish . Hope y’all April filled with green dildo,5
1617040324,Wish BOtW 2 would come out so I could take a break from looking at my portfolio,5
1617040473,ETH is finally waking up after being in a coma for a month.,5
1617040529,Whilst we’re giving out random awards 🥺,5
1617040595,I’m if ETH can have a parabolic rise that’d be nice,5
1617040689,Tez and Algo doing work lately.,5
1617040742,I’m glad that this is finally repairing the ETH/BTC ratio a little bit,6
1617040784,Who needs a hug?,5
1617040928,Lots of alts are going up today Today is a good day :),5
1617040941,Lets go eth,6
1617040982,"I feel like I have so much opportunity to make money, but I also don't want to risk more than 50% of my savings. Tough decision to make...",6
1617042043,Why is the market up? Visa news? Nope.....it's because I finally got my cash out of bad stock deals and in Coinbase and was going to buy the week long dip on the Sunday sell off. So of course it goes up......,5
1617042726,Boredom is the reason I started cryptoing  also unemployment.,5
1617042856,Woke up today to green in my portfolio. What a nice feeling!,5
1617043195,"MATIC rocketing off after ETH, but BSC not moving at all.  Guess the market's decided which ETH-compatible alt-chain they want to support.",5
1617043519,It's nice to see everyone happy and doing well today :),5
1617043781,"When the dog's away, the cat will play! The force is strong in ETH ![gif](giphy|q1MeAPDDMb43K)",6
1617045826,This is great and all but I can’t be the only one that is holding in their excitement until we reach 2k again?,5
1617046048,NANO is recovering pretty nicely. Last I heard they released a patch that addressed the network attacks?,5
1617047319,"I sometimes wonder what the founding fathers of r/buttcoin think about at this point, do they think “oh shit, I could’ve been a multi millionaire if I had gone the other way” or are they more like “still think it’s shit”. Or maybe they’re just in too deep, who knows.",5
1617047342,"Almost at 2 million members, absolutely madness",5
1617048180,Anyone know why MTL has gone up like 2000% in couple months? It’s my only 2017 bag which is now in profit!,5
1617049027,Come on ARKy let’s go party 🎵,5
1617049042,Dang that high felt good. Can see things starting to normalize now but expected.  Still a nice green day.,6
1617049159,"So CrypotMoonShots is going insane with spam pump/ dumps and ""safe"" tokens. Are these people just copying and pasting Safemoon's source code and launching tokens of their own? It seems out of hand.",5
1617049203,"Fun Monday, hope it predicts a nice, steady green week",6
1617049458,Crazy how the 2 millionth user automatically gets gifted 2 million moons. Great surprise for them. 😳,5
1617050393,Less than 1k away from 2 million subs? We are going to have multiple reasons to party tonight!,6
1617050457,"Whenever the green dildos show, the crazies appear with ideas of new ATH's far exceeding the previous within the week. If they were all right we'd have 10t market cap very soon.",5
1617050622,Must.. resist...FOMO. Metal is going mental.,6
1617051871,Blockfi allows instant access to ACH deposits now 🙌,4
1617051908,"I’d like to remind everyone here that competition is healthy and pushes for innovation, instead of complacency. It’s a flame under ones ass to do better, faster. Avoid tribalism towards a singular project, be open minded.",5
1617051948,Why do ETH swaps cost so much more than transfers?,5
1617053368,Honestly with all the hype for crypto in April I’m expecting a red month,5
1617053422,"I've unfortunately had to perform my ""real job"" duties today and have been mostly disconnected. What did I miss? Do I have a billion dollars yet?",4
1617053991,"New coin idea. ALPL: Alpaca Love. A simply currency, no crazy smart contracts stuff.  The transfer fees will go to the newly created World Alpaca Fund. Its purpose to make this world a better place by putting more alpacas in it. The main user base will be Alpaca fans, secondary will be animal fans in general.",5
1617057148,"You know what, I'm finally in a good place where I'm not checking the charts constantly, I'm not stressing about dips or highs and I can go about my day as normal. Good night folks! *spends entire restless night dreaming about portfolio*",6
1617057169,Could algo get any closer to 1.4 without touching it dam.,5
1617058540,That’s it. Idk how much more of this AAVE bullshit I can tolerate. Just keeps dropping in rankings and being a total bitch. Now gotta find a different coin to put it on..,5
1617059093,"Hoskinson just said that he had given his secretary 293,000 ETH holy fuck lol",5
1616976441,Go LTO Go,12
1617004231,"So seems my post was finally approved 6-7 hours later. Sharing here, if anyone is interested in a writeup on the Terra ecosystem https://www.reddit.com/r/CryptoCurrency/comments/mfdlch/an_overview_of_terra_luna_the_defi_ecosystem_that/ Not sure why it takes so long for it to be approved (was removed), but it ends up killing any chance of people seeing it tbh. Which hey, maybe nobody would care anyway, but a bit of a shame.",13
1617015481,LTO so strong. LTO so brave. LTO is King. &#x200B; &#x200B; ![gif](giphy|AobQDNI4K7a4U|downsized),13
1617018198,Alright fine!! I’ll FOMO into LTO 🚀,13
1617035479,ALGO is on a rampage again,13
1617041845,auto-MATIC for the people!,13
1617050888,Q: Why does Superman hate trading Bitcoin after 7pm?  A: Because it’s crypto-night 🦸‍♂️,13
1617060849,"I'm a simple man. I see ALGO, I upvote.",13
1617038118,"ETH killer my ass, Charles is the real ADA killer every time he opens his mouth",19
1617011509,"LTO keeps reaching higher lows, getting squeezed under this $0.80 roof, when it will break through it's gonna be EPIC...",13
1617013148,RIP those toilet paper hands selling last week at 51k.  Use them hands to mop up those salty tears.,11
1617017208,"If LTO breaks 0.85 it will go through 0.93-0.95 i think, lets go champ.",12
1617030021,"Just sold 14000 ADA and bought two good eBikes, sold some staking rewards so basically no harm to my portfolio amounts... feels good. First time I take some profits ever... Hodling strong from 2017",11
1617031732,I've lamented a bit about my female friends not being into crypto because it would be nice to have real-life friends to chat with stuff about.  Much to my surprise two of the ladies in my mom-group were excited to tell me that they made their first crypto purchases this weekend. They bought DOGE.  On Robin Hood.  I just...ugh.,12
1617039518,"I'm out of love, u/Nomorealcohol2017 is the king ![gif](giphy|1rPpzEMv4t52OeC60R|downsized)",12
1617040380,Vechain gang! Are you here? are you staking you VET?,11
1617044296,Nice to see matic move up,12
1617056843,"Algo, forever underrated. Now is the time to shine 😍",12
1617059687,Algo just won’t stop! Pushed past 1.40 and still shooting up!!!,13
1616985960,I need to retire early.,16
1617034713,ETH performing better than BTC for first time in a long time,16
1617059351,If you're reading this you are early in to bitcoin.,17
1616981463,ENJ exploding! Where are the bears hiding?  Go ENJ 🚀,11
1616986581,Why is half of my portfolio suddenly Atom and Algo,11
1616990784,"Answers to UMA Coinbase quiz to earn $6 US (available now). 1 - UMA lets developers create what type of financial product? \- ""Derivatives"" 2 - Which network participants help UMA solve the oracle problem? \- ""Liquidators and disputers"" 3 - Which of these can be used to create a derivative on UMA? \- ""All of these answers are correct!""",10
1616995002,"I have a question for the ALGO peeps, are none of you concerned that the foundation holds 50% of the coins? I was doing some research on it cause it sounded interesting but that's an instant no-go for me.",11
1617001431,If Ethereum could just solve its scalability issues we would all be holding the greatest invention in the history of finance and would be considerably wealthier.,10
1617003985,"Guys. I did it. I’m 100% Bitcoin now! Ordered a hardware wallet, transferred all my alts into Bitcoin... this is it for me. I’m stacking them sats",10
1617015644,If the visa eth news breaks mainstream in usa eth might go ath today,10
1617016040,There goes 80c. Next stop 90c for LTO!,11
1617016777,"So, visa chooses the ETH blockchain.  ^(as expected)",10
1617017397,"LTO! LTO! Never forget that yesterday, someone said it might be a pump and dump lmao Wait maybe this is the pump before the dump /s",12
1617021591,"The ETH gas fees suck but I really don't get how megafans of competing projects can so confidently be like ""ETH is trash compared to my unfinished crypto that currently does nothing,"" it reminds me of my uncle saying he could throw better than his team's quarterback. Hype your project but respect that ETH actually has real applications that work and people value.",12
1617023195,"Cosmos IBC (Inter Blockchain Communication)  launch party tonight, yeah! Go, ATOM, go!",12
1617025956,"People putting a big sell wall up at .84 for LTO, fucking virgins do you not get the point of hodl",11
1617026213,LTO and HOT running good today,11
1617027986,"No you are not late on LTO, TAKE A LOOK AT MCAP!",12
1617040298,The Visa news is all Eth.,10
1617042277,MATIC Yall better hop aboard,11
1617047959,Where can I buy VISA? Heard it's going to be the new L2 for ETH.,11
1617052768,ALGO has had a very good day today!,11
1617052988,"ETH honestly should be where bitcoin is at, i can't see why Bitcoin is the ""best"" coin except for it being the first. I suppose we'll see it's dominance decrease over the next 10 years",11
1617061457,My dumb ass bought Algo pretty much at its ATH when I first got into crypto. I think this is the first time I'm in profit on it.,10
1616985305,I’m upvoting the last 100 posts to combat this downvote BS. Edit: make that the last 200 posts/comments.,15
1616976041,New daily same hodl,3
1616976132,MANA is at it again.,4
1616977226,"VET going to hit that 0.010$ soon, the beauty is blooming like crazy!",4
1616977697,Where can I find to buy a physical crypto wallet? And how can i know if the product being sold is legit?,5
1616977966,"Heyho people :D Remember to drink enough water, and beer is not water, then drink even more water. Love me some water!",5
1616977970,"I know Elon and Mark Cuban are fighting for DOGE to be $1, but is that even realistic?",5
1616979579,Crypto > stocks  Cash< crypto,5
1616980535,[deleted],4
1616982347,Is oxt any good,4
1616983185,ZIL is looking good tonight.,6
1616987073,Full moon tonight! That’s always a good sign 🌝,3
1616989318,"Damn, none of my coins are doing *anything*. I'm feeling…bored? That's new for me in crypto haha",3
1616989448,Damn me atomic moon,3
1616989973,Good morning everyone from Europe! Lets start this week strong and green!,5
1616990069,Question for US buyers of LTO not using binance. What’s the cheapest way? Binance.US->BNB->Trust Wallet? Or Binance.US->Binance Chrome extension->BSC->Metawallet->Pancakeswap->LTO?  I’ve done both. And fees were hefty but have varied.  Do slippage rates on Trust Wallet vary alot?,3
1616990298,"Should I buy a bag of XLM, LUNA, or ALGO? I rely on Reddit to make decisions for me because every one I make is wrong",4
1616991410,"Time to sleep so I can play my daily game of “oh god how much did I lose/gain in the past 7 hours!” Please keep the ship on course until I’m back, people on the opposite side of the world. :)",5
1616993957,HBAR more like GreenBAR,3
1616994083,"I was thinking about setting up a validating nodes for several different networks...the hype around ANKR got me curious about the amount of work and capital it would cost. I now understand the complaints many have about Nano not offering incentives for setting up validating nodes...most of these blockchains require a significant amount of processing power and storage, and it really is quite a bit of work to get everything working smoothly and running 24/7. ANKR charges $20-$150 a month to make the process of setting up a node easier for a SINGLE network, otherwise you'll have to do a lot of work to get it up and connected properly.",3
1616994494,Grt goes back well,3
1616994564,my MANA and ONE finally taking a breather and then my THETA and WABI starts pumping. Love it when my coins seem to work together to make me money,5
1616994768,KSM has reached an ATH and the parachain auctions haven't even started yet man I'm so happy.,6
1616994839,HBAR had a big jump.  Any news?,2
1616995358,"Being new to crypto, I have stuck to Binance.US and Coinbase Pro (took everyone’s advice and switched from regular Coinbase).  That being said, it seems the way to really get ahead is to be in very early on different projects.  As Binance.US and Coinbase seemingly have more established crypto, where should I go to put a little in on crypto that have not been widely traded yet?",3
1616996458,"Cmon verasity, push 3",4
1616997178,What are the best online resources to learn about current and upcoming airdrops? May include: 1) YouTube channels 2) subreddits 3) Twitter feeds 4) websites 5) telegram channels 6) other?,5
1616997614,"Who is the person whose bot is linked to the telegram or discordant message? get out, we don't like you",4
1616997781,Happy Monday everyone. Hope we all get some decent gains this week 🚀,3
1616998973,HBAR coming with the pump,3
1616999848,i love you,3
1617000583,"I must say,  I do love my Ethereum ❤",4
1617006461,I have all my shit in crypto,6
1617010651,USDC to 1.01$ let's goooo babyyyyy,15
1617018348,I know feel really bullish right now,7
1617018553,"Exactly, amazing news for eth ![gif](emote|emo_pack_1|dancing_wojak)![gif](emote|emo_pack_1|im_fine)",6
1617041488,If algo hits ath this week I will get an algo tattoo (a very small one),13
1617041181,Praying we can break beyond 1.30 thats traditionally been a problem as of late Edit: there is a yuge sell wall at 1.30 its going to be tough Edit2: nm read it as 200k instead of 20k i guess even 200k isn't insane,11
1617041157,"Despite knowing im not selling any time soon, these gains are really nice",7
1617050108,It’s-a-Ve,11
1617031563,VETerans unite!,8
1617016113,Have a nice day!!,7
1617043320,Im not selling till its atleast top 50.,12
1617043368,Holding to $10,8
1617050114,Work on your world domination gainz as much as you work on your coins gainz - Genghis Coin,8
1617050196,Buy shit coins and eat shit food - Albert Einstein,7
1616978265,It's going to be very ATOMIC soon!,10
1617013412,I also love LTO and your mom.,5
1617048690,ALGO get some more gains tomorrow.,12
1616993243,Bend over I get to slap your ass once. It’s tradition.,9
1617032903,Speak for yourself. I’m going to be a very smart poor person.,9
1617033233,I’ll be happy if I have enough for retirement in 25-30 years.,6
1617049616,ALGO mad,7
1617018137,![gif](giphy|85UGT15wJfghYtuM5E|downsized),6
1617022277,"Yeah, was just thinking that. If I hadn't maxed out my ""safe"" limit for my futures account, I'd probably dump some in. Luckily for me ATOM is only one of many that is insanely bullish at the moment.",7
1617024061,Charts n farts,10
1617025803,Mint it as an NFT and sell it for $21. Then you'll be laughing.,5
1617026832,hey I have those things,6
1617031417,I keep at least 50% in BTC.,11
1617031581,"Right now about 70% ETH, 30 in alts",7
1617048842,"I see what you mean but if you do, you'll just arrive late, have to carry your puke-covered buddy home, and also pay for the taxi",7
1617051994,Slaap lekker 😙,8
1616979069,"HODL, VET going for $1 in 2021!",8
1616979727,just HODL. VET is gonna be at least $1,7
1617002789,Crypto aren’t Pokémon but your enthusiasm is contagious,14
1617038602,"Me too! Hodlers all over the world, join hands. Start an ETH train",6
1617045873,[It’s not a tumor](https://m.youtube.com/watch?v=OaTO8_KNcuo). It’s crypto.,6
1617052377,Yeah me too! Finally,7
1616978442,Does the pope shit in the woods?,12
1616978646,Doesn't count until you post it on reddit,8
1616978707,"ALGO is a winner. Bold prediction, one day we won't refer to it as an alt coin.",13
1617006974,Not that easy to get.,6
1617007414,Nah top 100,8
1617018130,I don’t think you will be waiting to much longer 😊,6
1617036380,$2K soon,6
1617043431,"Sir, this is a casino",6
1617043039,"LTO is pretty hyped up in here haha, but we’re not close to being done yet!",8
1617044124,"The primary thing they're leaning on is '[Anchoring](https://docs.ltonetwork.com/tutorials/anchoring)' things in the blockchain... Which isn't actually a unique feature to LTO.  (Basically every single network can do this) What *is* unique to LTO is how much they focus on it as an advertising point in the market and make it easy for companies to do so via LTO hosting a web API service to interact with and perform these anchoring actions on their blockchain in a centralized format (which doesn't involve their clients having to run/directly connect with an LTO node). Basically their selling point is 'Hey, send us a web request with some info, and we'll put it on the blockchain and guarantee it becomes secure/immutable.'  And then pushing that case for use with things like their land registry project partnership. Tl;Dr; Not actually very interesting/unique/special tech, but a good sales/marketing team behind it making waves with partnerships & knowing how to sell their product in a focused way.",9
1617051833,Holy fuck...  Stop hitting members! You've got an issue!,6
1616987370,"God, hear my prayers and send ETH to my wallet",7
1617036079,Needs more Matic. Maybe try 110%,8
1617040736,Remember when ADA was added to coinbase and everyone was making ADA posts that were being removed? Those same rules still apply. Only (x) amount of posts allowed in the home page about (n) coin in any 24hr period.,7
1617041800,Ive been waiting for this for 3 years! They told me to sell... ha!,8
1617048313,You know what else feels good? Your first moon ![gif](giphy|pHb82xtBPfqEg),7
1617050759,"Bro LTO isn't listed on a single fucking US exchange.  It's not too early lol.  That said, as soon as the gas fees fall low enough I'm about to throw a FAT yolo into it so prepare for it to dump to 1 sat.",16
1617050816,Not even in the top 150. How can it feel late man?,11
1617050884,"ZOOM IN, and then you won't say that :P",6
1617051065,Will be worth $5 easy. Not to late 😊,7
1617012422,Have been 3 weeks? But it feels like an ETHERnity ago,7
1617015777,Holy fuck that is random. I'm watching the Two Towers extended edition right now,6
1617018258,Probably both. They both look like they'll put in some yardage in the next few weeks.,7
1617041222,Visa news today was all ETH its beautiful to see,8
1617047013,Both.,8
1617046988,50/50,7
1617048583,...and girls! We're here too! 🙋🏼‍♀️,6
1617050237,"In order: sub 2m , btc 60K, ETH 2k",10
1616977673,When $9,8
1616977666,should have bought more,7
1617015767,I trust you because your comment looks sick with the comet and stuff,15
1617003512,After 20 your only goal will be to find a way to avoid working at a job,9
1617021354,![gif](giphy|xT5LMQ8rHYTDGFG07e),6
1616976739,No one here has it except for a few. GRT being an indexer for blockchains (like Google for search queries) and not having any competition is surprisingly underrated,6
1616976848,"I'm always bullish on ATOM sooo, I'll say ATOM, but I guess no one can predict anything right",7
1616996478,In the future the inflation rate can be reduced if it is put to proposal and approved. Anyone can submit and fund a proposal.  There are additional use cases coming intended to bring value to ATOM but the primary use case is staking and governance. There will likely always be inflation because it’s not trying to be a store of value or speculative asset.,8
1616997811,"Same here, this will be a good week before eastern :) &#x200B; PS: Why the heck someone downotes your post?!",5
1616998002,"My blood pressure, most likely.",5
1617000115,Always a good time to buy under a dollar,7
1617000163,I spent time waiting for dips and eventually realized it's always a good time to buy ONE,5
1617005971,The UN and the Dutch government are their top 2 clients but they have heaps more.,5
1617006696,lmao from 2017 this coin price still same,4
1617009522,"HBAR seems good, undervalued, HBAR to the moon. there you go.",6
1617010695,"Nice, more LTO shillers here to be welcome \-> Go LTO!!",6
1617011651, Do it maybe you’ll wake up as happy cowboy,5
1617015758,"It's a good day so far, moons up 6% 0.058 euro :)",4
1617017709,Basic math would suggest not Even with a 50% APY (which is ridic high) it would take you a year just to get back to your original amount of tokens,6
1617017652,Fuck no,5
1617019255,![gif](giphy|eruVMzXlb70oo),5
1617022734,XLM. fast and almost no fees,9
1617022756,"XLM, you don't even have to worry about volatility",5
1617034083,Live stream of green dildos scaring away bears: ![gif](giphy|ErDZ73YFYLSPC),6
1617036716,What is that gif from? A porn parody of the office?,5
1617039707,Okay now I get it lol,5
1617041411,"Everyone else seems to be giving smart advice so I will tell you what you want to hear. Risk it all. Get a second mortgage on your house, your parents house, and your grandparents house or be smart and listen to everyone else.",5
1617042152,You sold the market correction in the stock market... come on man.,5
1616977096,🐎,4
1617015901,Finally over $0.8 again!!,5
1617018468,Let's go boy![gif](emote|emo_pack_1|to_the_moon)![gif](emote|emo_pack_1|dancing_wojak),10
1617038186,ETH 2.0 is **the** ETH killer.,10
1617038390,Here is a fun excerpt from some of his ex-coworkers at ETH. https://i.imgur.com/c7LDWci.jpg,8
1617038163,lol what did he do this time?,5
1617017321,Going to go far. Feels like it deserves to break into the top 100.,7
1617017348,Well let’s make it happen💪🏼LTO strong,7
1617031766,Hey everyone has to start somewhere,6
1617032232,"Well, that's just the gateway crypto.",6
1617039575,I got you fam ![gif](emote|emo_pack_1|arrow_up),7
1617039555,"I’m all out of love, I’m so lost without you",7
1617040412,Yes and yes!!!,5
1617040464,Here! Yes for the Vtho!,5
1617059831,If it passes the 1.43 barrier im gonna pee myself.  This is the most money ive made in a day since 2016.,10
1617034858,Has me excited for 1559 and 2.0. If it’s outperforming now I can’t wait till then,6
1617004321,Just in time for Alt season!,13
1617004028,whale alert,7
1617004305,Why? At least ETH has good potential and is hardly going anywhere. But you do you.,6
