date,content,score
1616496122,"**TL:DR** \- Monthly proposals have just become a battlefield for people to maximise the number of MOONS they can get. Only three proposals looked to improve the state of the subreddit: Posted as a thread as requested! \_\_\_\_\_\_\_\_\_\_\_\_\_\_\_\_\_\_\_\_\_\_\_ **The proposals** This month there are 10 proposals that are listed and I just wanted to try understand how users interact with them. 1/ Limit of two free posts a week: Aims to restrict the amount of MOONS a user can earn. 56% of MOONS are against this which comprises 54% of individual voters 2/ Reduced karma from news links: Aims to restrict the amount of MOONS a user can earn. 66% of MOONS are against this which comprises 29% of individual voters 3/ Personal story flair: Aims to restrict the amount of MOONS a user can earn. 65% of MOONS are against this which comprises 29% of individual voters 4/ Tipping allowance: Aims to promote gifting (without impacting MOONS). 87% of MOONS are for this which comprises 84% of individual voters 5/ Bonus moons for voting: Aims to promote voting. 95% of MOONS are for this which comprises 85% of individual voters 6/ Reduce membership fee: Reduce membership fee by ten-fold. 55% of MOONS are against this which comprises 25% of individual voters 7/ Reward members with bonus: Incentivise membership with additional MOONS. 54% of MOONS are for which comprises 44% of individual voters 8/ Reward quality posts: Incentivises high quality posts at the expense of low quality posts. 90% of MOONS are against which comprises 50% of individual voters 9/ Restrict eligible comments: Aims to restrict the amount of MOONS a user can earn by only counting an arbitrary number of comments. 79% of MOONS are against which comprises 54% of individual voters 10/ Negate downvote effects: Aims to improve MOONS amount for a user. 83% of MOONS are against this which comprises 55% of individual voters \_\_\_\_\_\_\_\_\_\_\_\_\_\_\_\_\_\_\_\_\_\_\_ **Types of proposals** Subjectively speaking - only Proposal 4, Proposal 5 & Proposal 8 look to improve the actual state of the subreddit. \- Ensuring people do not feel compromised by tipping will improve the community spirit within the subreddit; \- Incentivising voting will directly improve the health in ensuring that people's views are taken on board; and \- Rewarding quality posts is a better way to have a better subreddit as opposed to taxing low quality posts. The former will have people generate better content, the latter will leave an empty subreddit. \_\_\_\_\_\_\_\_\_\_\_\_\_\_\_\_\_\_\_\_\_\_\_ **Concerns of our voting system** My biggest concern is that although all MOON holders should vote in their best interests, big MOON holders (potentially including Moderators, unsure if they are allowed to vote on proposals) sway any proposal significantly to the extent that they are immediately unviable even though the majority of voting population are positive towards it. I direct you towards Proposal 2, Proposal 3, Proposal 6 & Proposal 8 where large MOON holders overwhelm the voting and make any proposal improbable. When MOONS were released, it was stated we were able to be democratic in our ways. Each individual MOON is not a voter, each individual person is a voter. Like traditional politics, we can restrict our voter population if you wish (minimum karma amount, minimum age) but this is just pure capitalism. This can create a model even worse than traditional politics, imagine the people in your country would vote with their net worth? Bill Gates and Jeff Bezos vote on an agenda that suits them, the rest of the country might as well go back to sleep. \_\_\_\_\_\_\_\_\_\_\_\_\_\_\_\_\_\_\_\_\_\_\_ **Potential solution** \- Proposals are still voted on a MOONS basis so that a proposal is only passed if there is a simple majority in MOONS above the minimum threshold \- Should a supermajority in individual voters (potentially 67% of people) vote for a change to the status quo, a simple majority in MOON votes is no longer required (potentially 35% - 40% required) \- If required, we can create anti-alt measures such as a requirement to have contributed to the subreddit for one period (i.e. even if they have been making negative karma requirements, as long as they have been in the subreddit for one month they can vote). All the numbers in my solution are arbitrary and could be flexed to create a better solution. If we were to have this current solution in place (and the current proposals were to achieve minimum voting threshold): \- Proposal 2 & Proposal 3 would be extremely close to passing (with between 34% and 35% of votes and a supermajority) which would mean that with some tailoring we would be able to re-propose this and pass it next month; \- Proposal 6 would pass as it has a supermajority in voting population and a MOONS voting of above the adjusted threshold; and \- Proposal 8 would not be impacted by this as although it is swayed largely by large MOON holders, it does not achieve a supermajority in voting population. \_\_\_\_\_\_\_\_\_\_\_\_\_\_\_\_\_\_\_\_\_\_\_ If you made it this far, I humbly thank you for reading my ramblings and if you have any thoughts - I would really appreciate them to see if we should take this further!",12
1616511054,[https://twitter.com/nickcarter/status/1374347860834062340](https://twitter.com/nickcarter/status/1374347860834062340) ADA gets the coveted Backstreet Boys endorsement. Gg other coins.,12
1616537892,LTO still going,12
1616485472,“a friend of mine” yeah right 🙃,42
1616484988,![gif](giphy|Ae7SI3LoPYj8Q),25
1616457914,Yeah it absolutely should have been a governance decision. What is the purpose of moons if not for decisions like that?,30
1616458692,Shady as fuck and a blatant abuse of the mod position to make a buck.,26
1616458210,Should have been a proposal. Not sure why people can just email mods and get shit passed without public vote.,17
1616459093,"And fix the loyalty badge problem please. I should not have to re-equip it after un-equipping because it automatically applies itself every few hours regardless of how I feel lol. I know this isn't as important but it has been a problem for months on a product with just 4 total features, I feel none of them should be broken.",5
1616516369,But mom I want those returns NOW!!!,8
1616476306,And to top it off they even lock off the thread disallowing actual discussion on the proposal. It just reeks of corruption.,20
1616476590,"I have posted about this too because it is an absolute joke but, i am sorry what? > The mods already get something like 20% of the MOON distribution. Is that an actual joke? I assume they earned them like everyone else, being a mod means you were likely hear from day one so already earned a ton and generally mod comments and posts are upvoted hugely. But if they actually get that - then what the fuck. So they get paid and can already game proposals due to their huge amount of moons, and now when they feel like it they can decide to force through whatever they want and pretend it was a 'desired' feature. What a pisstake, and zero accountability",13
1616477221,ditto lol. everyone should just boycott the sub premium at this point.,12
1616482272,![gif](giphy|d5mI2F3MxCTJu) Wake up. Checks chart. Back to sleepy. Call me when dip over.,13
1616484117,I love coming to this sub when market crashes,10
1616538355,"Hope you feel better soon mate, had it start of this year, absolute worst",5
1616521429,You will thank the shillers here for your long term gains,7
1616463458,Load up on Top Ramen and find shelter brother.,12
1616516578,I feel nothing at all anymore.,6
1616508478,"its just pain, no gain",6
1616531009,Yeah it's really important to not put too much weight on what strangers online say.,8
1616459929,Both!!!,11
1616460598,Yes,11
1616460095,Both,8
1616460303,Seems there are a lot of people that own both.,8
1616460303,ALGO,6
1616464554,You can re-live history,7
1616465226,Also a good chance Matic/polygon is the layer 2 choice to power the new uniswap V3. So much in the pipeline for Matic.,7
1616519266,Probably all of us tbf...,6
1616524755,Every time ![gif](giphy|32mC2kXYWCsg0),6
1616464524,Member trying to break 40k? I member...,9
1616483010,"I know this may sound counter-intuitive, but when the market is red, it is the best time to read the charts and plot your moves. But you're the best judge of your situation, and I hope things turn out OK for everyone. ![gif](emote|snoomoji_pack|snoo)",8
1616465224,For me it is IOTA,7
1616486302,"In a few days they'll be calling again, begging.",7
1616507243,Always.,8
1616507519,"It's destined to go to $1, hence the name.",9
1616522642,MUST BUY EVERYTHING!,4
1616522668,Yep. Unreal. I feel like everyone except me is making millions.,5
1616497977,People must be liking both !,6
1616506506,"Buyers will pay more and sellers will ask more.  Price rises, as those two things continue to gel.  What causes it, bots, market conditions, chili farts.",5
1616508451,"I would like to read your comment but Shrekcoin is on sale rn, be right back!",5
1616508618,until Kebab moons +4000% :P,5
1616519402,![gif](giphy|inyqrgp9o3NUA),7
1616519372,Bright future,5
1616460807,I think this is where i would honestly vote to not allow premium accounts to still abide to the karma and time gate rule.,8
1616461058,"That happened right after I paid for my first month. Now I feel like every scam account is gonna look like mine. I kinda wish this didn’t happen as well, people shilling clearly don’t have any problem spending money to buy accounts to post.",4
1616461583,Sometimes xlm seems to just lay there but other times it lays strong like a Boulder.,5
1616477825,"what, you need to pay moons to enter now?",5
1616480631,"""I just need to double my money...then I'll be happy"" lol :D",7
1616507371,Even if it dipped another 30% we'd be fine.,5
1616522875,ok if it doesn't reach that price I'm coming to you for the difference,8
1616523927,New ATH after new ATH after new ATH.,5
1616461688,I entered the crypto market 2 weeks ago and I'm still green. Wish I was just getting in today. lol,9
1616465204,Right here - watching the SIAE traffic with the newly issued ASAs. Big NFT announcement coming. &#x200B; Huge influx of assets is related to this: [https://www.algorand.com/resources/blog/siae-partners-with-algorand-for-efficient-management](https://www.algorand.com/resources/blog/siae-partners-with-algorand-for-efficient-management),8
1616459622,*there is no fiat left for this move*,10
1616470572,Seed phrase or it didn't happen,9
1616479245,That thing is full of shit.,4
1616482559,"It is accounting for the genesis airdrop of anchor (which was 2500% in a day), it will adjust down over the course of the month",7
1616520721,You got a car and house? Nft or real? :)),5
1616529934,"The general consensus is that if/when a bear market comes, an alt heavy portfolio will get utterly obliterated. How you allocate your portfolio is based on your personal risk/reward goals though.",8
1616531081,I keep at least 50% on BTC.,9
1616529898,"Depends on your own risk tolerance. If it's promising ALTs, then why not. If you're just chasing highs without knowing what you're even putting your money in, then that's a bad move.",7
1616539372,"Medium is basically Youtube for writers. Creators earn money by the reading time of viewers. So if something is trending, they will make more contents about it",5
1616471043,Mac: Hey Farva what's the name of that restaurant you like with all the goofy shit on the walls and the mozzarella sticks? Farva : You mean alt season?,9
1616481721,It is still better than the Lira,9
1616481709,Well btc might go up 30%-40% over the next weeks. The lira won't.,6
1616465907,What is the major benefit of this group using Algo?,5
1616467919,In 2017 alts pumped 20-40% everyday for weeks. Literally,8
1616472478,CUM,9
1616472304,SHT,5
1616472314,ThotCoin,5
1616479531,![gif](giphy|7TdN6y8lUl5Qs),4
1616500468,"me: woo, i can buy 2013 audi already, let's use this leverage thing and make it a 2018 audi, real quick. 3 days later, i can buy 2005 audi.",4
1616520402,"LTO is a solid pick, it's not vapourware, it has a solid use case with loads of paying customers. I can't see you regretting it in the long run!",6
1616529496,Check in your mom’s nightstand. You’ll find plenty.,8
1616529865,Don’t wash them and you will have your wish,6
1616538451,Don’t need to do taxes if you just hold forever ![gif](giphy|d3mlE7uhX8KFgEmY),8
1616538418,What the IRS doesn’t know can’t hurt em.  *they know*,7
1616494784,"It’s all fun and games until he really does eat his dick live. Then the investigations against Reddit start, the news reports of this vile internet site that forces good kids to eat dick. This is just the beginning.",7
1616516182,"Hi there, John!",7
1616493528,Good luck eating your dick bro.  I'll be over here not doing that.,6
1616461774,Me theory is that people are stupid and sell these two at the same time because they're alphabetically close.,16
1616494586,"Can confirm, I shat under my son's pillow before he went to sleep and we woke up to a fat stack of dentacoin.",11
1616494391,"Can confirm, when I asked my dentist if I could pay in Dentacoin he looked at me weird. We're still early so it's a good buy!",6
1616460885,Good project that’ll gain traction once the game actually allows what they’re selling to be in the game. I’m not aware if any timeline for their games though.,5
1616461812,Buy the apple tree not the apples,12
1616462128,Buy VET and generate VTHO,11
1616466295,I am also a fan,5
1616468478,Step 1: open your vault,5
1616477757,Sell kidney to buy more crypto....buy kidney when gains realised....legend,6
1616496791,It's 78 now right?,6
1616497572,Ethereum right?,5
1616498099,"The issue is with Google Android, other apps are also impacted not just binance. Google releases a statement earlier today.  You need to update ""Android Web View"" and ""Google Chrome"" on your phone.",8
1616499762,Link will rise up again,6
1616500300,"Can confirm, mine are papermaché",5
1616501478,Please stop talking about my transfers. Just setting aside a rainy day fund!,5
1616518177,Quick! Start an upvote comment chain! YOU GET AN UPVOTE! And YOU GET AN UPVOTE!,5
1616522590,"Mostly red, some greens, LTO ath, One moving up",4
1616529555,I can't wait. They are gonna be my first moons got based on my contributions!,8
1616523162,I pet some random cat for 20 minutes. Best moment of the week other than Harmony stuff.,5
1616507016,lets fucking go bro im so pumped i yolo’d a very large amount into ONE during the dip today,6
1616467226,[Alt season noises],5
1616473128,alcohol,5
1616483705,You guys have hobbies outside of crypto?,5
1616487423,Like every other day?,5
1616490785,Nice big V. V FOR VETdetta,6
1616490939,Don't try to find a rational cause on an irrational market (and I'm not talking only about crypto),9
1616498281,F...,5
1616513964,You are healthy and normal.,9
1616519993,Atoreum to moon....🚀🚀🚀,5
1616536946,One hasnt been haha. But most do long term. You are going to get random pumps but I feel like in the end Bitcoin brings most down,5
1616537105,This weeks bullshit will be a very distant memory by next week. 60k back on the menu.,7
1616543474,Its correcting for like the first time ever lol.,5
1616470002,VET if you want a 2-3x  LTO if you want a 5-20x,6
1616516519,VET,7
1616462512,LTO!,6
1616459379,[deleted],17
1616459650,Two of r/cc's favourites. 50/50,5
1616459631,VET,12
1616522786,I spent the last two weeks making big boy choices on my shitcoins. Consolidated any high cap coins like ADA into my El Tio sans a few defi moonshots. I really want LTO to take off for a quality of life perspective. I think it has a real use case too.,6
1616460020,Have you tried putting it in rice?,10
1616460087,"Working properly, move on.",9
1616460306,You just need to turn the market off then back on again,7
1616460512,Buy the new dip and repeat until price goes up.,5
1616460418,"We're still here, just observing. Kinda like XLMs been doing on the market since early february.",7
1616460639,"I’m still here, just got a little sick of XLM actually becoming a stable coin. But I’ll still hodl, if I sell that’s when itll go up.",5
1616475718,"""Oh shit, we made an unpopular decision, how will we tell the people?""    ""Easy! Just don't allow them to talk! No negativity = we did well!""",14
1616463453,I give this a day to flip lol,9
1616462689,![gif](giphy|S9iMXx6Lqrr5mJoMxC|downsized),5
1616460848,"Crabpeople, most likely",15
1616460870,"Funds finding their way to the stock market would the logical guess.  Alternatively it could be a self fulfilling prophecy; people anticipate a Monday dip, so they pull funds, which in terms causes the Monday dip.",6
1616460981,[deleted],5
1616461177,Solidity,7
1616460875,Python.,3
1616463737,Why would you sell IOTA? Everything is going according to their plans.,6
1616471073,You jinxed it =(,5
1616472083,Harmony ONE,11
1616471228,"Topping off my algo bags, may add some others. If we rlly go dipping I’ll snag some more eth and btc as well.",4
1616471252,no morefiat to load up T\_T,5
1616474799,"Don't worry, tomorrow I'll be able to move some funds around and buy 100,000 sats. Better load up now friends.",7
1616481413,Vet!       ^^^Disclaimer: ^^^I ^^^don't ^^^hold ^^^any ^^^other ^^^alts,6
1616481559,ROSE and ALGO look very cheap now.,3
1616481887,ALGO or MATIC.  XLM has become my new dollar since it just... So stable right now.  So maybe that.,4
1616486890,BTC and ETH,8
1616486819,"ADA, BTC and some VET",5
1616493486,"If you buy spring onions (scallions) and leave some of the white part with the root after you chop them up, you can grow another scallion from that to put in your ramen another day.",5
1616496699,LTO imo,6
1616498305,"Ever, highly likely.  This year, impossible.",4
1616503389,"good work, /u/anus_lips",6
1616506357,I really believe the big institution investment brought a lot of traffic to BTC apart from their actual investments,4
1616509016,To them moving 12000 is the same as you moving 0.003 ahah,4
1616512514,"Sometimes, the blood of the willing, is donated to the pool of the everliving. If I do anything new, I always do a test amount.  In the case of ETH moves, that gets expensive, BUT, I'd rather lose $5 + $20 in fees, over $5000 + $20 in fees.",4
1616519357,I got into One from people posting here,6
1616520347,Thats literally the most normal thing you are gonna get in this space my guy 😀,7
1616527992,"If a good portion of traffic from uniswap alone moves to layer2, it would likely have an impact on the entire network and lower gas all around to some extent. Looking forward to seeing some real high liquidity L2 adoption.",3
1616528219,"Of those, ATOM/LINK if you're talking for at least a year+. LINK continues to seem like it has a strong stranglehold on the oracles market, with no sign of that easing up.  (Honestly the only way I can see it happening is if a non-solidity supporting network ends up blowing up with their own Oracles platform getting established before LINK can pivot onto their network) ATOM has had multiple SDK-based chains hit the top 20(CRO/LUNA/BSC) in the past few months, with more major ones on the way, and a ton of main-chain updates still slated this year. MATIC while neat, probably will hurt after ETH 2.0 release if it makes the subnet kind of irrelevant, and it's still yet to catch on yet as the main L2 solution for ETH 1.x. ALGO/ADA are a little more moon-shot-y.  They could blow up, or they could fizzle out/never really become truly relevant market players in terms of dApps/etc.  I don't really feel like the cards are coming up ADA/ALGO at this juncture, given the way the dApp scene has been moving recently.  (Everyone wants Web3 Support, Solidity/ETH dApp support, ETH/BSC Bridges, and/or Cosmos IBC compatibility.  These two are 0/4 on those features currently.)",6
1616528487,ATOM. LINK as 2nd.,5
1616530216,Celsius pays 10.51% on USDC.  No minimum and they pay your gas fee when you withdraw.,6
1616530422,Dogs chasing squirrels. Nothing to see here,3
1616530872,"Its mostly 12 year old's with $9 in a coin, they get $1 profit, and all of a sudden, they're drenched in pussy just waiting to crash through their bedroom doors.",3
1616533092,People are a lot in streaming,5
1616536993,Level 5 crypto completed.,7
1616541141,It is pumped due to coinbase listing.,5
1616543571,"Hype, money laundering, easy money",7
1616538483,"""I'D BE SHOCKED IF ELROND DOESN'T HIT 50X THIS YEAR"" .... ok",5
1616459887,Are you not entertained?!,8
1616464904,ETH below 1700 is a really solid buy. Wish I held out a little longer but I bought at 1740. Still a good buy in my eyes,7
1616474056,"Them damn fibonaccis and whatnot, know what I mean?",6
1616473703,"Enhance, *Enhance* **ENHANCE**",4
1616535418,"Yes, except it should only be BTC and ETH. ADA, LINK and DOT are all relative newcomers in the top 10, which historically sees a lot of circulation if you zoom out a bit. Only the big 2 has a firm grip on relevance and I wouldn’t bet on anything else if your timeframe is 2-3+ years.",6
1616535215,Replace ADA with ATOM and yes.,7
1616534762,"Yes, actual shitcoins are not for holding, it's for immediate monetary gains in a short term period. A lot of people who held shitcoins for years and got rewarded did so because they were already at a loss. There are instances where your shitcoin graduates to altcoin but those are rare cases.",3
1616537330,This might be a dumb answer.,6
1616510887,Why doesn’t governance mean anything?,5
1616466287,"""Let's gooooo"" and ""to the moon"" are top contenders for sure",8
1616466961,"When people just post the name of a coin... Like, why?",6
1616466489,"Why is ""x"" dipping?",3
1616466700,"Coin name with triple rocket emoji, exclamation mark, exclamation mark, exclamation mark.",4
1616467164,I’ll give you one—hang on.....and done,5
1616468685,Lol true story. Too many dreamers here,3
1616521095,I own 9 cents worth of BTC come at me hackers,6
1616521348,They would count for next distribution wouldn't they? Snapshot was already released,7
1616521296,![gif](emote|snoomoji_pack|give_upvote),4
1616521377,⬆️,4
1616521525,How you doin'?,5
1616522054,"At your service, hope I get a free award to give out too",5
1616522253,"> *any* sort of rationality to it,   Considering that I have a cousin that buys SLT because it sounded like 'slut,' there's a tiny bit of hope. ![gif](emote|snoomoji_pack|flip_out)",7
1616529350,Wish you plenty my guy!,6
1616529354,Claiming them in the UFO is the best part! 🛸,4
1616537118,What does Options expiring mean?,2
1616539393,Nah man it's just a lot of different people here EDIT: Actually you're right,11
1616538796,thats why i love it best sub on reddit,4
1616539953,What a weird timing to pump against the market,7
1616541928,"Remember, markets are just the medium to move the money from impatient to patient hands.",6
1616471249,Clearly mods have interest in pump moon price since they received riddiculous amount of moons.,5
1616511392,This is a top signal if I've ever seen one,9
1616463809,Where do I find this Ramen coin?,8
1616461757,Lmao I don’t think I can adequately express how many times you will repeat this cycle 😂,6
1616468528,Step 2: Cut a hole in the box,11
1616491073,Talking about your dating life too?,5
1616461296,Look like crab 🦀 talk like people,5
1616530366,"Second this, Celsius is great",6
1616538864,He is probably talking about his cholesterol levels,4
1616535202,"Yes. 2017 bullrun I held  Substratum, QuantStamp, Lisk, carVertical, Civic, Eos, OmiseGo, PowerLedger and WaltonChain besides ADA and BNB. Guess what. Im down 30% even though BNB exploded and ADA is back at ath.... Most of the ones I really reasearched and believed in died. Some are still top 200, but will never recover.  Get 3-5x gains on lowcap shitcoins. Get out. Get top 10.Well... Probably not Thet or LTC or XRP....actually.... Get top 3 rather.",6
1616510967,Because they make their own decisions and do their own thing with or without community polls or discussion.,9
1616466522,Oh yea that’s a good one. Especially when the entire markets down.,3
1616522019,Its called investing in your future,5
1616537351,It means bad,5
1616540241,It did this last time it went into price discovery mode too,4
1616491106,Were you spying on me?!,4
