date,content,score
1616529446,LTO went round two,14
1616480846,"This dip is balls, so I'm upvoting everything in the thread. At least we can have moons if everything is dipping. Stay positive and we'll be back on top in no time!",19
1616457810,It's been a privilege playing with you tonight gentlemen /goes down with ship,12
1616459981,"Yeah, I would like to report a bug. So I did bought the dip but it keeps dipping further. I was told that it would go up again.",13
1616460050,I miss my XLM gang making jokes about XLM,11
1616475496,Mods got that little peen energy with the locked pinned post,12
1616480067,This feels like the end.   But then I zoom out and remember we corrected to 45k a month ago. 53k doesnt feel so bad now,12
1616507995,"Just panic bought another .5 ETH Thought the dip was getting away from me, there.",13
1616462609,[https://www.blockchaincenter.net/altcoin-season-index/](https://www.blockchaincenter.net/altcoin-season-index/) It's alt season bois,17
1616459958,Where you at beautiful BAT holders?  Make some noise!,11
1616466619,When the Sunday dip and Bloody Monday ain’t shit and we bout to have a crazy week🚀: ![gif](giphy|tlGD7PDy1w8fK),11
1616485469,"What a comeback, LTO!",11
1616497094,"Just bought LTO at 0,52 during the night, welcome me to the gang!",11
1616537407,https://link.medium.com/KSH2WcL2Reb And another update in the Cosmos ecosytem: Rainbow Wallet has upgraded for multi-chain support including BNB and ATOM for now. Rainbow is the official Iris Hub(IRIS) wallet and will be a Cosmos interchain wallet supporting more IBC assets over time.,11
1616459209,Guessing algo at 1.10ish is the best were getting unless 54k breaks hard,5
1616460718,"Hello people, whats your speculation on why the prices goes down every monday (US time I think, its tuesday in my timezone) Wild guesses are welcome im curious about your opinion",5
1616460809,what's a good programming language to learn to make blockchain and crypto apps?,5
1616461278,Uh oh. I just got my bonfire started and haven’t checked the portfolio yet and y’all making me nervous😅😅😅 *closes out app slowly and sacredly*,4
1616462609,"Pfft, you call that a dip?",5
1616463288,Almost sold IOTA but then I canceled my buy order. Feels great rn.,5
1616463759,CRO green on the day now,4
1616464279,In the midst of a (very small) pullback all you can see is the sky falling. When it's pumping you wish you could go back and buy more. If you are long these are the times to pump your profits.,4
1616464329,"Do you guys feel like we're in the Alt season? I felt we were, but keep seeing comments saying ""Alt season about to start""",4
1616464725,i feel like right now BTC is walter and our altcoins are donny.   Fuckin' hate walter.,5
1616464729,Did anyone manage to get in on the casper token ICO ?,5
1616464831,IOTA decided the dip is over,3
1616467461,"Looking for a new project on coinbase to pick up during this dip. Current bags are 30% UNI 30% Eth 10% BTC 10% LINK and the rest is spread between REN, ALGO and MATIC.",4
1616468178,So stoked to finally pick up some DOT and stake on Kraken!,3
1616468355,"Holy Shit IOTA at 1,70 what the heck is happening",3
1616468819,Next month is the anniversary of moons right? Do you think we will get an update?,4
1616469635,What is your favorite shitcoin and why?,5
1616470449,deepbrainpain pulling a denta 2.0 ? &#x200B; ps: just realised DENTA and DENT are TWO DIFFERENT THINGS,5
1616470927,"Ok dip, I bought. You can go back up now.",4
1616471107,What coins are you loading up on this dump?,4
1616471342,lol every alt coin I bought early morning during dips are dipping more,4
1616471418,"DCA’d the dip,.... keeps dipping, see you tomorrow dip  😅",4
1616474566,"Hoping some whales wake up, see the price being so low and buy/store a ton :p",5
1616475998,I prefer when it goes up.,4
1616476968,"A perfect night for me to buy more ETH. Buy up now, lads! Seeing red isn’t a bad thing.",3
1616477160,So.... this looks like a good time to buy a lot of crypto lmao,4
1616477183,"Jesus, dip has no chill",4
1616478116,Buying this dip feels like catching a falling knife,4
1616478293,Hellooo Dipness my old friend...,4
1616481203,"FTM still up a bit on this very red day, wow. My sweetheart ROSE fell down a cliff though. Just bought some ONE as it looks cheap.",5
1616481260,What alt in your portfolio do you have the highest hopes for after we rebound from this dip? Shill me,5
1616482075,"Augur be like, that’s a cute lil bear market you have there.",3
1616482639,"Coinbase, Nexo, and Celsius please list USDC-Stellar already 🤬",5
1616482933,Its my fault. I opened a leverage long,3
1616483040,"Bored of these red dildos, time to change colour please",3
1616483234,its fine. tomorrow moons for everyone.,5
1616483313,I guess the gift for my cake day was a juicy dip,4
1616483647,Good morning to all my fellow uk coin holders (and everyone else)  ive been up early motivating these coins to go up so you can have green days. Its not much but its honest work,3
1616484343,Shout out to THETA for keeping my portfolio green today.,4
1616484468,So I guess my lambo needs to wait in the showroom for a bit longer,5
1616485494,"Up 30% on TFUEL, it's just nice to win one.",5
1616486242,Great day to DCA!,4
1616486245,"First day working from the office in month's, I JUST WANT TO WATCH CHARTS ALL DAY",4
1616486635,What’s everyone buying on the dip?,5
1616487698,"during dip like this, do we still shill shitcoin or do we hold hand and cry together? I prefer the latter",4
1616489486,What are you buying right now and why?,4
1616490166,Last time I bought the dip it dipped like 3 more times..  I'm just gonna buy a little bit for now,4
1616490186,[deleted],4
1616490896,Looks like everyones over getting anxious about dips now.  Chat here is relatively cool.,4
1616491037,"Sigh, I wish I had more fiat to buy this dip, dipping so hard near the month's end is not nice, BTC..  not nice at all.. I manage to buy a couple more coins but nowhere near what I wanted... I still have my ""emergency reserve"" which I almost used thinking about refilling it on pay day, but I managed to restrain myself saying I'm not an addicted gambler buying every dip 😂😂 but if it dips again bellow 53k I'm losing it, YOLO after all...",3
1616492387,What is the link to the site that counts the number of times coins are mentioned in this thread?,4
1616492867,Anyone manage to buy LTO at 51c this morning? If so you won this dip.,5
1616492902,Well I can’t afford hot dog slices in my ramen anymore. It was nice while it lasted.,4
1616493663,You call that a dip?? Didn’t know BTC was such a paper handed weak ass bitch.,3
1616493737,How's Pancake Swap? Has anyone used it? How does it compare to Uniswap?,4
1616493821,"Whenever I think of cryptocurrencies in general, it reminds me of ""credits"" used in Star Wars as intergalactic currency",4
1616494932,https://www.youtube.com/watch?v=c4CVKbVtTsc The answer to 90% of questions asked on this sub.,4
1616495227,"Was wondering, do posts in this thread actually count towards karma for Moons?",5
1616495640, I sold..  my car to buy more ETH !!,4
1616496637,[deleted],4
1616496647,Random $250 to stack more BTC or eth. What would you do?,4
1616496911,Cheap crypto is good crypto,5
1616496917,Cake lookin tasty,3
1616497459,"Is it possible for ethereum  to hit 10k a coin ? Possible , highly likely, unlikely, impossible  ?",4
1616497521,"Had whale alerts for sys vib stmx doge(still whale heavy) data lit 1inch and neo Check whale reports, just raising attention.",5
1616498500,Is it normal to be suspicious of coins with low circulating supply percentage?,5
1616498807,You miss 100% of the dips you don’t buy,3
1616500971,"As someone whos only just getting into crypto, these dips are like time traveling. I get to go back in time and buy at prices from weeks/months. No 88mph required.",5
1616501155,Well if this is the case then I hope it lasts until Friday so I can drop my paycheque on these dips. Just in time for it to rocket up on the weekend,4
1616501497,NICE to see this moon poll pass! &#x200B; [https://www.reddit.com/r/CryptoCurrency/comments/m7ehzz/proposal\_5\_bonus\_moons\_for\_anyone\_who\_votes\_on/](https://www.reddit.com/r/CryptoCurrency/comments/m7ehzz/proposal_5_bonus_moons_for_anyone_who_votes_on/),4
1616502011,If this dip is still around tomorrow I’m buying the absolute shit out of it,4
1616502124,Just put my stimmy into ETH and ADA. The future is bright!,4
1616502641,*looks at portfolio this morning* I love the smell of napalm in the morning.,4
1616502827,Everything’s red but at least my orders for ETH at $1665 and AAVE at $327 filled over night.,4
1616504124,Go to the r/dogecoin and check new posts. Some cringe weird stuff,5
1616504691,So proud of myself for buying almost every dip and not panicking. April is going to be an amazing month for us,4
1616504989,Crypto is a machine that turns time into money. Patience while hodling is valuable!,3
1616506266,Realistically where do you think btc would be at right now if it wasn't for elon musk and tesla investing in bitcoin? It makes me wonder without anymore institutional news can we get to 100k.,3
1616507096,That ANKR bounce back lookin nice,4
1616507796,is it safe to come out yet?,5
1616507878,"Okay Crypto God, we're all ready for alt szn  🙏",4
1616508795,[deleted],4
1616508862,"I get sweaty palms just moving 0.003 BTC from an exchange to my wallet, imagine moving 12,000 BTC lol",4
1616510808,sneak peak at an AR display case for VEVE collectibles https://www.instagram.com/p/CMvSlj3HvUn/?igshid=1gah92vw0jh5q the more I see the more bullish I become,3
1616511060,"don't worry, HODL",3
1616512066,I’m salty today as I fucked up and sent dai to a Xdai wallet. I’m trying to see if I can recover $ through exchange but why is that even possible at this stage of the game? The transaction shouldn’t be allowed to send or should fail If the to and from addresses don’t align. Right?,4
1616512163,"I felt like I was in government when I was voting on the moon proposals. Next stop, The White House!",4
1616514768,"Verasity patent has been issued as of today. Great news, hope it will push the price a bit more",4
1616516963,What are you doing step VET? 😳,4
1616518124,"You should invest in Bitcoin, it’s a solid project with great potential for growth. You heard it here first.",4
1616518231,The LTO interview is today right? Since 50 minutes ago if I'm not mistaken (17:00 CET). Can't seem to find it yet though. Anyone been watching and can deliver some good news?,4
1616519193,"No way this daily will reach +10k comments. I miss the heady, bullish days of.. Um, like a week ago",4
1616519250,"So what’s a good source for news? ONE and Theta were not even on my radar before I saw them explode. I would love to be ahead of the curve, and I think I am just lacking good sources of information. Any recommendations?",5
1616519890,I got 6 alts last 2 weeks. Guess how they're doing? 3 I picked myself with some research: Shitting the bed.  3 from Reddit and social media: Blasting off to planet Mars.  I'm probably gonna stop picking my own.,4
1616519984,Just wanna hear ur guesses. What would happen if LTO gets listed on Coinbase? x3 or more would be my guess,3
1616520174,It’s a little strange that BTC has recovered a bit but most of my alts are still down. I guess it’s not strange 🤷🏻‍♂️,4
1616524940,"I downloaded Trust wallet and figured out how to swap my coins to it no problem But i tried swapping BNB to Smartchain, it took my BNB and now BNB and Smart Chain have values of zero. Anyone know what i did wrong? Can i recover my BNB or did i screw myself",4
1616525486,Hot take: Polkadot should have a higher market cap than ADA for the current state they are both in. Someone convince me otherwise,4
1616525810,I FOMOd big into SPI 🤦🏻‍♂️,4
1616527243,Litecoin is going to get bounced out the top 10... damn.,5
1616527421,"I had 0.3 bnb in the bnb vault at binance until a few days ago, but logged in yesterday and saw it was practically gone, now at 0.05. I can't see any kind of transaction log that would explain this and support hasn't gotten back to me yet. Has this happened to anyone else? I hope I'm just being blind here..",4
1616527741,"Uniswap V3 launching on Optimism in May! Gas fees will be a thing of the past come May!! Every exchange is hereby on notice.  Oh, and the technology will need to be licensed so no copying and pasting the hard work of actual game changing coders. Suck it binance.  https://uniswap.org/blog/uniswap-v3/",4
1616527831,Do people here really care about moons so much they are so scared of stating unpopular opinions? My my my. Not good.,4
1616527945,"Posting this again for those who didn't see it earlier: For anyone like me waiting for the LTO Network interview with CryptosRUs, we're gonna have to wait a little longer. Interview held today as scheduled  [but will be released next week](https://i.imgur.com/4Gp9Noe.jpg).  If LTO keeps this current price movement up 'til then I'm sure it will get a whole lot more attention!",5
1616527990,"Best long term hodl?: Link, Ada, Matic, Algo, Atom, or other on Coinbase pro ?? Or just more BTC and/or ETH lol",4
1616528335,"Tried typing MATIC in the browser word search for this thread. Only thing that came up was someone said ""automatically"" Where is da luv? :(",4
1616530028,What do yall think of the 9% interest rate for USDC on voyager. Minimum of 100 USDC to be eligible,4
1616530115,Anyone else patiently waiting for Rocketpool ETH staking?,3
1616530368,"its funny how the mood of this discussion goes from “ITS OVER, BEAR MARKET INCOMING” to people going back to shilling their coins 😂",4
1616530676,"[JobsForNano](https://np.reddit.com/r/jobsforNano/) subreddit is slowly growing. If you are intrested, check it out.",4
1616531560,Binance logs out way too much. It's getting really annoying.,5
1616531811,Ready to convert my alts into stable coins,4
1616532825,Why is THETA pumping so much? Isn't it just a streaming platform?,4
1616533084,What is your 5 year price prediction for LINK?,3
1616536317,36hrs later there is still no sign of my Nano transactions ![gif](emote|emo_pack_1|arrow_down) I've always been a big Nano fan but this is pretty shit,4
1616536717,Im dead inside. Fam is no more. Slap me roll over pinch me spank me. Dont care,6
1616537676,We're all in this together Once we know That we are We're all stars And we see that We're all in this together And it shows When we stand Hand in hand Make our dreams come true,3
1616541066,Is STORJ legit?,4
1616541860,"Pleasantly surprised to wake up to see that TRAC and LTO, my only two holdings, have bounced back so well despite BTC's shenanigans. They've both been doing pretty well lately and every time I think ""oh well, we might be going down for a bit"" I've been surprised to see them bounce back quite quickly the next morning. It's like the opposite of 2018 haha.",4
1616542615,Goodnight all o/ see you in a few hours,5
1616543346,I still don't get the hype for NFTs. Is it just rich people having nothing better to do than to throw money at digital products that can be looked at for free by anyone?,4
1616543797,GO EL TIO! IT'S TACO TUESDAY!,4
1616513947,All I want is to never have to work again. Is that too much to ask?,16
1616538315,"Just a reminder for anyone that watches Bitboy crypto:  Don’t watch him.  He is not here to make you rich, he is here to pump his bags. Edit: format",14
1616458756,Can't tell if we're about to breakout or plummet.,9
1616463841,"Do you ever check on the prices of projects you sold and have zero intention of buying back...just to see how good or bad they are doing? I just need to learn to let go and move on, it almost feels like looking at an ex girlfriends Instagram.",10
1616464613,"Scooped up some ETH at $1680, LUNA at $19.50, and AAVE at $340. Didn’t quite catch the bottom but feel pretty good about it.",11
1616466381,"If I hadn't already used all my crypto monies on the first part of the dip, I would have used it on the dippier part of the dip",9
1616473647,Sometimes when I’m bored on slow days I like to bust out the fancy chart tools and pretend I know what I’m looking at.,10
1616534320,"Isn't putting 20% each in BTC, ETH, DOT, ADA and LINK better than chasing shitcoins if one is looking to hold for 2-3 years?",12
1616535434,Tomorrow is moon distribution!  ![gif](giphy|3ov9jEKWFGKZVYsxPy),10
1616537227,"I see some people saying ""This might be a dumb question..."" and then ask something. Well: you can research before you ask, yes. But you can also simply ask. If anyone takes the time to answer, perfect. But don't get shy to ask. We are all here to help each other. Do not leave your question unanswered!",11
1616470487,"Shill: Its altseason!!! Me: Checks app, some of my altcoins are down 20% while Bitcoin is down just 5%. Yeah definitely feels like altseason, you fucking oaf",15
1616510788,"I see they’ve unstickied that post and replaced it with a governance post. What a joke, y’all mods just proved governance means nothing with moons yesterday why bother voting anymore?",15
1616466125,"What commonly recycled comment or phrase do you find the most irritating? For example: Dip for ants, blank to the moon etc...",8
1616466640,Can I trade like 20 bucks eth to someone for some moons? Never had any and not interesting enough to earn them ig lol,9
1616467028,Love you all. Who cares about dips when we have each other?! (I’m buzzed) 🍻🍻🍻,9
1616468615,lol people in this thread that think because the line went over the other line means we will suddenly see all alts jump 10x.,9
1616479146,Good morning from The Netherlands! Pushing towards the green!,10
1616480024,*chuckles I am in danger,8
1616480314,Europe. It's your fucking duty to save us all!,9
1616482319,"Wife: ""How much did you spend last night?"" Me: It... just... kept.... dipping.          Wife: "" And"" Me: I.... just...kept...buying... Wife: 🙄🙄 Me: It was cheaper than a bar tab and the hangover isnt death 😁",9
1616487335,Saw the dip and I picked up a bag of LTO. I’m a pretty big fan of the UN org/system and I was liking what I saw with the LTO partnership. Hopefully it keeps going up :) Edit: wow tons of LTO comments in here now that I scroll down. I swear I’ve had my eyes on this one for a few weeks! Haha,9
1616489599,"Something isn't right. Did I?...Did I?...Buy the bottom? Something smells fishy, and I showered yesterday",9
1616491341,"I've been using Pancakeswap a lot lately, but today I had to use Uniswap to buy something. I know BSC is not popular in here, but Jesus Christ, those ETH gas fees! I got into crypto because it felt like a way for a normal person to invest, without needing a lot of capital to get started. ETH is telling me something very different...I hope they get it sorted soon, because it's such a massive barrier for small-time investors.",8
1616501799,"May not be much compared to some people on here, but I finally, after months and months of DCA, have $3K USD spread across four different coins. Hallelujah!",9
1616503815,"LTO boinked back up nicely. Still red, as is the rest of my portfolio. Hodling continues.",8
1616506369,"You guys always talked about it. Technically speaking, we are in altseason now!",9
1616506945,look at ONE go its making me emotional 🤭🥲,8
1616516296,"Me and my pals have come out of lockdown in very situations, all heavily invested in crypto. I'm the only one with a mrs, so have decided to put my money and efforts towards saving for a mortgage with her and retired from doing dr\*gs. Lockdown has changed my life substantially, some good ways, some bad",9
1616521039,Hey guys just a reminded not to post amounts of coins/ dollar amounts on here.  You dont want to make yourself a target.  There are almost 2 million people on here that can view your amounts.,9
1616521256,Let’s get an upvote chain before moon distribution tomorrow!,10
1616522070,"I sold a bit of my VET stack to jump onto LTO yesterday. I think vechain still has a ton of potential but LTO's low ranking compared to what they've done so far made it too tempting to resist investing in it. If THETA can make it into top 10 while delivering so little, hopefully something like LTO can take off once even more people realize its potential. This is of course assuming the market has *any* sort of rationality to it, which isn't very likely lol",9
1616523063,Lto long deserve new ath and beyond!,9
1616527492,Market goes up 10% - XLM .40c  market goes down 10% - XLM .40c,9
1616529241,"Not even gonna front, pretty excited for my first moon distribution tomorrow, lol.",10
1616533875,Got my stimulus today.  Immediately put it to good use.,11
1616535544,"Good night everyone from europe, hope to wake up tomorrow in a green mood ;)",11
1616536979,"A record amount of Bitcoin options expire this Friday ($6B), previous record was at the end of January ($4B). The whales are circling, ready to fap off into the screaming mouths of those needing to exercise options. Fuck these gambling fools.",8
1616538601,**bipolar sub this**,10
1616539824,LTO pumping again 🚀,10
1616541668,"You know how EVERYONE says “I wish I had Bitcoin when it was X dollars”?! Well, nothing would’ve changed for the majority of those people, wanna know why?! Because your average person is IMPATIENT and skeptical at heart. If you would’ve bought Bitcoin at $1,000 and the second it goes down to $700 or so, what did a lot of people do? Sell. And maybe SOME did HODL...it gets to $2,000, wow, 100% return, SELL! Only a fractional amount would’ve kept hodling. I guarantee that!",9
1616471014,So any of the mods want to comment on the locked sticky thread and it's downvote percentage?  Pretty clear the users of the subreddit do not want paid shills bypassing spam filters and karma requirements for their profit...,13
1616537295,I am losing a lot of moons for posting opinions and jokes. This month I will have to pay reddit,14
1616540849,"I see a lot of Theta FUD.  Here is what you’re missing as to why this has stealthed into the Top 10 and why in a market of speculation and bullshit it offers way more than most.   1. The entire supply is in circulation 2. The token is staked/used to operate a node as part of a backend for streaming video systems.  Theta TV is not the end product it is a demo version of the system they will provide to other established companies. 3. Their system is patented 4. It runs on a two token system. Stakers earn TFuel (another top 100 token). This means the Theta token is not subject to inflation and yet produces a yield for holders.   5. tFuel has a use case: it is earned by those providing content and viewing streams on the platform.  It is earned through staking on nodes.  It can be used to run a low tier node on the system to earn more tfuel.  6. They have a legit team and advisors include YouTube and twitch co founders. 7. They have real partnerships with household names including Sony, google, Amazon, Samsung, to name just some.   8. For some reason those in Korea seem to realise this thing has potential whereas it is a sleeper in the west (where most of this subreddit live) 9. There is a mainnet v3 release in 4 weeks and like all coins in a run up to a mainnet, it’s pumping.  Hopefully this will encourage some of you to go and look into it before palming it off as crap because you didn’t spot it and you don’t understand the project.  Unlike half the top 10 I’d say Theta warrants a place there. I mean damn it actually has a working patented product with a use case and a fully circulating supply.  It’s delivering, which is more than can be said for a hell of a lot of the totally speculative crud that gets shilled in here on an average day. EDIT: typos. EDIT: I’m not saying this won’t dump hard when bull run ends but I do expect it to pop back up. EDIT: I’m not saying go buy it after it’s meteroic trend upward and this is not financial advice -  DYOR and make your own investing decisions",14
