date,content,score
1616484902,A friend of mine told me he sold btc at 42k dip and bought back at 60k and now sold at 54k. I think he completed the tutorial,92
1616457675,What are people's thoughts on the new r/cryptocurrency special membership change? Good for newcomers? Money grab? This is what I wrote on the pinned post before it got locked and had all the comments removed: > Shouldn’t this have been put up to a vote? $5 is relatively cheap for shills and pump and dumpers when they stand to gain so much more.,35
1616458534,"So we are going to have a proposal to veto that mod change to posting requirements right? (stickied - and locked). Mods can vote against it if they please, just buy the voting dip and show your displeasure at the precedent set by this kind of decision making, in a supposedly community driven, semi-decentralised governance forum My thoughts on it: https://np.reddit.com/r/CryptoCurrency/comments/ma9qe7/daily_discussion_march_22_2021_gmt0/grue0l7/",36
1616476072,"I can't believe some people have to hear this, but guys, if you want 1000% returns, you can't freak out about 10-20% dips once in a while.",37
1616475761,"The biggest issue I have with the pinned post is that all it does is show that MOONs have no actual value in governance, as they just willy nilly did that without there being an actual proposal and vote. It's blatantly an attempt to monetize the subreddit. The mods already get something like 20% of the MOON distribution.  It also seems like it won't stop bots/shilling at all, a shill isn't going to be put off from spending $5 to buy a membership for their bot/shill account to make it look more real Money corrupts all I guess",32
1616477024,"And I just cancelled my sub premium. Moons don’t mean anything, mods make changes regardless. I’ll miss the gifs but I’m not spending money supporting this centralized garbage anymore.",27
1616481925,hodling through these weekly dips ![gif](giphy|ksVugU85LoBk4),28
1616487640,"If you watch Jaws backwards, it’s a movie about a shark that throws up so many people they have to open up a beach.",27
1616483989,When BTC dips a bit  - OMG tHIs iS ThE enD - I kNeW thIS iS gOinG tO hApPen - sEll yOur NaN sELL yOur dOgs  Yesterday - bUy biTcoNnect it wiLL mOoN - wE gOiN tO hit 8TriLlion mArKetCap - sHill Me jEsus CoiN,23
1616484382,"Welcome to crypto club. We only have three rules: 1. If it's red, buy 2. If it's green, hold 3. If this is your first night... you *have* to buy",23
1616471646,Ethereum has been hurting my feelings for a month now 😪,22
1616485324,"no more FIAT to spend. diamond hands only from now on, wish me luck boys",22
1616531284,Man holding alts takes some serious conviction,21
1616471534,Can’t wait till I actually make money lol,19
1616538220,"Well, after spending the last 3 days unable to get out of bed, I've discovered that one of the surest ways to HODL is to get COVID. Be safe out there!",19
1616461742,Can’t keep xlm down! ...or up,18
1616465491,All my gains gone 🥲🥲🥲,17
1616471337,"Markets go up and markets go down, but the one thing that never changes is XLM at $.40.",18
1616465353,ALGO checking in with the crazy number of new assets issued for [https://www.algorand.com/resources/blog/siae-partners-with-algorand-for-efficient-management](https://www.algorand.com/resources/blog/siae-partners-with-algorand-for-efficient-management) today. Official Announcement coming tomorrow: [https://mobile.twitter.com/Algorand/status/1374084813339172867](https://mobile.twitter.com/Algorand/status/1374084813339172867),17
1616521229,LTO is shilled so much i bought some myself lol,16
1616520027,ONE is a fucking monster dude,16
1616463361,"What happens when you buy too many dips, and you run out of money? Do I live on the streets until I'm crypto rich? Plz help",15
1616482477,Is it just me or does this dip not bother anyone at all,14
1616464136,And VET is back over .09 as we make our way towards .10 and beyond!,14
1616499113,"*** Guys you don’t believe what I just witnessed**** Yesterday out of boredom ( was a bit high as well 🤣) I went to a  Pentecostal church with my aunt , at the end of praying session two guys start to go around to receive donation offerings but as they guys came towards us I quickly noticed that one guy receives cash and the other one had some sort of iPad and was asking for crypto donation. I was like damnnn this can’t be real .  Jesus coin to the moon Bullish 🚀🚀🚀🚀",15
1616501253,"Good day, gentlemen. May your green candles shoot to the moon today.",13
1616508360,Lol LTC is like a big wet fart so far,14
1616530363,I'm happy I didn't listen to the theta fud last week. I almost sold at 7$. Now I'm up 367% and hodling on ;),13
1616459767,To buy more ALGO or Cosmos?,13
1616464477,Crazy how you can read this thread from the bottom up and just see the overall sentiment totally flip,14
1616464774,Matic making a pretty quick recovery from earlier. B U L L I S H,13
1616466304,Rest up LTO. You got this 💎🙌🏼,14
1616504569,I think the biggest flaw of 90% of people on this sub is impatience. Patience is key to getting paid.,13
1616507635,The chosen ONE!,13
1616518839,Idk who the person was that put me up to LTO two months ago... I LOVE YOU,13
1616521082,Boom! New ATH for LTO,13
1616524302,Awaiting a pretty hefty transfer between exchanges. ITS SO SCARY EVERY SINGLE TIME. `someone hug me`,13
1616464323,"Bitcoin is at 55k, which is 10k higher than last month.",11
1616482864,Don't think I'll spend much time in the daily or checking charts today. Needed a break anyway. Good luck all.,12
1616500249,The dip hits different when you have fiat to spend,12
1616506728,"Finally able to buy ENJ in NY this morning.  Gemini has started offering ENJ, 1INCH, LRC, SAND, SKL, GRT, and BNT as of 90 min ago.",12
1616518719,Lto saving my portfolio. 1😀😀😀,12
1616524199,"[India, Bangladesh and Sri Lanka](https://twitter.com/ltovidt/status/1374412531112964106?s=21) are next to commence land registry using LTO network. Other developing countries will be starting this year as well. 2021 is going be huge for LTO. I’ve gone 90% LTO when it was .3. If it hits $3-5 this cycle, I will be able to retire at 26, one can only dream.",13
1616532403,"You mfs are gonna make me buy more LTO, aren’t you?",11
1616535582,"I started to learn developing on Ethereum, and now I’m nearly finished my project. It’s so exhausting but I’m also so passionate about it. I possibly found my new profession.",11
1616539527,"I'm a long-term holder on my coins. Not because I'm thinking of the long-term gains, but just because I don't wanna pay taxes.",11
1616465040,Nano is doing better today than anything else I hold.  🤔,11
1616465563,Bears it’s your bed time 🥱 the bulls will take it from here,10
1616479921,"Today i eat ramen, so that next week i can also eat ramen. I like ramen.",10
1616486222,Shall I put the Forbes interview on hold?,12
1616501803,USDT to $1.01 🚀,11
1616505941,ONE back in the green! ![gif](emote|emo_pack_1|dancing_wojak),11
1616507201,Still a good time to buy ONE?,11
1616518742,LTO🐐,11
1616519677,gotta love LTO,12
1616522583,The amount of FOMO I get just from refreshing this thread every so often is crazy.,10
1616528273,People cry over a 5% dip yet believe they would held BTC for 10 years over the waves and waves of crashes,12
1616528733,I was asleep for LTO ATH. 🥲🥲 happy and sad. Not long til $1  🤙🏽🤙🏽,9
1616531270,This community has been pretty great overall for me the last couple months. But damn I wish I had some crypto friends in real life...,11
1616532569,So good waking up to see LTO above 60c. Nearly hit 65c over night!,10
1616532949,"Imagine selling BTC under 6 figures, let alone under $69,420",11
1616470555,I'm impressed with XLM staying at $0.4,10
1616471438,soooo... what's the status of those optimistic rollups that everyone said would totally fix ETH's scalability in March?,10
1616477030,My dumbass bought stuff just two hours before the dip,11
1616479501,If VET ducks under .08 im fucking SPENDING dude,11
1616479624,Has anyone had any contact with scammers? I had one PM me pretending to be Pancake Swap support. It was a fun conversation.,11
1616490688,VET and ONE are just waiting for the green light to rocket,10
1616492437,"Financial advice of the day: If the market is crashing, buying the dip won't be helpful.      But if the market is going to recover, buying the dip will be helpful!    I am so helpful.",9
1616497812,Cake is on a run again 🥞🤤 staking cake to earn LTO is pretty cool!,11
1616500568,"Unwise financial advice of the day: Reading and learning is boring, just buy whatever seems to be going up.",11
1616506436,"Just curious, what causes the giant green dillies to start like with ONE right now? Surely not everyone just says GO NOW and it starts. Do the big money folks do this to start a quick pump and dump, assuming that people then FOMO into it?",10
1616506819,"ONE pumped abit, ENJ, ADA CHZ might follow Bullish!",10
1616508316,"I really wanna take crypto serious but why tf do there have to be so many shitcoins and tokens?? I mean, for example. Kebab. like wtf? Do they even do anything exepcept making me hungry again? With stuff like this it is not unusual most people call it a scam after all...",10
1616512586,One of these days we're gonna get a massive green dildo from ETH. One of these days...,9
1616512699,I thought we agreed we were gonna go up today,10
1616514020,[deleted],11
1616518101,LTO at it again! This has been a great month.,10
1616519246,ONE doing that thing again.,9
1616519733,"Just grabbed more LTO right before it pumped again, my heavy bag will hopefully have me retire early.",10
1616520138,"bought LTO at 0,52 today, what a good decision!",11
1616530092,Fear is contagious.,10
1616530233,Need...More...LTO,10
1616531211,Bull case: - ETH optimistic rollup - Uniswap v3 rollout - ADA goguen decentralization  - Coinbase direct listing,9
1616531265,So many shorts taken on btc  Please fuck off bears,10
1616534043,Time is on our side,12
1616536283,"Sorry hodlers, I bought some ONE",11
1616536380,"maybe it’s time to stop checking charts every hour. i don’t buy, i don’t sell, i just watch and do nothing with any event. lol",11
1616536968,"Buy the dip, sell at the next dip to assert your dominance.",11
1616537048,Tomorrow is moon day?  My first moon day! I’m excited because it’s all I’ve got.,9
1616460718,"Haven't been on this subreddit in 36 hours, but that paid barrier to the subreddit defeats all the purpose the karma rules have. Anyone can just pay to shill now.  Thomas truly has never seen such bullshit.",33
1616461456,XLM holding my line at +0.01%😂  *is all good doe*,9
1616461609,Anyone heard of the game Age of Rust. They run on Enjin and their chain/coin. It's a legit game on steam with great graphics and design. Uses NFTs (limited digital blockchain collectables) for upgrades and all sorts of things. Plus they have a huge 20btc in game treasure hunt. It looks awesome. Just wish I had a pc to run it. Looks like a good real in game use of Enjin and what it can do with a legit looking game.,8
1616475473,Which will happen first: BTC 100k     or...    Coingecko having a worthwhile candies reward?,9
1616477701,Anyone considered the fact that Reddit just opened up a gaping hole for legal liability by charging MOONs to post in the forum? They were keeping MOONs valueless for a reason... But I guess that just ended.,9
1616479805,That feeling when you were waiting for a dip and now the dip is here you wait for a deeper dip.,10
1616480454,"Wow its gettin ugly tonight. Unfortunately Im not up 200% like some of u since I only start in Feb so Im basically back to even now, maybe a little bit in the red. I just need one good run to make my profits and then it can drop all it wants.",9
1616482401,"Well, that sucks... Most of my previous week gains gone at this point, hope BTC is done skydiving 😂😂",10
1616482450,IOTA is saving crypto as we know it. Fucking legend.,9
1616482633,This dip today very strongly resembles the movement on Jan 20th 2021. The whole shape of that dip looks like this on the daily. I imagine we stay around this level for 10 days or so and then it’s go time!,9
1616485018,My magic conch shell told me to do nothing.....THE CONCH HAS SPOKEN,9
1616489754,Okay... fine...I’ll admit it... I’m down bad😅🤣,8
1616490401,"I swear to fucking god if you bought everytime the fear in this sub got so strong you could taste it, you’re a millionare now.",9
1616494507,"Ok America, over to you. /Aussie signing off",9
1616496689,"Lto looking really strong right now. Almost 0,6 during this dip is quite bullish.",9
1616499771,"https://sports.yahoo.com/covid-19-vaccines-vaccine-passports-060358407.html VET is the answer to this problem, and has first mover advantage in this space. Why would you sleep on it?",9
1616507100,"We're recovering just fucking fine, nothing to worry about.",9
1616511458,looking at the ETH/BTC chart makes me want to convert everything to ETH,9
1616518323,LTO 🚀🚀🚀,10
1616518726,Just hit portfolio ATH 🙌,9
1616519986,"For anyone like me waiting for the LTO Network interview with CryptosRUs, we're gonna have to wait a little longer. Interview held today as scheduled  [but will be released next week](https://i.imgur.com/4Gp9Noe.jpg).  If LTO keeps this current price movement up 'til then I'm sure it will get a whole lot more attention!",10
1616522216,Decided to buy some VET during this dip.  Hopefully ends up working out.,9
1616522775,LTO 1$ 3 days from now trust me,9
1616523829,LTO just keeps going!!! New ath,9
1616530250,LTO singlehandedly holding up my portfolio today,10
1616537088,Luna due for a correction but that's still a little bit of a Guh moment.,7
1616540166,Lol Jim Cramer is gushing about bitcoin. This is a good interview to share with your muggle friends: https://youtu.be/oqfAtMKu1wo,8
1616461625,"Keep calm and hodl on. At this point y’all should still be green unless you joined last week, in that case, keep calm and hodl on lmao",22
1616464495,Here for my ALGO holders. Where you at?,25
1616477931,![gif](giphy|VrcucT74UiM2k),24
1616459373,Wow! Just logged on and had a look at my portfolio.... no green in sight 😳 Time to stock up my ZIL and ATOM stacks ![gif](emote|atom2_emote|atom2)![gif](emote|atom2_emote|atom2),8
1616459478,"People wanted a good entry point for most their favorite cryptos, here it is. Buy the dips.",8
1616461571,"Late night Dutch advice: ✨ *Don't forget to stake your long term investments for free gains.* ✨ Sleep tight, world and beyond.",7
1616462069,All abooooard!  Take-off coming soon.,8
1616462515,I’m proud of you all! Mood has been much better than usual with this dip today. We are learning together to HODL!,8
1616466558,"If this NFT hype doesn't cause a bear market, I will be soooo relieved. (Referring to the digital art selling for stupid amounts of money, not the crypto tech that's got more going for it than just making Beeple rich)",7
1616469103,hey! at least XLM is still at .40!,8
1616469475,more like salt season,7
1616469622,you guys are going to think im joking.....but someone just sold me some bitcoin for under 55k. I cant believe it.,9
1616476774,Please convince me not to sell my ENJ....,7
1616476857,I have become comfortably numb (to the dips).,7
1616478104,This dip doesn't give a fuck,8
1616478994,Its alt season! Atleast.. thats what altseasonindex is telling me.,7
1616482432,u/anhowa have I lost the plot or has staking Luna on Terra gone from 9 to 40%,9
1616485924,I just sorted binance by 24hr profit and fucking dentacoin is top of the list.,8
1616488340,I wouldn't be surprised if IOTA keeps steadily growing over the next 5 weeks until the Chrysalis update. The Firefly wallet beta obviously was perceived very well already.,8
1616490641,+20% IOTA is nice on a day like this,8
1616502443,"Bedtime here in Australia for me, send my holdings to the moon for me America xx  Not asking for much maybe a 10x by the time I wake up? ONE/LTO/ANKR/ENJ/BTC/VET",7
1616502532,BTC never again below 55k! \^\^ This comment might age like milk.,8
1616505037,"I gotta say, ONE held up a fuck of a lot better than I expected during this dip.",7
1616506409,My first instinct is to buy when the market is down. ![gif](giphy|GW0qlzAvWK3pm|downsized),8
1616508314,About to quit my job to focus more on crypto! Or should it be the other way around...,8
1616508452,"Things to remember during the dip, find green alts on btc pair with ascending triangle, after btc recover it'll rocketship to the moon",9
1616519114,ONE just wants to have some fun,8
1616520339,Dam btc didnt stay under 55k long enough for me to liquidate my car and my house to buy the dip.,8
1616520375,"LTO making me kinda happy, LINK keeping me grounded.",9
1616522861,Only been in the HARMONY game 1/2 a day but already very pleased! Hope the market picks up and everyone gets winners.,8
1616529820,Is it bad if the majority of my portfolio is alts? Or should I convert more of them in BTC? Which is better in your opinion: more BTC or more ALTs? Sorry if bad question,8
1616529949,Harmony One recovering well compared to other alts,7
1616532800,Lots of talk on social about BTC supply tanking hard over the last 24 hrs on exchanges. Just less around and some big whales buying off Coinbase over the last 24-48 hrs.   Also apparently miners are now acquiring BTC themselves.  I'm wondering when BTC is gonna bounce really hard up based off of this.,9
1616538515,"Goodnight from Sweden! Runes are looking good for tomorrow. Cooked up some mead today and I invite you all to a gathering for the full moon profit night ceremony tomorrow evening. Until then, stay safe.",8
1616539032,"Life’s a dip, hodl it.",7
1616539182,"Why are there so many crypto articles from the Medium domain lately? For example, [this](https://celsiusnetwork.medium.com/the-ultimate-collection-of-celsius-customer-support-resources-vol-1-cbf7d147d875) and [this](https://mlevanduski.medium.com/have-you-really-missed-buying-bat-at-low-prices-81026dedfcca). I believe that Medium is a platform that allows one to self publish. Is this basically the text version of youtube crypto vloggers? Is there a reason why the crypto space seems to have so many of these? It's possible that I just haven't noticed Medium elsewhere.",6
1616540819,This bowl so good I almost forgot how bad today was,8
1616470790,Next person who says the phrase alt season is getting pistol whipped.,22
1616478315,"Protip for the noobs that got burned/are getting burned today: If you see day after day of gigantic gains all across the board, #THAT'S THE WORST TIME TO BUY IN FOMO buying is purely emotional and stripped of all reason. Your primate brain sees the gains, then sees everyone else rejoicing about their gains, then makes you go ""ooga booga me get gains too! ape together strong"" Look, it's rough and it happens to the best of us. That's just how these things go. But remember that any investment, whether crypto or stock, must be tempered with actual research as opposed to reddit upvotes and people swinging their arms about whatever the hot new coin in question is.  End of the day though, we'll be fine. The collective market is down and might keep going down for a while, or maybe only a couple of days; no one knows. All that matters it that more likely than not, there *will* be a recovery and the most savvy time to buy whatever you've been eyeballing is....well....during times like this.  It's a clearance sale, basically.",22
1616458799,"Oh no, it's a blood bath!!! * Once again the market has crashed, going all the way down to 1.7t. This is crash #126 of the month. * This crash has been caused by XLM trying to be more than a stablecoin and actually growing. This confused the market. * Despite the crash, I am feeling very bullish with the daily being above 10k comments again! Gooo green! * BTC fell down to a pathetic 54k. * ETH couldn't even stay above 1700. * BNB again gave rank 3 to hated Tether. * XRP is up... * THETA has almost climbed into the top 10. * VET almost broke 10 cents before it got punished due to XLM's destabilization. * ATOM below $20 again. It worked so hard to get above $20. Poor ATOM. :( * Big grower of late, Harmony, also decided to not skip out on this dip. * DENT didn't get dented by the dip, growing over 50%! * NANO climbed a little in value and left the top 100, then it dipped in value and came back to the top 100. * VET's little one, VTHO, decided to join the top 100 as well. * ""bought the dip"" most commented words on the daily. * Only 13 top 100 coins are green the past day, with DENT taking the lead by far with over 50% mad gains. * Almost everything red, with LUNA, SC and FLOW more than 10% loss. But many coming close to 10% loss. * In the top 500 we're looking at many many many more coins losing much more than 10%. BOTX lost another 35%, again a big loser. In my paper trading experiment I am expecting to have a $1000 paper loss. Stupid BOTX. How are you still even in the top 500? * The top 500 is also seeing a few big gainers, with AGA 45%, STEEM 50% and MLK 55% * Today's mental image is that scene from The Shining.",65
1616481299,"How much must it suck to be Turkish right now?  Lira declines by ~15% yesterday, move your Lira into Crypto all 'Yes, now I am safe from inflation', then have the Crypto markets proceed to tank 10% on you the very next day.  Ouch.",22
1616459962,ADA having a brutal day but thank god for ONE keeping me from sadness,7
1616465829,[deleted],8
1616467645,How quickly does an alt season generally pump the Alts? Seems like a metric shit ton of Alts have already pumped massively in the last 90 days.,6
1616469109,"Goodnight from America, you know what to do UK and Asia!",7
1616470246,Really curious what the average commenter here actually has invested in crypto $ wise. From the sounds of it I feel like it is either 50k+ or like less than 1k,7
1616471617,My algo and ada are like twins today lol,6
1616472048,"Congratulations! - You get to name a coin, what are you calling it?",7
1616472673,Anyone feel like shilling MATIC? I'm considering buying in but I just worked a 14 hour day and am too tired to research :P,7
1616479337,Lot of fucking bears lurking in here,6
1616479830,So we are dipping on a Tuesday now?,7
1616480683,*FUCK OFF BEARS*,7
1616480747,"Fudbots and bears crawling out of the woodworks like clockwork, always a sight to behold! The ciiircle of liiiife!",6
1616482588,Whos buying more VET?,7
1616484084,"Europe waking up, let's end this stupid son of a dip.",7
1616484962,"Woke up to IOTA taking off even more, I'll take it with days like these",8
1616485401,"Is there any serious, non-biased comparison of ETH and ALGO?",7
1616487037,"“This is ridiculous, who checks there portfolios at 3am....” *Oh boy Three AM😁*",7
1616490044,Wow Theta kicked Chainlink out of the top 10. Didn't see that coming!,7
1616491164,Vet doesnt dip alot but when it does i make sure to get more bags.,7
1616492639,"we hit 2million members, congrats to yall!!",6
1616496211,Seriously considering rolling my ADA over to ALGO... seems to have more upside with a lower market cap. What are peoples thoughts?,6
1616496887,All in Zil,7
1616497118,Completely forgot I had IOTA in my Etoro account from 2019..Thats my PS5 and new TV paid for anyway ha.,8
1616500350,"3 days ago me : woo leverage, let's try it! Now me : fuck!",7
1616500667,"Mr Gorbachev, tear down that VET 0.10c wall today!",8
1616503737,"I'm convinced if I fell into a coma and woke up in the year 2035, XLM will still be $0.40",7
1616504833,Just remember the longer you hold crypto the better you will get at holding.  Don’t let a 10-25% dip make you sell. You will regret it.,7
1616505091,"Another 647m Bitcoin moved off Coinbase 12,000 Bitcoin off the market ![gif](emote|btc2_emote|btc2)",7
1616505748,[This](https://i.ibb.co/GHg0nSS/hope.png) gives me hope.,7
1616513776,Slowly realizing why alt coins are inferior,7
1616514535,You know your annoying asshole neighbour that have a Dog who Barks every fucking night for 2 hours straight? What Shitcoin would you sell him? I would sell him Tron.,7
1616519114,ONE is pumping like craaazy,8
1616520197,"Any low cap recommendations to add on my list? Considering LTO as a next move. Already going to buy more Bitcoin and Ethereum. I now have: 45% BTC, 20% ETH, 10% ATOM, 10% VET, 5% LINK, 5% NANO, 5% XLM",8
1616523216,Why is LTO gonna blow up? Anything I'm missing?,7
1616524148,"just FOMOd a bit more LTO to finnally own the number i like, if we dip now it is my fault :(",8
1616525975,"Ok, that’s it, I DEMAND all my coins to go up! No more Mr. Nice guy!",7
1616526145,"When feeling low, I always watch this video to cheer myself up.    [https://www.youtube.com/watch?v=dYJH3li2zgQ](https://www.youtube.com/watch?v=dYJH3li2zgQ)",7
