date,content,score
1617006194,How many of you have more in crypto than your bank?,50
1617039979,"ETH Take Me To The Moon 🚀 .   ⠀⠀⠀✦ ⠀ ⠀ ⠀⠀⠀⠀⠀* ⠀⠀⠀. . ⠀⠀⠀⠀⠀⠀⠀⠀⠀⠀⠀⠀✦⠀⠀⠀ ⠀⠀⠀⠀⠀⠀⠀⠀.    ⠀⠀⠀⠀⠀⠀⠀⠀⠀⠀⠀⠀⠀⠀⠀⠀⠀⠀⠀⠀⠀⠀⠀⠀⠀⠀☄️ ⠀ ⠀⠀⠀⠀⠀⠀. . ﾟ .  ✦  , . ⠀⠀⠀⠀⠀⠀⠀⠀⠀⠀⠀⠀⠀⠀⠀⠀⠀🌕  * . . .  ✦⠀ , *  ⠀ ⠀ , ⠀⠀⠀⠀⠀⠀⠀⠀⠀⠀⠀⠀. ⠀ ⠀.   ˚ ⠀ ⠀ , .  .  *⠀ ⠀ ⠀✦⠀   .  . . ⠀🌑  .  🚀  ˚ ﾟ .  .⠀ 🌎⠀‍⠀‍⠀‍⠀‍⠀‍⠀‍⠀‍⠀‍⠀‍⠀‍⠀🪐  * ⠀.  . ⠀✦  ˚ * .⠀  . .  ✦⠀ ,         .",40
1616981399,This day has been a total shitshow. Work has been awful and I've just about had it. At least I have my portfol...  shit.,26
1617052257,Sold off most of my Crypto and all my stocks except for 1 company. Feels bad but I will be a homeowner soon so it is worth it :),25
1617010541,"VISA news is so bullish, can't wait for my USDC to finally pump! Triple digits baby!",24
1617018149,VISA news is so fucking bullish jesus,22
1617041087,ALGO 🤘,22
1617050016,VeChain on Italian News Network. Being used at several wineries.  https://heraldsheets.com/vechain-vast-adoption-in-italy-confirmed-via-an-italian-news-broadcast-3-wineries-testing-its-solution/,21
1617025683,All ATOM peeps! The very first IBC transfer happened this morning! ⚛️👩‍🚀🧑‍🚀⚛️ Absolutely incredible  https://twitter.com/dogemos/status/1376457448207183876?s=21,18
1617032284,I have a sneaky suspicion we're all gonna make it.,18
1617039817,"![gif](giphy|l1HmWAkG9fPA65Huya|downsized) Love train has reached its destination for now, shoutout to u/Layneeeee for joining me this time",18
1617048974,Look at ALGO go up such good coin it deserves much more attention and appreciation.,18
1617009827,Just added a stack of VET to my portfolio 📈🚀,16
1617039708,"ETH is still way undervalued. Lots of updates coming, May and June are gonna be big for ETH.",17
1616980947,"ATOM, destination : m̶o̶o̶n̶ Cosmos",16
1617017930,My portfolio hit ATH today 🙂🤞🚀,16
1617026115,Bought my first coins two weeks ago and they all immediately dipped. Woke up today and I’m finally in the green! It’s a lot more fun this way,15
1617040812,LTO new ATH lets fucking go! 🚀🚀,16
1616978602,ONE says not today Satan.,16
1617024904,Please tell me its finally dollar LTO day,16
1617028548,"When Einstein was developing his theory of quantum mechanics he found that Newtonian physics calculations were incorrect when applied at the subatomic level. This was partly due to the fact that at such a small scale there is no point of reference to measure against. Einstein concluded that he needed to find a universal constant, a point of reference that could never change and stay stable throughout the whole universe and for all of time, and thus, XLM was born.",15
1617038388,It took 6 hours to the market to realise that the main beneficiary of today news was Ethereum.,15
1616977152,ONE breaking .21 likely means new ATH very near in sight and it looks like we just did,14
1617016078,Just woke up and the coins are absolutely pumping. Let’s go! Upvotes for everyone!,14
1617030665,"Go to sleep at 55k, wake up at 58k.  I could get used to this.",14
1617043364,"Goodness, ALGO is going straight up.",14
1617043379,Thanking my past self for blowing my paycheck on that ETH dip last week.,13
1617043484,WHERE MY MATIC BROTHERS AT,13
1617059415,It's no coincidence that Algo is getting me randy.,14
1616988939,"I like crypto cause it reminds me of the early days of the internet. Risks of viruses, everyone out to fuckin get ya, don't dare post your personal info, easy to fuck something up, boomers still don't know what the fuck is going on.",45
1616977183,"I see you and appreciate you, ONE",13
1616980462,ONE doing the Lord’s work tonight,12
1617022142,"With yields 50x better than banks and communities forming left and right, DeFi is the future of finance. We are witnessing something HUGE, and as early adopters, we will be rewarded. Fasten your seatbelts, it's going to be explosive !",13
1617022465,my portfolio is going up. i am a genius ![gif](giphy|eMu0803X2zkWY),13
1617032262,"If you wait until everybody understands, you will miss the opportunity.",13
1617039939,Putting some ETH gains into LTO. Feels good man,13
1617040259,What a darn beautiful day this is turning out to be. ETH you sexy beast,13
1617043263,"Just to clear things up, LTO is a long hold, right guys?!",13
1617043652,Thanks JRNY crypto for selling al your eth,13
1617050045,Work on your health gainz as much as you work on your Coins gainz - Marcus Aurelius,14
1617059461,(っ◔◡◔)っ ♥ ALGO ♥,13
1617059810,Let's gooo Algo 🚀🚀🚀,12
1616978113,ATOM 👀,12
1617013041,Things I love most in my life: my mom and LTO,12
1617022515,"C'mon VET, it's your time to go up!",12
1617024619,Show me that price discovery LTO,13
1617027811,I’ll represent VET with all the LTO love going on. Where the true VETerans chilling at?,12
1617039478,Is our boy Ethereum finally going to grow up and move out off BTCs house?,12
1617043369,MATIC is going insane right now. New ATH coming soon?,12
1617044113,Yayyyy MATIC,12
1617048565,ALGO making a decent move today.,13
1617049769,ALGO just keeps going.,11
1617060104,Wow I didnt expect ALGO to keep going this hour. Quite a run here.,12
1616976523,Top mentions on this sub today (Not investment advice) |Symbol|Total Mentions| |:-|:-| |BTC|391| |ETH|275| |ADA|157| |LTO|97| |BAT|74| |VET|72| |XLM|67| |BNB|37| |STORJ|36| |ALGO|29| |ANKR|29| |ATOM|27| |LTC|27| |DOGE|26| |XRP|25| |BSC|25| |ENJ|24| |SNL|20| |GRT|19| |LINK|19| |ICX|19| |CAKE|18| |DOT|16| |XMR|15| |MATIC|15| |NANO|14|,11
1616980491,About to take the jump and splurge on the special membership. Thanks ONE!,11
1616993172,it’s been one year since I joined Reddit and my how time flies..,10
1617013705,"Just staked my first coin, ZIL 🔥",11
1617018695,"LTO baby, keep on pushing that ATH",11
1617032819,All of us idiots are gonna get rich,11
1617037920,"ETH , lets fucking go 🚀",11
1617047316,I have successfully paid for SMILE laser eye surgery purely off of crypto gains! In a few weeks I start the procedure to correct my terrible eye sight!,11
1617049160,Thanks to the kind person who donated me my first moon!,11
1617049587,ALGO Is going really mad today... Nice to see you so up!,10
1617057229,Thanks ETH and ALGO. I had a very sad and awful week but this week is starting much better!,11
1617059939,Algo is taking off!,12
1616977287,"Yesterday's daily barely managed to hit 10k, despite great efforts by spammers and automod! * The market cap hasn't moved much. * Many coins haven't moved much, with reds and greens staying within 2% * LTO was the big talk of the day. The first of the Ginyu force to arrive. At the start of the day, 90% of the comments were LTO. Though it ""only"" moved about 12% * XLM moved above 40 cents and then went back down under. * KLAY moved up to rank 14, people keep wondering what KLAY is. Coingecko doesn't list it high as punishment for CMC not listing OMI in the top 100. * FUD surrounding Litecoin is making people sell litecoin bags. FUD here is not enough price movement. * Though GRT wasn't talked about much, it gained a lovely 23%! * ONE with almost 25% was talked about some, but not nearly as much as overshilled LTO. * MANA with 20% was another common mention. Though it also couldn't beat LTO shilling. * Big gainer ANKR didn't gain the past day, with 15% loss. * Moons mentions are still common but declining. * Many users are hyper for 2m members. * The top 3 gainers of the top 100 the past day were GRT, ONE and MANA, with 20-25% growth. * On the loser side we're seeing BTMX with a very solid 35% loss. ANKR and STORJ didn't do well either with 15 and 13% loss. * Outside into the top 500 we're seeing NBR with 50% growth and a weekly growth of a mere 280.000%. Its massive $1163 volume shows its strength.  Another big gainer with 45% was MITH, and people are starting to talk about MITH. * On the loser side we're not seeing anything special with 20% losses being fairly common. None stand out. * Overal, this is another day with relatively little excitement and mostly stability. Some ups, some downs, some sideways. Gambling minds are suffering. * Today's mental image is a graveyard during a spell gone wrong. A few zombies and skeletons get out, but most are just softly thumping on their chest from the inside, hoping to also get to play. Edit: it's Monday! This was suppose to be a weekly! Dumb me!",66
1616976879,Let's make it a green week everyone.  A nice big green week with new ATHs for everyone! :),11
1616987221,Algo back to 1.30 tomorrow :))),11
1616999270,"I used to spend way too much time reading about politics, which made me miserable. And now I spend my free time reading about crypto and shitposting here, and I love it!",10
1616999465,ONE going for another go at .22,10
1617014953,We're back ![gif](giphy|1n83V8ss2ZOrHs1FyJ|downsized),10
1617017971,Game changer for eth 👍 ![gif](giphy|MagSgolK3ScWvtHAB4),9
1617022146,"ATOM looking real bullish today, goddamn",9
1617022320,ATOM over $20🚀,10
1617024049,Who else is on the toilet watching charts rn?,9
1617025509,ATOM making a move🚀,10
1617025537,ATOM back over $20.  Maybe this time I'll save a screenshot since that might last longer.,10
1617026706,"What a good day to be holding ETH, vet and LTO",10
1617031342,"What percentage do y’all hold of BTC, say compared to your ALTS?  I’m willing to accept a decent amount of risk, but would like to keep some a little more “safe”. Upvotes for everyone who responds. Just wanting some general guidance from those that’s been in this through recent bear markets.",10
1617031385,"Good morning, afternoon, evening or night. May your dildos be green and long today.",11
1617032100,Do people not understand that BTC and any other coin is going to have a little pullback pretty much every single time it makes a significant move? Pumping from 55k to 58k then pulling back a little is completely normal and expected.,9
1617038362,ETH going stronger than BTC today now. Great to see.,9
1617039538,First comment on the sub. GO ETH!,11
1617040358,ETH having the time of its life today.,11
1617043266,MATIC and GRT making me happy again,9
1617043426,"Algo did not care about the 1.3 sell wall, just stepped right over it.",9
1617043640,First time I've been green with MATIC since I bought it,9
1617044080,Im here to cheer for Algo,9
1617048724,"You know you shouldnt FOMO into a pumping coin... but fighting that temptating with every fibre of your being and then seeing people saying ""wow we are going to the moon guys!"" or ""OMG i just got x3 from this!LETS GOO"" It feels like all your best pals are invited to this super cool party and you are not. It feels hurtful. It feels personal. lol kinda also like seeing your best friend walking away with the girl you secretly really like. WHY DOES IT HURT SO MUCH MOM",11
1617049395,I have 6969 comment karma. BULLISH Edit: Not anymore I guess,9
1617049899,"I feel so good scrolling through the daily discussion on green days, there’s just so many happy people just simply being happy and that in turn makes me happy! On red days too it’s super funny when people panic over 2% dips. All in all this subreddit is just amazing",10
1617051854,Wishing all of you sweet dreams from the Netherlands! Hope that I wake up to some more green tomorrow.,10
1617055685,I wanna cry when I see that bitchboy has more than 700K followers on youtube and my man Benjamin Cowen only has 250K.  I'm hopeful it will change and people will learn from their mistakes after having him dumping on them whatever shitcoin he's pumping...,10
1617057563,"Algoing, algoing, ALLGONE!!",9
1617058922,Top token mentions on this sub today - (Not Investment Advice) |Symbol|Total Mentions| |:-|:-| |BTC|454| |ETH|440| |LTO|181| |ADA|155| |USDC|116| |XRP|102| |VET|73| |XLM|70| |BAT|58| |ATOM|49| |ALGO|47| |BNB|34| |BSC|31| |MATIC|31| |LTC|28| |MANA|27| |DOT|26| |USDT|25| |LINK|24| |CRO|23| |XMR|23| |OGN|21| |UNI|19| |DOGE|19| |BCH|19| |LUNA|18| |NANO|17| |HBAR|16| |GRT|16| |DEX|15|,10
1617059211,It feels a bit like an Algo party is starting here and I’m all good with that! 🎉,9
1617060194,Don’t have any Algo but happy for all the holders!,10
1617060226,LTO and Inj are my dual thrusters that'll take me to the moon.,11
1616978495,"At this point, LTO shillers have provided more marketing for the coin than LTO's own team.  Yes, I like the coin.",31
1616978856,I can't believe I actually bought the top on VET 🤣. Buy high sell low seems to be in my future... At least ONE is lifting my bags.,8
1616990043,XLM is like reading the same book to your kid each night over and over and over until you wonder if you will ever get to move on to something new and refreshing except your kid doesn’t exist and you’re just looking at your crypto portfolio.,8
1616995598,"Good morning, and a very happy Holi from India. Hope the only colours you see today are green!!",10
1617002659,"BTC, ETH, ADA, ALGO, ATOM, MANA, XLM, SIA, MATIC LETS GOOOOOO!",10
1617014921,Just threw my April monthly money on ETH waiting for the pre summer usual pump,8
1617015101,Fuck me this is a nice morning. Thanks Europe,8
1617016047,USA going to be waking up to some great news!,8
1617022393,All I  want is a .10 VET 🚂,10
1617025808,"As a VeChain shill and as someone who works in real estate/title litigation, I love seeing [news like this.](  https://www.ubitquity.io/ubitquity-teams-up-with-vechain-to-implement-vechain-toolchain-for-the-us-and-global-title-industry/) tl;dr - UBITQUITY, a blockchain-secured platform for real estate recordkeeping, announcing a partnership with a Seattle-area title company.  In the big scheme of things, it is probably quite small but in my niche I love to see real world adoption in an area that is a great use case for blockchain.",8
1617028466,Seems like 90% of the comments are about LTO,9
1617033513,Can people stop calling a $500 pull back after a $2k day gain a “dip”?,9
1617035986,Hello $1800 ETH. Welcome back.,10
1617036198,"Feels good to be in Crypto, feels GREAT to be in LTO!",9
1617038011,God damn ETH finally.  Drank its coffee and had a Red Bull.  And then decided to have a Monster as well.,9
1617038091,ETH FTW,9
1617038169,ETH kicking BTC to the curb.,10
1617038543,"Alright, just hit portfolio ATH. Time for a love train",9
1617038706,"Hey guys I'm new to the community, glad to be part of this",10
1617039472,"ETH is gonna break $2000, can't you feel it in the air?",10
1617041822,It is finally your time to shine MATIC <3,8
1617043358,Matic has no chill,9
1617043547,15 minutes until COSMOS IBC launch party!,9
1617045793,April is going be a *amazing* month for crypto. I can feel it in my balls. I keep checking them.,8
1617046031,https://medium.com/originprotocol/how-origin-uses-chainlink-oracles-to-secure-ousd-bff5601e840e OGN Chainlink partnership! NFTs and LINK are good to go baby 🚀🚀🚀,8
1617046503,I sold all of my ONE yesterday and bought LTO. rate this move,9
1617051109,If 2 million people know about moons that makes them a pretty well known alt,9
1617052305,"ALGO balling out today.  I’m holding long term, but I’m definitely glad to see it break out a little bit",9
1617055840,ALGO has gone mad today it won’t stop roaring. 🚀,9
1617058872,ALGO was one of my first ALTs and it is very nice watching it's steady growth recently.,9
1617059009,"Algo, I like the way you move.",8
1617060275,"Algo baby, there you are",9
1616978285,If you buy LTO and tell nobody about it... Did you *really* buy LTO?,50
1616986889,Just a friendly advice for the new guys here.Please stop day trading .Thank you,23
1616976598,"r/algorandofficial is on the rise and so is r/hashgraph. They seem to have a similar correlation as I have been watching them together for the last month. But overall, if Bitcoin goes up so do they... not a surprise.",8
1616977146,Nice ONE past 21 cents next stop ATH,8
1616977898,Anyone got a cure for me? I just can't resist buying more of LTO & VET.,8
1616978298,Finally picked a decent alt thank you algo grand 🗝💪🏼,8
1616981465,"MANA is taking off once again, bless up",9
1616986809,I am addicted to lto,9
1616987262,Does MANA break $1.20 Tonight?,10
1616994249,"The atom deserves a large move, please!",7
1617006332,"Well well well... if it isn’t Polkadot, finally decided to do something huh 😄",9
1617006665,Anyone in GET protocol - NFT ticketing Recently got some hype with Mark Cuban talking about NFT ticketing for the Mavericks,9
1617007330,"Lto really wants to be the top 150, right?",7
1617007832,RIP 57k,8
1617009095,Don't forget to upvote the daily discussion!,8
1617010156,Visa taking all the crypto headlines this past hour.  Visa.Visa.Visa.Visa.Visa.Visa.Visa.Visa.Visa.Visa.Visa.Visa.Visa.Visa.,8
1617016353,All hail Ethereum,9
1617017865,Anyone know whats holding LTO from getting on binance US? Would be good for the price to get it on there now.,7
1617022234,![gif](giphy|7FBY7h5Psqd20),9
1617022990,I feel happy today. but if VET goes faster I will be happier,9
1617027061,Buying more $ATOM on the dip on thursday was a great idea 🤑,7
1617033590,People think coins dipping between 1%-5% is a dump? There must be many new people here.,8
1617034886,**** EXCITING NEWS****   “ We are extremely excited to announce listing our new lending platform. BitConnect will allow new users to lend the value of Bitconnect coin in return for interest payment “ ~ INTERNET EXPLORER,8
1617035701,I like green dildo's,8
1617036119,1800 ETH Lets gooo,8
1617036200,Papa Eth moving,8
1617036241,ETH $1800!,8
1617037837,"I’m riding such an ETH high right now, makes all this waiting worth it 😅",9
1617037906,WOW ETHEREUM WTF,8
1617038099,"  ETH didn’t come to play around today, it means business!",8
1617038500,Keep it up ETH if you break 2K this week I'll take you out for ice cream,9
1617039553,"OGN man, thank you for your service",8
1617039988,"Staked my ZIL, ALGO and VET. Bought SUSHI and MATIC at the dip, see you in a month. Wish everyone a big green dildo!",7
1617040904,Nice to see some green dildos today. ![gif](giphy|l41Yq0LrP3i7GOpqw|downsized),9
1617041434,"lol thank Todd its a green day... Having a pretty shitty Monday... Normally I try not to jump on here during work or check prices too much, but I was forced offline for a few hours due to an Autodesk (rage stroke) issue and checked my portfolio like a bad boy... ETH is making my mouth do this weird thing that is hurting my muscles and cracking my lips? Is this happy?",9
1617042569,Why does crypto trading feel like gambling. Was trading drunk yesterday and profited 20% like is it even possible to reliably make money off of this? I feel like 95% of the people have no clue what they’re doing and the other 5% are the people who have 7 screens to look at the same chart.,8
1617042586,"New portfolio ATH, thank you algo, very cool!",7
1617042601,"Woah, good job ETH!",9
1617042962,"What do you think about my most recent move? Sold all ADA, bought LTO. Less hyped, more gains",8
1617043884,okay so im not gonna lie i bought LTO because of its low market cap and the insane hype. im curious what some of the use cases are though,8
1617046289,Woke up this morning to some gains! I LOVE IT!!!,9
1617048095,"Did you guys follow the stocks news, apparently a degen stock trader got liquidated completely on his multibillion dollar account and took down few banks that were lending to him in terms process",8
1617049754,Hoping to see Eth 2k soon,8
1617049810,"We seem to have hit a lull. Snack break, everybody! We’ll consolidate and then move on up more later tonight!",8
1617051724,800 Members away from hitting 2.000.000 Members 🤩,7
1617052691,"**Harmony ONE** partners with **Quidd** to bring **Atari NFT**s: [https://www.animocabrands.com/launches-atari-capsule-collection?fbclid=IwAR0qwOsBdDKAHF-d7-VAotonyYxrqjUivKjZZvUmzflvhQ0CND1XYvWttRY](https://www.animocabrands.com/launches-atari-capsule-collection?fbclid=IwAR0qwOsBdDKAHF-d7-VAotonyYxrqjUivKjZZvUmzflvhQ0CND1XYvWttRY) “We are thrilled to partner  with Blockparty, OpenSea, and **Harmony** to bring Atari digital  collectibles to blockchain,” said Michael Bramlage, CEO of Quidd. “The  NFT format gives collectors the confidence they need to invest in great  pieces. This is the very first set of NFTs that we issue, and we plan to  produce more in the near future.”",8
1617053459,690 people to go until 2 M users! BULLISH!!! 😀,7
1617053715,Here's your daily dose of hopium. >!BTC new ATH tomorrow.!<,8
1617054332,Lto really wanna stay above 0.80,7
1617056926,"Alt season is starting, let's go!",8
1617062000,Eth has managed to stay above 1.8k for over 6hrs woo,8
1617064746,With 2m members if we all pitched in 1k usd we could theoretically buy the country of Belize and start an entire country run off of crypto.,8
1616976260,New Daily. New LTO post.,23
1616997652,Fuck working 9 to 5. Fuck it,22
1616978348,"Someone copy pasted my content and became the top link of the subreddit. I reported it and the mod told me although[ it is suspicious](https://i.imgur.com/qq4LaQS.jpg) but there is a lot of activity in the thread so they wont act on it. I made a post about it in a constructive way by suggesting ways to earn karma instead of copy pasting others, as my post was gaining attention it got removed! It's not a big deal, but I just felt sad about how the situation was handled, I wanted to vent a little...",19
1617060596,ALGO made me more money today than I do in a 2 week nursing paycheck... this shit never goes my way I’m so happy 😭,21
1616979615,"Welcome to another week, wait for eth to reach 2k",9
1616979673,"I was bummed for a minute that my portfolio has been down about %7 over the past month, but I'm up %700 over the past six, so that didn't last long.",7
1616982195,"MIR finally breaking out after a while in the $6-7 range. V2 is coming and it will do well i think Synthetic assets you can also add to liquidity pools - it just launched the first tokenised synethic index (FAANG), and has limit orders and leverage long and shorts launching. Seeing as my post on Terra (LUNA) here was removed, i shall copy a small excerpt regarding MIR: The idea is for this to be used to tokenise any asset desired by the community, and to date it has focused on US equities - such as TESLA, GOOGLE, APPLE (and yes even GME), which has proven very popular with the east Asian audience who may find it hard to have access to these assets. It aims to offer high returns on assets and make them widely available to anyone, with low fees (0.1 UST to transact) and offer flexibility in 24 hour trading.  It has also recently introduced limit orders and will be looking to introduce options trading very soon with v2. The assets which can be introduced are endless, and just rely on community governance to launch. This is the first of a few ways terra presents a great hedge against a crypto bear market without converting your money back to fiat - if things like commodities begin to be listed (and yes, bonds). Mirror was launched in february this year and within a month had over $1bn in TVL and a $300m market cap. And they have recently launched FAANG (facebook, apple, amazon, netflix, google) to become the first tokenised index on an AMM and the system now allows for USDT and USDC on-ramp via the mobile app.   https://www.coinbureau.com/review/mirror-protocol-mir/ - coinbureau overview on mirror. - on MIR (synthetic assets): https://unreliablenarratives.substack.com/p/mirror-decentralized-investing-for - Mirror site: https://mirror.finance/ - Mirror app: https://terra.mirror.finance/gov - Mirror whitepaper: https://mirror.finance/MirrorWP.pdf",8
1616987042,"God, hear my prayers and send ETH to the moon",9
1616993971,Good morning from the Netherlands!!,8
1616999620,LTO steadyyyyy,7
1617001205,Please break that 80c barrier LTO! 🚀,7
1617005679,"I got a pay upgrade at my FIAT mining place yesterday, little extra something something to buy more dips",8
1617006250,I sincerely believe that this year's eth may be like btc. explosive growth is coming.,7
1617008405,$0.10 VET Babeeeey I can just feel it coming  🔥🔥🔥🔥🚀🚀🚀🚀🔥🔥🔥🔥,8
1617008827,"My alts:  Oh look BTC is up huge, oh man this looks like a great time to lurch along at 0.0001%  Also my alts:  oh look BTC is down 0.00000001% I guess I gotta go roll in my own feces and drop 15%",6
1617013209,70k Bitcoin here we come,7
1617013733,BTC rising baby!,7
1617014319,funfact: Kusama (KSM) is a japanese artist who creates paintings with dots (POLKADOT).,8
1617015856,Visa once again bringing us bull-ish news!,8
1617016988,"Sell wall at .82 and .82500 are pretty big for LTO, BREAK EM",7
1617019058,"Mr.  Gorbatchov, tear down that 0.82LTO wall!!",8
1617019799,Let’s go matic !! You deserve so much more !,8
1617021309,Love this wonderful community,7
1617021739,"There is now an ""IBC transfer"" option on the Keplr Wallet. ![gif](giphy|l3nFh9xbJtZYc6UhO)",8
1617022343,"Let's go ATOM, you deserve a new ATH!",8
1617022497,A bullish day! This feels so fucking good,6
1617022592,I. Declare. SOLVENCYYYYYYYY,8
1617024935,LTO just casually walking through sell walls,7
1617026742,Shill me your favorite coin,7
1617026778,Go VET go!,7
1617027388,"The vibes here when everything's green are so positive, I love it",7
1617027928,Let’s go ATOM,7
1617027982,Who doesn’t like MATIC? Tell me why I shouldn’t buy more.,7
1617028804,"I don't know when it'll be enough lol ""Just a bit more LINK. Maybe I should enter into DOT. Do I have enough BTC and ETH? How about...""",8
