date,content,score
1616528810,"Okay the reason why I said **“Theta is the next Bitconnect.”** Maybe over-exaggeration, but it will dump hard. **Theta（ICO of the Chinese team)** Risen 71% in the last 7 days and 17892% in the last year. Exceeded BCH to become top12.  Through data analysis, the team has money to control the market and is sought after by Koreans, which may be the core reasons. **FYI，theta just became top10 crypto, exceeded chainlink.** Theta’s core advisor is youtube co-founder Steve Chen, with sufficient funds. Top 10 holds 61% of the currency, which may be easy to manipulate the market. The new version of Theta will be launched in the near future and keep up with the NFT boom. **Some Theta's investors and advisors have a poor reputation in China, but it is irrationally sought after in South Korea.** According to CMC data, the trading volume of Theta/KRW on Bithumb, the leading exchange in South Korea, ranks fourth. And the top three in the total trading volume of Theta are trading pairs of Binance and Huobi. CMC pointed out that only Bithumb's trading volume has high authenticity, and the top three have low authenticity.",8
1616529290,Ate a 0.5% loss in fees because I forgot you can just convert USD<->USDC directly in coinbase pro for free without going through the markets.   (╯°□°)╯︵ ┻━┻  I dum.,8
1616529448,i better wake up to giant green dildos tomorrow.,6
1616531248,what goes down must go up .... allegedly!,8
1616532487,"My portfolio still dipping but is back to green in the 24h chart... So it's all good, I guess",7
1616534215,This is fine,8
1616536761,"Bout to go buy some beer, have a bonfire Do some research and buy some crypto tonight :)",7
1616538289,taxes are a fucking pain. Which do you guys use? cointracker or bitcoin tax? &#x200B; edit: bitcoin tax pricing looks so much better but coinbase is recommending cointracker but fuck that price. $199? WUT,6
1616540437,Have a look at how obediently bitcoin is following stock to flow model prediction by PLANB. [**https://prnt.sc/10tt0zw**](https://prnt.sc/10tt0zw),8
1616541074,Is ENJ worth buying?,7
1616541391,Is there a better oracle protocol than Chainlink?,5
1616541570,So I have moons now And I can give these moons to you guys ??? Or other people ?? And they can do what with them? Send them to ETH wallet? Orr am I missing something,7
1616493444,America here.. waking up. I personally guarantee we’ll be back to 60k within the next 14 hours to start the next leg up.  # Or I eat my dick on live national television.,40
1616460818,Algo and ADA decided to be secret best friends and copy each other's price and movements.,19
1616472230,If this is the alt season everybody keeps talking about don’t sign me up for the next one,18
1616461907,VeChain getting ready to smack 10 cents and beyond,28
1616494115,"dentacoin is for validating transactions between children and tooth fairies, the science is legit, def not a shitcoin",17
1616539253,"I hope you become rich, fellow cryptosexuals.",18
1616457737,New thread? ![gif](giphy|ncbdoCpKerEbK|downsized),7
1616459243,Damn dude I feel so good moving more than 50% of my holdings into KSM a couple days ago,5
1616460703,How do you guys feel about ENJ? Just bought a shit ton on this dip.,7
1616461761,Should I buy more VET or VTHO or LTO?,7
1616462327,Soak up those sats; better day coming soon. 🚀🌕,6
1616465056,"Checked a wallet I haven’t for awhile to remember I bought some dent as a joke a few months ago, no idea why it’s worth so much now but I’ll happily sell it off lol",7
1616466223,one!!!!,7
1616466389,I have $1 in xlm I didn’t realize I had.  It’s the only green in my sea of red.,6
1616466701,It’s not payday yet. I wanna buy some 🤦‍♀️,7
1616468425,"How do you earn/buy moon, I’m curious I keep seeing it around the sub but I’m not sure how it works",6
1616469053,"Morning from the uk, up super early today!",5
1616470270,Congrats friends on 2 million subs,7
1616471138,alternative season,6
1616471200,"Please, Vitalik, carry us on your biceps and make us forget the dump, amen.",7
1616471647,Anyone scoop up that ENJ?,5
1616473905,I'm gonna be so poor tomorrow when I wake up... yaaaaay.,7
1616474452,"Just made a pro gamer move.   Sold all my ONE after I bought it with the profits from another sale, and I bought some shitcoin that I have no idea what it is, if its even a product, or just an animal. Whats this Bee Tea Sea thing, anyone?  Bueller?",7
1616475838,I invested my whole stimmy into crypto I’m sorry I broke the economy :(,6
1616477102,"Despite the pinned post, MOONs are somehow up 9% and the only green in my portfolio",6
1616477572,...but can I sell my *other* kidney to buy the dip?,7
1616479633,Fu*k it. Time to buy some more ETH,6
1616479982,So there is an advantage to holding XLM. You don’t make money but you also don’t lose money.,5
1616480559,I keep buying the dip and it just dips more and more I’m afraid I have joined the long list of bag holders 🥴,7
1616480674,Is everything collapsing because literally every person and every news broadcaster is talking about it? This feels so similar to 2017 already,6
1616481195,"Proud of my LTO gang, LTO is doing really well during this dip. Maybe because the majority of coins are being staked/ leased.",6
1616482350,Get that flash sale!,6
1616482932,Bore da! Was not expecting to wake up to this. Brutal 😆,5
1616482992,Its sunday?,7
1616483310,The problem with buying the dip is that it keeps dipping.,6
1616483446,"Purchased VET, BEPRO, nano and some link on the drop, just a nice bouquet of shitcoins 🤩",5
1616483769,Do these massive spikes in LTO mean that a whale is buying?,5
1616484066,"Gotta talk to my job and tell them I need an advance. When they ask for my reasoning, I’m just going to say: “Look at the charts, I gotta buy the dip.”",6
1616484454,What's everyone getting on sale then? Upping my VET for sure,7
1616484819,Topped up on some AAVE. The quite times are always opportunities!,7
1616484884,There goes my last FIAT 👋 stacking sats,5
1616485190,Didn't we have a big ass dip about a month ago? Why is everyone overreacting saying it's the end of the bullrun? We will hit ATH's within the week.,7
1616485356,DON'T CALL THIS A COMEBACK,6
1616486859,"Despite this dip, IF Btc keeps its current upward trend, we should see around 70k by May.",5
1616489805,"I saw a post about Filecoin's circulating supply, and what on Earth? It's fully diluted market cap  would plant it so strongly into third place by market cap. That's insane!",6
1616490290,ETH supply on exchanges at a 28 month low 🚀,6
1616491994,Honestly I’m not even mad about how stable xlm is at this point it’s kind of amazing.,6
1616492779,"Bought BTC for the first time when it peaked at 61k, have since been able to bring my avg. buyin to 59k but we sinking further than that lately. Hodl me please, my hands are iron but my heart is downtrodden",5
1616495072,This was the dip? I don't trust like that,6
1616496731,"We passed the 75 mark [altcoin season index](https://www.blockchaincenter.net/altcoin-season-index/), which means we are in the period where 75% of alt coins are more profitable than bitcoin.  Curious to see how things move forward now.",6
1616497405,Today looking like ETH wants to be back over 1800,6
1616497739,Can’t wait until we’re freaking out about crashing down to 60k 🤑🤑,5
1616497928,Anyone having issues with their Binance app? Mine just keeps crashing when I open it,6
1616497993,Alt season ??,6
1616499626,"LINK out of top 10, wasn't expecting that",6
1616500209,I promise not all of us Americans have paper hands.,6
1616500544,Ah we had started slowly getting a bit of positive momentum back. Then the Americans wake up.,5
1616500891,Stop loss? Hit Market? Retraces afterwards Hotel? Trivago,5
1616501144,"12,000 BTC transfered five minutes ago. Holy shit. https://whale-alert.io/transaction/bitcoin/98af142954ccc235516594fc0d8aa5d67516f1bfec312271ba599f89408b850b",6
1616501248,Saw a dip and just bought!,5
1616502902,"Are you ready kids? 1,000 #BTC (54,915,652 USD) transferred from #Binance to #Xapo",5
1616503380,Are you guys silly? I'm still gon' hodl it.,7
1616507105,Oooh prices creepin' back up I see.,5
1616507860,"I'm looking at the dips of the NFTs and I don't know what to make of it. Is the hype of the last few weeks over and they'll settle at a more ""realisitc"" price point? Will they pick up more steam? I feel like not buying and them going to the moon will make me quite sad. On the other hand: this is the typical FOMO mindset. Damned if you do, damned if you don't...",5
1616515262,"My friend who bought 1 grant of Tron today after buying btc at 60k and selling at 54k switched his Tron to Dogecoin because ""elon is behind it and partner""...",7
1616517880,Moons get distributed tomorrow right?,6
1616518695,"Why is ADA and ALGO running a three-legged race? Besides starting with the same letter, what if anything do they have in common? They've been mirroring eachother for days now",7
1616519584,"the UNI airdrop is now worth $14,000",7
1616519610,That UNI pump though...... V3 excitement real,7
1616520310,"On a more positive side note, we are less than 40k users away from the 2 M mark! The hype is real 😀🚀",6
1616520899,The Miami Heat and cryptocurrency exchange FTX have agreed to a $135M naming-rights deal for their arena. FTX will be the first crypto exchange to sponsor a major US professional sports venue. The world is changing.,6
1616522200,"Evening team, I've just finished a long shift at the hospital. How's today been? If you can summarise the last 10 hours for me that'd be great 😁",6
1616523679,"VET, ONE or MATIC or ALL ?",6
1616524665,Bro ETH keeps falling further and further behind BTC. So f-ing annoying.,6
1616526870,Well there’s that VeChain dip you lot were griping about,7
1616527955,What does THETA do and why is it ranked #9 while nano is #100,6
1616529407,We getting moons tmr!! 🌚🌚,5
1616531957,"Hmm, should I buy back in yet on VET and ENJ?",6
1616537426,Yuge pump inbound. I feel it in my kundalini.,4
1616538852,Just hopped on the ANKR hype train. Let’s see how this goes 🚂,7
1616539426,BTC has not had more than 2 red weeks since June 2020. Not saying we hit bottom yet (maybe we did). But if 53k wasn’t bottom then it will be found within the next week before going higher!,5
1616541820,Morning😁 part of me is happy that LTO is pumping but the other part is like but it’s DCA day now what about my averages 🙃,6
1616460268,I’m jealous of anyone with fiat to spend today,15
1616522905,In a world filled with so much negativity I would love to hear something positive that has happened to you today. No matter how small or insignificant it may be.,16
1616533427,Everyone take a break and stop looking at charts. We will be up and green soon,15
1616464609,as a Turkish citizen it is great to see IOTA is finally going up. %50 of my portfolio is on IOTA. Turkish Lira is going down but at least IOTA is defending my ass.,15
1616477736,Good morning fam ... *checking charts ...* WTF?,15
1616506577,"ONE is done with yer bullshit Bitcoin.  Its getting out the nipple clamps and whips, we ridin dirty to .20",14
1616537832,"Hope we see some green tomorrow. I'm becoming dad for the first time tomorrow, will be a nice way to celebrate it! Good night!",23
1616459446,"Crypto is move addictive than football manager, please just one more hit!!!",5
1616459719,"I’m mad chillin..I believe in ENJ , it believes in me",5
1616461235,"https://finance.yahoo.com/news/crypto-com-inks-global-partnership-203510442.html Somehow missed this. CRO is in fire, mainnet launching very soon. Glad I picked up some more last week. Slight dip today so you could still get in with gains!",4
1616465600,"Keep it ticking green for the next few hours, Europe wakes up and we get fucking HISSING again",4
1616466274,I’m on a roller coaster,5
1616466391,I really want to accumulate some sats:( but it’s stil 2 days til payday!! Ffs why does it have to dip now,6
1616467165,Just started buying new coins today instead of sticking with btc and eth. Feels like a brand new world! Excited to see what each altcoin offers.,4
1616467968,"Although XLM never has crazy moves upwards, it's also not having any crazy moves downwards in this dip. Half redeeming itself haha",5
1616469088,What is your view on the fact that new users can just buy their membership into the sub with Moons and avoid the karma restrictions?  The pinned post is downvoted a lot lol,6
1616469128,Am I missing something here? Everything is red how is that alt season?,5
1616469140,"can someone tell me why everyones saying its alt season and that bitcoin and eth are gonna plummet now? looking at the graph, this is so far the smallest of the 3 drops weve had on the way up. march is also a bad month according to others for crypto so whats stopping it from going back up after this dip?",4
1616469519,Playing only Green Day songs all day today,5
1616469836,How do we feel about matic and aave? Still have room to run for the bull run?,6
1616472387,"Another week of the same old red start, lets go",6
1616472918,His do you deal with selling a stack and then regretting it later when the prices moons?,4
1616474260,"DCA, HODL, repeat",5
1616475165,VeChain vs. OriginTrail? What are the differences from a technological perspective? I don’t care about partnerships or institutional investments.,5
1616477321,Hold me,5
1616477535,We test 50k and rebound from there. Don't think the dip will be as bad as last month,5
1616477746,and down we go :(,5
1616478246,"Am I the only one who loves those small dips? Usually means we see a big spike after it ends, and good time to buy some more",5
1616478619,Just remember if you sell now some billionaire is probably buying on the other end.,4
1616478806,Another 5k day. Its all good. We'll be up 10k by April.,6
1616478922,*checks charts* ![gif](giphy|tyqcJoNjNv0Fq|downsized),6
1616479277,Alexa Play House on Fire by Rise Against,5
1616480146,"So much whale movement today, but it's not very unified in direction as of yet.  Lots of BTC/ETH being taken off the market into Xapo (digital bank/custody service) and private wallets, but also a good chunk of USDT/USDC being pulled off exchanges after cashing out.",4
1616480402,Bear love is true love!,4
1616481427,"Why do I want to sell everytime I read ""don't sell""?",5
1616482270,XLM hodling well 😂💪,4
1616482646,Cool as a cucumber...April we’ll be back on track to new ATH’s,5
1616482944,We must imagine Sisyphus happy.,6
1616483116,This is such a good time to buy more. I need fiat 😱,5
1616483308,Iota to the moon :),5
1616483654,Good morning European and African pals! Let me just say that today it's a good day for rediscovering your hobbies. Try to not look at those charts for one day (saying it mainly to myself).,5
1616484178,"I'm going to check in at the end of the day, this ain't healthy for me.",5
1616484892,**Shill me your worst shitcoin** Worst one gets the expiring award I have to give away,5
1616486882,On what day are MOONs given out?,4
1616487158,*Sea of Red* Now buy the dip,6
1616487172,"Folks what are you buying this sale? ETH, BTC, ATOM and a little bit VET here.",5
1616487181,Is it just me or is there an abnormal amount of “low cap gems” being shilled in here today?,5
1616487478,This dip both upsets me (first time my money i put into crypto has gone down dramatically) but also excites me as i'm following the crypto scriptures and 'buying the dip' god speed brothers and sisters,6
1616488461,"Interesting political discussions going on around the world. In Norway we're seeing the environmental impact of Bitcoin mining a topic of contention. Especially strong is the scepticism from the left. The tech industry points out how strange it is for the political left to not see the value in a currency that is accessible to everyone and has the ability to bank the unbanked around the world, taking power away from the financial elite. It's clear that Bitcoin is getting attention, and it will be extremely interesting to see where the mainstream narrative goes",4
1616489210,"All the shilling really went from ADA to LTO. That being said, might pick up a bag if it dips more.",6
1616489506,"Daily tx on Polygon (MATIC) have tripled in 30 days, up to a quarter of the daily tx ETH does. I promise, it's not just me petting my Aavegotchis!! [https://imgur.com/QDCGlUW](https://imgur.com/QDCGlUW)",5
1616490589,VET Bouncing back boyssss & Girlssss,5
1616490650,Guys look that you have enough IOTA in your portfolio if the update comes in April the price will explode. 💥💸 🚀🚀🚀,5
1616490858,Do we know what caused the dip? Or just crypto being crypto?,5
1616491197,"If the market drops -10%, it needs to climb another +14% just to get back to where it originally was. Maths is cruel.",5
1616491234,My friend who sold at 54k after buying at 60k just bought  Tron for 1 grant,5
1616491456,Now is the time to buy,6
1616491580,"Didnt have my laptop this morning with me, regret not picking up ALGO at 1.08",5
1616491849,Someone should launch a coin called DIP so people buy it in these moments ;),5
1616492092,XLM really is unfazed by this little blip,5
1616493841,"*I will never financially rec... oh.. nevermind""*",5
1616494508,Is it altseason? 78% on the Alt Season Index? Calm before the storm?  https://www.blockchaincenter.net/altcoin-season-index/,5
1616495820,Would someone be interested in a whitelist for good youtubers ?,5
1616496125,Damn IOTA is going parabolic 😍🕊️,5
1616496550,Bought myself some shitcoin for discount. I mean... It's 20% down anyway and my gambling money was put aside. What can go wrong?! 😅,5
1616496608,Wish I had more money to buy this dip.,5
1616498213,I accidentally sent some dai to an xdai address. Is that shit gone forever?,5
1616499474,Anyone wanna earn some SchruteBucks? I’ve got some chores that need doing.,6
1616499830,"ZIL dipped pretty low, implies there's plenty of people not staking. Surprised considering how lucrative the staking is.",5
1616501885,"Southeast Asian countries such as Malaysia and Singapore are using blockchain to keep track of the batch of the vaccine vial - and this is the basis for their vaccine certificates. [\[Link to the Tweet\].](https://twitter.com/Khairykj/status/1374332247923257344?s=20) Question: To use blockchain in such a way does not require it to be linked to a coin? ![gif](emote|snoomoji_pack|flip_out) Question: If it is linked to a coin, what are the possible coins linked to such function?  ![gif](emote|snoomoji_pack|grimacing)",5
1616502197,Volatility works both ways boys and girls.,6
1616503347,52-53k is becoming a major support/resistance level for BTC dating back to Feb 17th. It’s been resistance and support for over a month testing it multiple times each way,5
1616504107,How long do you think VET can go this bullrun?,5
1616505115,Alright just put the last bit of money into crypto. Gotta wait 3 months to add.  Come on guys you can carry me until then right??,5
1616511360,Remember to Vote on proposals everyone!,4
1616513764,Don’t forget that dips are heathy and normal,4
1616515087,I feel like ENJ has a lot more room to grow. What do you think?,4
1616515310,Looking at these moon poll percentages you can really see how a lot of users don’t want others to get more moons lol,4
1616515476,I own too much shitcoins...,5
1616518329,Does anyone know where you can order a custom sex doll with the harmony logo instead of a head?,5
1616518584,"ONE & ANKR proving their potential, expectations in short term?",5
1616519746,Anyone know how i can stake my ONE? Cant do it on binance because the minimum amount is 10000. I read something about trust wallet but dont know how that stuff works.,5
1616519903,"Atom doesn’t have to flip Ethereum, it’s here to accompany it.",3
1616520327,Gotta love XLM,5
1616520393,Quick scan of the UNI V3 - can anyone ELI5 what sort of impact its going to have on fees? Not drilled into it properly but I'm not seeing their solution to the major problem for the most casual users...,5
1616520396,This dip seems over,4
1616521510,"I might need to link a screen on top of this one, cause Ive been watching LTO charts and that green dildo keeps wanting to break the top of my screen...",4
1616523960,"Banano has been surprisingly resilient this dip. Saw someone mention OCEAN, what does it do?",4
1616525288,"Everyone always talks about the whole maximum fear/greed thing usually about the market at large, but I do wonder if we're at some kind of maximum fear point on XLM.  Everyone seems to be off the coin/not interested anymore, yet somehow the price refuses to go down. Feels like it might be one of those cases where it's one really big piece of news from suddenly going parabolic out of nowhere, but I don't know enough about XLM's future plans to have any idea if that kind of news might be realistic. Regardless, *someone* is buying up XLM to keep up the value despite retail investors losing interest in the project.",5
1616526303,"Haven't checked portfolio all day, judging from the comments here I'm guessing it should be down a little edit: okay when the fuck did I buy storj and why is it up 140%???",4
1616526790,"Was curious about the Moons market so looked it up a bit. Sitting at about $7k volume today. Not too sure what the daily average is, but if this was it, one single mod could absolutely gutter the price lol",6
1616527786,There’s blood on the streets but not my blood cause I’m not selling,4
1616527831,The UNISWAP V3 Information is looking good!,6
1616527864,We are dipping again. Nice. Love it. &#x200B; &#x200B; &#x200B; &#x200B; Just checking to see if reverse psychology works on this bad boy.,5
1616527932,"Buy stellar at $0.39, sell when it gets to $0.41. Rinse and repeat?!? Profit??? My favorite stable coin that’s for sure.",5
1616528071,Don’t let your emotions manage your portfolio,5
1616529112,"I have been struggling to find an efficient way to keep track of my crypto investments and to get a summary of losses/earnings at any given time - mainly because of the complexity of things when it comes to buying altcoins and transfers and swaps. EX: Buying $500 of BTC on Voyager to send to Binance so it can be converted to BNB then sent to Metamask to make a swap on Pancake then sent back to hold in Metamask, all while getting charges fees along the way. Not to mention all the different exhanges, staking, wallets, etc. for different cryptos. I found [this article](https://www.doughroller.net/investing/ways-to-track-your-bitcoin-investments/) that recommends AltPocket, CoinTracking, and Blockfolio. Trying to get a feel for what other people use and trust.",7
1616530627,LTO allergic to it's ATH,6
1616531596,"Holy shit, SPI went up by 40 dollars within 25 mins. The influence twitter/social media has on crypto is insane.",5
1616534124,"A few newbie questions: 1. Is there any reason not to keep all my crypto in flexible savings in Binance? 2. Is there any reason not to convert all my crypto to something that's rising or at least stable during a dip like what we're having, then convert it back some time later? 3. What do you think of automatic portfolio rebalancing? I've tried to post a thread about it but it seems to have been shadow deleted (I'm guessing a bot marked it as shilling), so I'll keep this somewhat vague – but there's some stuff around online hinting at pretty wild results. Are these simply cherry-picked? Will trading fees of 0.1% eat up my portfolio quicker than it can grow by rebalancing?",5
1616536254,Thoughts on Chiliz? Would it make more sense to buy the CHZ tokens or the specific team tokens?,3
1616536296,I’m just kinda to the point where I go three or four days without checking my portfolio because I don’t think it’s good for the heart every twenty five minutes,7
1616536757,"What witch craft is this, i bought the dip yesterday yet it's still dipping",6
1616536762,"I have a serious question as someone with a passing interest in crypto, if BTC will essentially just be an appreciating store of value, shouldn't it not follow the stock market indicies? It seems like they both rip and crash on the same days at the same times.  Also are there any cryptocurrencies that don't seem to follow Bitcoin? I have some in my coinbase account and everything I keep an eye on follows BTC almost to the tick. Thanks",7
1616536866,"hopefully tomorrow morning is green crypto god, good night!",5
1616536956,sooooo when are we planning to go up again? soon right?🤨🤨,5
1616537188,At least we'll get our moons tomorrow....right?,4
1616537674,Damn the ETH/BTC ratio is the lowest I've ever seen. Good buying opportunity.,5
1616538258,"Its been already 13 hours since I've sent some Nano from KuCoin to Binance, but I still haven't received any. How worried should I be? this never happened b4, never had to wait more than half an hour",4
1616539229,"Hope everyone voted on the proposals pinned to the front page, this is a great community   and everyone in it has the right to decide.  Lets make r/CryptoCurrency even better than it already is! ![gif](giphy|fveKCnZRN7aOrtWNfj|downsized)",4
1616541270,This last month has been pretty low key.  Maybe a nice break out to go along with spring weather is in the cards,5
1616541940,Noone into chain games here? 275 mil market cap and not on any decent exchanges yet (other than uniswap).,6
1616543111,"Sad to see Luna like this, but I will hold because I believe in it😔💪🏽",5
1616543678,Why are all the new shitcoins named after animals why not just openly call them PumpNdump ScamCoin lol,5
1616457734,Considering the days events I haven’t sold off a single one of my positions. Broke my own thumbs just to make sure.,12
1616459333,LTO or VET?,12
1616491549,LTO  🚀,13
1616521694,Harmony to ONE!,12
1616522430,Only thing I regret with LTO is not having bought more,12
