date,content,score
1617026162,"People take profit. This is the way. Depending on their entry point, they could already be making a nice.",6
1617048091,"You should load up on USDC, since that's what they're using for the transactions",9
1616985831,Batman of this community right there!,4
1616977771,"Search ledger nano or trezor, those are the two big ones. Only buy them directly from the seller or you risk receiving a device that’s been tampered with. Also happy cake day.",6
1616978135,"No. Also ""fighting"" is a harsh word as Elon just posts memes for the luls and Cuban only listed Doge as a payment option for Mavericks tickets as it could help sell a couple of tickets more..",5
1616978254,"No utility, no plans, unlimited supply, big holders and price manipulation ...doge is just an inflationary shitcoin, wont even hit 10 cents. Reading the delusional posts in r/dogecoin is a good laugh tho",5
1616989415,I assume you're 100% XLM,3
1616990409,Algo. Just not sure if this is the best entry point,8
1616990491,Algo 100%.,7
1616995499,Kucoin or pancakeswap are good answers to jumping on new coins but having trustworthy exchanges still.,4
1616997338,This right here. I want to know too,3
1617002837,Gotta catch em' all!,7
1616977701,"Next week, very bullish!",6
1616977746,"Get some more, you won't regret it.",7
1617017401,I hope so.,5
1617031813,That's true.  Maybe this will be their gateway drug.,5
1617059988,"Same dude, algo is my biggest alt hold 👍🏼 sending good vibes your way",9
1617060109,"start peeing, hombre",5
1617048382,"I hold a small bag of USDC and it's been crabbing the entire time. WTF is it, a stablecoin?",7
1616989534,"LMAO no, but good guess!",4
