date,content,score
1617030082,I’m tempted to make the jump from XLM to SLT. Anyone care to FUD me on SLT? Need a perspective to break this possible tunnel vision.,7
1617031415,Just waiting for Alt season..,8
1617031449,the moon is getting closer ![gif](giphy|QWXjap9Fi2x5yUfleu),7
1617033721,"With the recent VISA news, very few people are giving credit to CRO. I bet even less people know who CRO is using for their oracles...I swear it's almost as if there's a shun campaign on here toward LINK. I'd argue they're making bigger moves than whatever tends to be shilled on here",7
1617035385,"XLM making it back to $0.40 and stopping, sounds about right",8
1617035686,Gratz to ATOM for getting above 20 again. I expected it to be weeks more!,7
1617036028,Rate my portfolio: 100% MATIC,8
1617036238,XLM up 0.0% the past 24hrs,7
1617036255,You can not stop ETH. You can only hope to contain it.,6
1617036837,Should you buy more ETH right now? >!Yes!< >!Yes!< >!Fuck yes!<,8
1617037830,Holy crap that elevator up on ETH. ATHs tomorrow at this rate.,8
1617037851,Eth starting the engines.,7
1617038027,"Scared money don't make money. Buy low, buy high, hodl.",7
1617038050,"BRO, Ethereum is shooting for ATH",7
1617038200,Today this sub is /r/ethereum,7
1617038274,ETHtastic,8
1617038455,Eth is rising from the dead!,6
1617038538,Stepped away from the charts and eth is casually sitting $1800+ I like mondays,6
1617038553,Congratz to the ETH holders!,7
1617039090,Is this the run up Vet needed to hit 0.1 it sure looks like its going that way.,7
1617039148,Eth giving me feels,7
1617039196,"ETH is outperforming BTC today, amazing",7
1617039264,XLM up 1% on the Visa news! Watch out world,8
1617039350,i like how ETH takes little breaks every few minutes and then absolutely rockets off again,7
1617039400,ATOM is looking to settle above $20. Thanks IBC,7
1617039459,Eth got its milk 🥛,8
1617039492,Thank you Vitalik Buterin,7
1617039547,Portfolio ATHs for evvvvvvryone,6
1617039623,Xlm breached $0.41 alt season is here!!!,6
1617039699,Oh yes ethereum time to catchup,7
1617039756,u/nomorealcohol2017 gave up alcohol for love awards :),6
1617040660,"LTO posts being banned? Edit: just a test, saw someone say this",7
1617040691,Its a ramen with seasoning extra seasoning kind of day,7
1617040704,ETH still feels undervalued.,7
1617040839,I couldn't get any more bullish on ETH and ALGO.,8
1617040892,Everything is going mental. I’m like this right now- ![gif](giphy|3CZ5z93Ux5CWQ),7
1617041527,"Asian Team calling it a night now, but with how bright them green lights are, i might as well sleep with my eyes open. Take care folks. I hope we all make it. ![gif](giphy|iEocb37vZOOaV3BuAI)",6
1617041713,ARK Mooning 🚀🚀🌕🌕,7
1617043960,ALGO about to pass Voyager 2 🚀,7
1617045953,VET going to hit 0.1 this week!!!!,6
1617047065,Just bought some Stellar. Idk I have a good feeling about them,6
1617047839,I miss the days when XLM was 50 cents for a little while,7
1617048035,Got the day off and some gains. Feels good,7
1617048334,Good to see LINK going up!  I'm bullish.,7
1617050137,How did the Cosmos IBC launch go today? Hasn't done much to the Atom price but I'm staking till 2030 anyway,7
1617050718,why do i feel like it is late to buy LTO ? :/,7
1617051223,Good morning Australia! We are green and happy,6
1617051526,Been staring at the 1m chart for ALGO on CoinBase Pro… looks like almost every 5 min there’s a big green candle with a spike in trade volume. What could that be? Institutional buyers? Or am I just witnessing some weird bug in the charts,8
1617051673,"Good night from Spain, keep on that good work! Buenas noches!",6
1617052222,I hope everyone is ready for the Moon Stimulus Cheque once we hit 2M subs,7
1617052271,Good night from Sweden! 🇸🇪🇸🇪,8
1617052864,ETH looking better by the day.,7
1617052892,here's a quick drawing I made celebrating the 2m subscribers. 😁 we are nearly there...  I hope you like it! 🙌 https://i.redd.it/v1h0gzfv3vo61.jpg,8
1617054017,🅰🅻🅶🅾 Looking strong  ᕙᓄ(⇀‸↼‶)ᓄᕗ,8
1617056857,Only slightly more than 3 million users to go until we get 5 million. HYPE FOR 5 MILLI,7
1617057016,ALGO about to flip my old ass LTC bag,7
1617057877,I only have a little ALGO and that pretty much just for the CB APY. Should've got more.,6
1617058542,We broke 1 40 on algo!!!! Congrats,8
1617058695,"Rooting for Matic and algo holders even though I got none, I wish I had the cash to lol",7
1617058971,Yo ALGO how the hell am I supposed to get some sleep when you're acting up like this?!,7
1617008992,LTO is so hot right now,18
1617025031,"VET wants to bust its nut so bad right now. Just let it go bud, make a big green mess all over my portfolio like the dirty little hodler I am.",17
1616976540,Lemme see that VET pump,27
1616976506,"Harmony is actually a nice name, I’d name my daughter Harmony",6
1616978322,What’s everyone favorite upcoming project?,6
1616979219,"Kusama is on a war path, stopping for no man",7
1616980149,Just wanted to say thank you to anyone who has posted anything regarding teaching users about staking!,5
1616980950,Bitcoin will moon tomorrow afternoon,5
1616991544,Time for my weekly ZIL dollar cost average :),5
1616994595,IBC launches tomorrow for Cosmos. Maybe it will actually move price wise.,7
1616995449,"On the 4-hour and daily chart, eth looks really bullish. a large number of pennants are formed.",6
1616996889,"Lto, ogn and sol have helped me a lot",4
1616999499,Back to fiat farming this morning and my biggest holding HBAR is pumping. Life is good,6
1616999860,Little heatwave in the uk for the next few days  Hopefully this heats up eth to make a run,7
1617000450,Surely Kusama has to be the best performing coin over the past few months that is in the top 30. Parachain fomo,6
1617003155,Hang out on this sub\* ![gif](giphy|5zoHyCdbtm8feNkIxJ),5
1617003408,Buenos dias from Spain!,8
1617003771,[*56K Noises*](https://m.youtube.com/watch?v=aV8DEJ8ydJQ),5
1617006052,Buckle up everyone. I am making the call ![gif](giphy|jsl82uOLnCdAXBqT1O),7
1617008786,"A bit of fundamental market analysis regarding the ongoing Suez Canal issue. The boat getting grounded last tuesday has brought global trading to a bit of a halt with over 30% of cargo trade going through the canal, and now a lot of uncertainty exists in the market. When macro uncertainty appears, there is a tendency for institutions to de-risk from assets and leveraged positions and see a sell off across the board. Even if the risk is only short term, this in turn is not good for cryp... *Wait the boat is called EverGreen...Nevermind*",6
1617008970,Sellers are running out of tokens while buyers are finding more money I expect this trend will continue,7
1617009078,BTC back to 57k soon Looking to 60k and above,5
1617009666,"VISA now settling with USDC, let's fucking go. Now just need tether to die and be replaced by UST, and I can be happy with the world",5
1617010071,"For a historic red month, we're set to end March quite bullish, we'd have to drop tons the next 2 days for us to even end this month neutral. ^pleasedontjinxit",6
1617010121,I feel like we are at the start of a huge new leg up,6
1617010257,Matic making some moves..,6
1617010468,Visa settling on ETH 🤝  That’s bullish,6
1617010791,"I feel like Ethereum is about to really rocket up in the coming weeks when people and traders start to realize how close layer 2 scaling, ETH burning with EIP-1559, lower fees on layer 1 and extremely low fees on layer 2 dapps like uniswap is. The coming weeks and months are going to be so exciting for Ethereum. 🚀",5
1617011766,2 Million Subs and new ATHs gonna be a good day. People are gonna Fomo hard.,6
1617011811,Bitcoin now kind of reminds me of a kid trying to run fast but you can’t stop him so you just have to hope that he wont trip.,6
1617012141,perfectly on track for a 6 figure BTC by Q3,7
1617012182,Come on ETH rebel like an angsty teen against BTC,5
1617012333,It would be great to see ETH hit 2k again,7
1617012698,Can someone tell me what this LTO hype is about?,6
1617013269,"The atom deserves a hefty move, come on!",5
1617013457,"This VISA announcement couldnt have come at a better time IMO.  Futures out of the way, March nearly done.....big April planned",6
1617013612,![gif](giphy|jsl82uOLnCdAXBqT1O),7
1617014710,Anyone feels addicted to DCA into crypto? Buying a new bike? Nope can invest into crypto. Buy a new laptop? Nope can DCA into crypto. Sometimes I feel like I live like a hermit just to DCA. Am I the only one?,7
1617015208,Lol just tried to enter a 4x long leverage position for ETH after the news and there was insufficient margin. Bullish 😅,5
1617015730,One coin to rule them all?,7
1617015922,Atom finally heard me crying non stop. Yess! A little bit more come on baby🎰,6
1617016314,Moons back at 6.9c ![gif](giphy|3i4Prsb5uTZArI7fI4),6
1617016831,ETH/BTC ratio can seriously go fuck itself.,5
1617017167,"Morning America,  please play nice 😃",6
1617018033,![gif](emote|eth2_emote|eth2),5
1617018179,LTO or ONE? Have a couple hundred bucks to spend.,6
1617019220,Gold Coast Australia signing out 😊 Take it easy,7
1617021192,Missed the dip cos pay wasn’t in. Now Eth is up and my pay still isn’t in 🥲,4
1617021284,I know its a running joke now but XLM is genuinely puzzling me. What is it with 0.4 that it seemingly cannot overcome? Are people selling every time it hits 0.4 and keeping it there? Seems like no matter what the market does it always returns to that price.,6
1617021740,Y’all ready for 6 figures?,6
1617022176,Go XMR!,7
1617022810,"The atom deserves a large move, come on!",5
1617023262,"Holding ETH, ADA, ATOM, LTO & BTC.    All roughly equal in holdings.    How does it look?",6
1617023577,HODLING is a lifestyle,6
1617024333,I decided about 2 weeks ago I wouldn't be putting any more fiat in and it's really freeing. I have a lot less anxiety and FOMO now,5
1617024499,STACKING up on ZIL rn. Love it,7
1617024765,Anyone here invested in Avalance (AVAX)?,7
1617024882,The only fiat I have left is for bills.  All in crypto otherwise.  Let's gooooo.,7
1617025668,The boat in the Suez Canal is finally free!,5
1617026072,"New portfolio ATH. Thank you ATMOS, LTO and SLT.",5
1617026079,This is a lesson for those paper-mache boys who sold at 53K,6
1617026104,AAVE x Polygon announcement incoming soon....,6
1617027922,"The Governor of Texas, @GregAbbott_TX, says he supports legislation for protecting the use of #Bitcoin  similar to Wyoming's laws. [source1](https://twitter.com/documentingbtc/status/1376537920908242946?s=21) United States are falling like dominos for Bitcoin one state at a time.",7
1617028025,LINK gonna shoot past 31 this week.,5
1617029803,Year-to-date asset performance: + 100%   :    #Bitcoin  🚀  +   25%   :     Crude Oil +     6%   :     S&P500 +     3%   :     Dollar Index +     2%.  :     Nasdaq -      -6%   :     US 10-year Treasury -      -9%.  :     Gold [source](https://twitter.com/krakenfx/status/1376544781002739714?s=21),6
1617031155,This youtubers are really milking this 5$ ADA thumbnails,7
1617031926,HOT just throwing up double dildos today,7
1617032866,"The day that XLM breaks $1.00, people in the daily will go more crazy than when BTC broke $50k.      Change my mind.",6
1617034328,Green: Happy people cheering for random letters and spreading love. Red: I really like the project.,5
1617035111,Woah LINK actually moving a bit,6
1617035180,Everything is up for me today! Have a good one lads :),6
1617035519,LINK lift off 🚀,6
1617036167,"Algo $35 by 2032, based on nothing besides I want it to happen.",7
1617037345,"If you don’t have any moons, reply and I’ll give you some.",7
1617037592,Nice to see ETH going up,7
1617037869,"ETH breaking out, looking very strong, great to see.",6
1617038031,Buying a Nemanja Matic jersey if Matic hits $2 this cycle.,7
1617038349,Btc's momentum in the last 72 hours looks very stable,6
1617038647,I have 1k worth eth. Should i sell half of it and buy lto?,6
1617038728,"Hi ETH, looks like you're awake from your slumber!",6
1617038739,I am really frustrated. The VISA news is about USDC but it isn't pumping on this good news! /s,6
1617038753,"Holy shittttt, instead of just saying “Bitcoin or Blockchain” they actually put Ethereum on the Reuters article.  Bout fucking time",7
1617038828,price discovery once eth holds above 2k,6
1617038968,ETH is making me hard af Who's watching the BenCow live show?,5
1617039121,"Congrats to all my fellow crypto hodlers, we’re in it for the long haul",7
1617039202,Crypto up while stonks are down. You love to see it.,6
1617039210,[deleted],6
1617039307,I never doubted u ETH!,6
1617039389,"Oh boyyy, we are hitting 2MIL and love is in the air  🥰🥰🥰",6
1617039420,"Early days yet, but ETH is a good boy.",6
1617039529,  ETH ready to tear through $2k 🚀🚀,6
1617039779,ETH boys assemble,6
1617040090,Is today the real Valentine's Day? Lol,5
1617040523,If ONE hits 1 euro I’ll be able to buy a new couch 😎,6
1617040549,I'm liking the charts on ETH atm!,6
1617040650,"MATIC making me proud rn, keep pumping",7
1617041066,Around 1 month in and up 15%! I'm loving it!,5
1617041151,This guy is my hero. He bought the [dip!](https://news.bitcoin.com/wife-leaves-husband-after-he-refused-to-sell-bitcoin-at-60k-and-bought-the-dip/),6
1617041178,"Eth not bleeding against BTC during price surge, wut is this",6
1617041195,"ETH, my hero. This is all Visa, boys and girls",7
1617041341,I can give an award Who wants it?,6
1617041394,Becoming harder and harder to find comfortable entries for day traders.  The bull trend is strong.,7
1617041974,"Today’s random act of generosity is insane , is it Visa news or because we’re approaching April so BTC goes straight to 100k ?!",6
1617042355,Eth gaining and BTC staying stagnant is real nice for the ratio. Gotta feeling ETH is aiming for that ATH,6
1617042554,Suez canal ship was blocking our prices from going up lol seriously though it’s nice seeing the daily happy instead of all doom and gloom like end of last week,5
1617042789,I'm in the new ATH portfolio club today! Woot woot!,6
1617042811,"Hey ETH... oh, so youre a rock-climber now? What a pleasant thing to wake up to.",5
1617043089,Seems like we are into full blown altseason! 🎉🎉🎉🥂,6
1617043315,ALGO MOLTO BUONO!,5
1617043323,Almost 3am... nights all!  Enjoy your greens & have a wonderful wonderful day! ❤️,7
1617043516,"I kept on buying what I could when ETH dropped, patting myself on the back now.",6
1617043629,I am now breaking even on ALGO after buying at the top and averaging down,5
1617044012,What a good day for /r/CryptoCurrency/   We will get 2m members today.  Everyone is greener than the greenest trees.  :)  Way to go peeps. <3,7
1617046011,"Today was an good day.. I have an Silver Award to give, tell me yor biggest crypto regret!",6
1617046933,VET or ETH for short-midterm?,6
1617047909,What a day boys!! 🚀🚀🚀,7
1617048075,Daily ORN shill to remind you that mainnet and the terminal launches on Wednesday,7
1617048545,Good morning everyone! May the rest of your week be all green! ![gif](giphy|P2BUP6kPlJmO4),7
1617049492,April = Green Market // Hope everyone has an amazing month in April ![gif](emote|rocketflyingup_emote|rocketflyingup),6
1617049555,Eth better start hitting 2k so I could cover up the fees coinbase gave me 🤬😡🤬,5
1617050158,Btc 60k eth 2k or this sub 2m,5
1617051482,How are US people buying LTO?,5
1617051553,Storj a decent buy on this dip? Looks like it’s settling comfy above 2.60,6
1617052632,"Currently 100% BTC at the minute.  I've been thinking of diversifying into some other projects to build a proper portfolio and currently have my eye on ETH, LINK, VET, GRT and UNI. But would diversifying at this stage be worth it as the market seems to follow BTC anyway?",6
1617053937,"Someone please shill me a hidden gem with MC below 300m? Already got VET, TRAC, LTO and ONE.",5
1617054040,While I still haven’t hit that desired “moon” level of gains to retire upon.... crypto has made it possible for me to live comfortably and rarely worry over unexpected large expenses. Thank you crypto.,5
1617054115,"good night from Latvia, don’t do anything stupid while I’m asleep, thanks ❤️",5
1617054133,Why should I be bullish on ZIL? Convince me babies,6
1617054133,Is Ankr making a “cup and handle” or a “bull flag”?  You be the judge. Let’s hear it.,6
1617056941,The day we can all use Uniswap without paying hundreds of dollars in fees will be a glorious day. I think that day is close.,5
1617057131,How high can ALGO go!,6
1617058451,Finally narrowed down my portfolio to just 5 crypto I really believe in. Feels better❤️,5
1617058742,MATIC is doing well,6
1617058981,Damn ALGO. Look at you with your fine self.,7
1617059034,Thank you algo,7
1617059071,Set buy orders for LTO overnight but I guess it refuelled midair,6
1617059575,Goodnight folks🌝,5
1617059707,I have this weird feeling that XLM is about to pump in approx 2 hours,6
1617013066,"Anyone else quit their job because they made life changing crypto profits?  I'm just working my notice period now, and I'll be free by the summer.  Feels good, knowing there's light at the end of the tunnel.",15
1617039921,Imagine not being bullish on Ethereum.,16
1616976374,Let's see what this week has to bring for LTO and ONE,15
1616977531,"LTO $0.90 is incoming, brace and enjoy the ride! 🚀",15
1616985091,"I believe it was George Washington who said while crossing the Delaware ""Gentlemen...buy high, buy low...just hodl.""",16
1617053452,Almost got 600 moons last month. An admirable amount. This month I plan to kick the shitposting into overdrive and get over 1000. 34 upvotes a day let's do this 💪🏼,16
1617015617,"Visa will use Ethereum! Layer 2 becoming widely available with any smart contract, ETH 2.0 merging with ETH 1, staking with Rocketpool, defi, nfts, decentralisation with >100k validators in ETH 2.0, ... Ethereum looks super bullish!",33
1617003322,Is it weird that I dont want to work at a job? Im a teen right now and my end game is to earn enough money to live with staking rewards,14
1617020967,LTO is really out here 😳🥳🎉,15
1617061401,I am happy for all the ALGO holders 🤝🤗🆙,14
1617048069,Just got my first full ETH 😊🚀 Been chipping away for 3 months now and so pumped to have finally got it 👌,22
1616987482,Imagine ending your weekend by coming into the cryptocurrency subreddit and downvoting everything in the daily discussion thread. I feel bad for whoever is guilty of doing this,32
1616976081,Thank you Algo very cool,5
1616976308,"GRT seems slept on by this sub, esp last week when it was 1.40",5
1616976699,What’s going to be the top gainer this week?,5
1616978132,"Good god, ONE just going to fucking town again",4
1616980701,GRT has been pumping today!,4
1616982249,I am going to do something this week. i have full confidence 🚀,5
1616991168,How does one find out the exact dates for upcoming coin base listings,4
1616992091,[deleted],5
1616992105,"Nfts is booming again, baby!",6
1616992949,"Just sitting patiently, waiting for another btc breakout. First comment gets a silver.",4
1616993253,I have a feeling April is going to be a great month for crypto.,3
1616993480,Watching arrested development and checking charts. Not a bad way to spend a Sunday night,6
1616993621,Well I’m off to sleep here’s to waking up to lots of green take care good night,5
1616995816,"I have a question about ATOM inflation. Since there's no cap to the amount of coins that can be created, isn't the only way to make money from it long term is to stake it forever? Is there ever an coin burn in that eco system? I know their staking accounts for the inflation, but at some point wont the inflation just render any returns useless?",4
1616996735,Any updates on the Ripple lawsuit?,5
1616996860,Feeling like it’s gonna  be a good week:),4
1616997031,Anybody here know about SLT? i swtched all of my XLM into it and it was one of the best trades ive ever done in crypto so far... has the potential to 5x,4
1616997725,XLM into LINK? stablecoin jokes aside that doesn't seem like the worst XLM outcome given what I know about what it's for. but guidance on LINK too if you may--most of what I know is the CB summary and that Cowen likes it lol,7
1616997790,"So, what is going up today? 🦆",4
1617000055,Is it still a good time to buy ONE?,5
1617000489,Ethereum's only competitor is itself - Eth2.0,6
1617001311,3am. Time to check the portfolio 😁,4
1617001672,It's weird how your mind works. I initially bought LTO at 13c then some at 20c then I felt unsure about buying some more at 30c because it was so much more than when I originally bought it. Silly me. Should have only looked at marketcap,4
1617001891,"I hold 6 different coins (not counting free stuff from Coinbase and CoinMarketCap Earn). All of them are green the past 24 hours, sometimes you're just lucky i guess!",5
1617002814,"Good morning from Latvia, how’s everyone feeling?🤠📈",4
1617003977,Few people understand that certain applications on Ethereum are unstoppable. Even their creators can't stop them.  Ethereum is permissionless.,6
1617004007,"How about some new ATHs today? If bitcoin is sleeping, altcoins will deliver.",6
1617004638,Fresh pancakes in the morning boys and girls!,4
1617005564,Someone help me understand the uniqueness of LTO. Is it decentralised? Do they have real companies already using the hybrid chain? GDPR compliant means that it has inbound ID/privacy management?,5
1617006495,XLM gang rise up,4
1617006772,BTC and ETH in an ascending triangle. We are about to have a significant move up if we get some volume.,5
1617007004,LTO 0.78 now,4
1617007016,I rarely hear IOTA being discussed here. I know they have had a lot of problems but what do people think about IOTA in the future?,5
1617008142,Bet on VET,5
1617008374,"OF COURSE. Always wanted to start stacking HBAR but waiting for fiat payday, the entire week Hbar was sideways...and the day i can finally buy a stack, guess what? IT PUMPS. **MYSTERIES OF THE  CRYPTO LANDS......** *\*que eerie music*",6
1617008617,"Holy shit boys , everything pumping 😳",6
1617008685,ANkR wat-ch out.,6
1617009153,![gif](giphy|dtCIWvRsOKL6BgOYUh|downsized),4
1617009211,how is no one talking about HBAR?,4
1617009365,New Portfolio ATH 🚀🚀🚀,4
1617009627,Finally ONE paying out as before. Hold,5
1617009736,"Almost to 2 000 000 subscribers in /r CC! Not only cryptos are mooning, but the community as well. Good job, fellas!",5
1617010776,ETH has finally got me excited.,5
1617010795,A 30 minute Cowen video on Ethereum? Don’t mind if I do!,5
1617010997,Today is a BIG day,6
1617011102,Visa moves to allow payment settlements using the Ethereum blockchain!!! 💪💪💪  https://i.imgur.com/f7nAI0i.png,5
1617011247,BASED VISA,5
1617011541,And to think... I thought I might sleep.,6
1617011605,58k 🥳🥳,4
1617011636,XLM blink twice if your concious,5
1617011692,"Pretending to need the toilet at work so I can sit and watch the green candles for 5 minutes. Need the dopamine, it's been too long!",6
1617011793,"Big BTC, what are you doooin?",5
1617013569,It’s Green Day! ![gif](giphy|3ohs7PrePDURxvHm80|downsized),6
1617015442,Matic just tweeted there live on a new exchange...and weeeeee there goes that green candle,4
1617015461,73k Bitcoin soon,4
1617015570,I love this everyone is happy and i just checked the moon price.. i love my moons =),5
1617015770,VTHO having a go for it,5
1617015921,"USA is barely awake rn, were riding that 🚀🚀🚀",5
1617016366,Chainlink finally moving a bit. Portfolio ATH may be achievable today.,5
1617016676,Crypto 2T market cap end of the week?,4
1617016710,"Is Polkadot worth a gamble at this stage? I see Kraken give 12% for Polkadot staking, which isn't bad.",5
1617016710,MATIC you dirty slut you,6
1617016808,"I almost sell ETH yesterday after thinking about the delays on Eth2, gladfully I didn't because I got stuck deciding what to take in that case",6
1617017498,finally eths turn to pump,4
1617017600,Is it worth staking a coin if you lose 1/3rd of your coins by transferring to stake them?,5
1617018215,matic paaaamping,5
1617019170,"If you need a summary of today's news then just picture Mike Tyson saying ""Visa"" (vETHsa)",6
1617019373,Usdc to $2!!!!,6
1617019690,Yes HBAR do that thing 🚀🚀,6
1617022311,Nice to wake up to good news on a Monday instead of dreading the week with my actual adult problems.,6
1617022315,"Thank you, coins. You're doing great ❤",5
1617022474,ETH pumping more than BNB for once noice,6
1617022589,Any Canadians here?,6
1617022692,"What is the fastest and cheapest way to transfer coins from an exchange to another? In the past I used NANO, which was basically free and instant. Unfortunately my exchange doesn't have NANO at the moment. I tried with EOS, it was fast(1 minute maybe) but the fees weren't the best.",5
1617022853,I think this is the best monday ever lol,5
1617023230,So where can I get this Visa coin I've been hearing so much about?,4
1617023304,Hi guys wen moon? wen lambo?,6
1617023439,And were almost back to where we were at last week...almost.,4
1617023775,"Drinking a shot of rum every time I hear the USDC joke, wish me luck guys",4
1617024475,We have all become dependent on the endorphin boost from looking at our portfolios.,5
1617024745,"Forgive me, Lord, for I have FOMO'd.",5
1617025474,Hear me out... After seeing the Kusama price action I’m so very bullish on $DOT. In the last month Kusama has gone up by 144%! Polkadot normally follows the Kusama price action historically. An $80 $DOT looks like a bargain at current prices. Don’t you think?,4
1617026552,"Alright VET passengers, today is the day. Prepare for liftoff, the thrusters have started.",4
